2013;Ana Moreira,Paul Grünbacher;RE 2013 doctoral symposium.;http://dx.doi.org/10.1109/RE.2013.6636759;380;1;Doctoral Symposium;
2013;David G. Gordon;The regulatory world and the machine: Harmonizing legal requirements and the systems they affect.;http://dx.doi.org/10.1109/RE.2013.6636760;381-384;4;Doctoral Symposium;
2013;Sunil Nair;Evidence management for evolutionary safety assurance and certification.;http://dx.doi.org/10.1109/RE.2013.6636761;385-388;4;Doctoral Symposium;
2013;Sandeep Reddivari;Visual analytics for software requirements engineering.;http://dx.doi.org/10.1109/RE.2013.6636762;389-392;4;Doctoral Symposium;
2013;George Valença;Requirements negotiation model: A social oriented approach for software ecosystems evolution.;http://dx.doi.org/10.1109/RE.2013.6636763;393-396;4;Doctoral Symposium;
2012;Rick Salay,Marsha Chechik,Jennifer Horkoff;Managing requirements uncertainty with partial models.;http://dx.doi.org/10.1109/RE.2012.6345804;1-10;10;Handling Uncertainty;
2012;Hui Yang 0004,Anne N. De Roeck,Vincenzo Gervasi,Alistair Willis,Bashar Nuseibeh;Speculative requirements: Automatic detection of uncertainty in natural language requirements.;http://dx.doi.org/10.1109/RE.2012.6345795;11-20;10;Handling Uncertainty;
2012;Silky Arora,Prahladavaradan Sampath,S. Ramesh;Resolving uncertainty in automotive feature interactions.;http://dx.doi.org/10.1109/RE.2012.6345807;21-30;10;Handling Uncertainty;
2012;Wei-Keat Kong,Jane Huffman Hayes,Alex Dekhtyar,Olga Dekhtyar;Process improvement for traceability: A study of human fallibility.;http://dx.doi.org/10.1109/RE.2012.6345824;31-40;10;Requirements Processes;
2012;David Ameller,Claudia P. Ayala,Jordi Cabot,Xavier Franch;How do software architects consider non-functional requirements: An exploratory study.;http://dx.doi.org/10.1109/RE.2012.6345838;41-50;10;Requirements Processes;
2012;Willem Bekkers,Sjaak Brinkkemper,Lucas van den Bemd,Frederik Mijnhardt,Christoph Wagner,Inge van de Weerd;Evaluating the Software Product Management Maturity Matrix.;http://dx.doi.org/10.1109/RE.2012.6345839;51-60;10;Requirements Processes;
2012;Eya Ben Charrada,Anne Koziolek,Martin Glinz;Identifying outdated requirements based on source code changes.;http://dx.doi.org/10.1109/RE.2012.6345840;61-70;10;Requirements Management and Tracing 1;
2012;Orlena Gotel,Jane Cleland-Huang,Jane Huffman Hayes,Andrea Zisman,Alexander Egyed,Paul Grünbacher,Giuliano Antoniol;The quest for Ubiquity: A roadmap for software and systems traceability research.;http://dx.doi.org/10.1109/RE.2012.6345841;71-80;10;Requirements Management and Tracing 1;
2012;Nan Niu,Anas Mahmoud;Enhancing candidate link generation for requirements tracing: The cluster hypothesis revisited.;http://dx.doi.org/10.1109/RE.2012.6345842;81-90;10;Requirements Management and Tracing 1;
2012;David G. Gordon,Travis D. Breaux;Reconciling multi-jurisdictional legal requirements: A case study in requirements water marking.;http://dx.doi.org/10.1109/RE.2012.6345843;91-100;10;Legal and Regulatory Requirements;
2012;Jeremy C. Maxwell,Annie I. Antón,Peter P. Swire;Managing changing compliance requirements by predicting regulatory evolution.;http://dx.doi.org/10.1109/RE.2012.6345793;101-110;10;Legal and Regulatory Requirements;
2012;Mazeiar Salehie,Liliana Pasquale,Inah Omoronyia,Raian Ali,Bashar Nuseibeh;Requirements-driven adaptive security: Protecting variable assets at runtime.;http://dx.doi.org/10.1109/RE.2012.6345794;111-120;10;RE@Runtime;
2012;Lingxiao Fu,Xin Peng,Yijun Yu,John Mylopoulos,Wenyun Zhao;Stateful requirements monitoring for self-repairing socio-technical systems.;http://dx.doi.org/10.1109/RE.2012.6345796;121-130;10;RE@Runtime;
2012;Thein Than Tun,Arosha K. Bandara,Blaine A. Price,Yijun Yu,Charles B. Haley,Inah Omoronyia,Bashar Nuseibeh;Privacy arguments: Analysing selective disclosure requirements for mobile applications.;http://dx.doi.org/10.1109/RE.2012.6345797;131-140;10;RE@Runtime;
2012;Li Yi,Wei Zhang 0004,Haiyan Zhao,Zhi Jin,Hong Mei;Mining binary constraints in the construction of feature models.;http://dx.doi.org/10.1109/RE.2012.6345798;141-150;10;Feature Models;
2012;Pourya Shaker,Joanne M. Atlee,Shige Wang;A feature-oriented requirements modelling language.;http://dx.doi.org/10.1109/RE.2012.6345799;151-160;10;Feature Models;
2012;Joel Greenyer,Amir Molzam Sharifloo,Maxime Cordy,Patrick Heymans;Efficient consistency checking of scenario-based product-line specifications.;http://dx.doi.org/10.1109/RE.2012.6345800;161-170;10;Feature Models;
2012;Anne Gross,Jörg Dörr;What you need is what you get!: The vision of view-based requirements specifications.;http://dx.doi.org/10.1109/RE.2012.6345801;171-180;10;Requirements Communication;
2012;Ali Niknafs,Daniel M. Berry;The impact of domain knowledge on the effectiveness of requirements idea generation during requirements elicitation.;http://dx.doi.org/10.1109/RE.2012.6345802;181-190;10;Requirements Communication;
2012;Alessio Ferrari,Stefania Gnesi;Using collective intelligence to detect pragmatic ambiguities.;http://dx.doi.org/10.1109/RE.2012.6345803;191-200;10;Requirements Communication;
2012;Antoine Cailliau,Axel van Lamsweerde;A probabilistic framework for goal-oriented risk analysis.;http://dx.doi.org/10.1109/RE.2012.6345805;201-210;10;Goal Modeling;
2012;Robyn R. Lutz,Jack H. Lutz,James I. Lathrop,Titus H. Klinge,Divita Mathur,Donald M. Stull,Taylor Bergquist,Eric R. Henderson;Requirements analysis for a product family of DNA nanodevices.;http://dx.doi.org/10.1109/RE.2012.6345806;211-220;10;Goal Modeling;
2012;Sotirios Liaskos,Rina Jalman,Jorge Aranda;On eliciting contribution measures in goal models.;http://dx.doi.org/10.1109/RE.2012.6345808;221-230;10;Goal Modeling;
2012;Jane Cleland-Huang,Patrick Mäder,Mehdi Mirakhorli,Sorawit Amornborvornwong;Breaking the big-bang practice of traceability: Pushing timely trace recommendations to project stakeholders.;http://dx.doi.org/10.1109/RE.2012.6345809;231-240;10;Requirements Management and Tracing 2;
2012;Arbi Ghazarian;Characterization of functional software requirements space: The law of requirements taxonomic growth.;http://dx.doi.org/10.1109/RE.2012.6345810;241-250;10;Requirements Management and Tracing 2;
2012;Eric Knauss,Daniela Damian,Germán Poo-Caamaño,Jane Cleland-Huang;Detecting and classifying patterns of requirements clarifications.;http://dx.doi.org/10.1109/RE.2012.6345811;251-260;10;Requirements Management and Tracing 2;
2012;Andrey Maglyas,Uolevi Nikula,Kari Smolander;What do practitioners mean when they talk about product management?;http://dx.doi.org/10.1109/RE.2012.6345812;261-266;6;Product Management Concerns;
2012;Rasha Tawhid,Edna Braun,Nick Cartwright,Mohammad Alhaj,Gunter Mussbacher,Azalia Shamsaei,Daniel Amyot,Saeed Ahmadi Behnam,Gregory Richards;Towards outcome-based regulatory compliance in aviation security.;http://dx.doi.org/10.1109/RE.2012.6345813;267-272;6;Product Management Concerns;
2012;Yuri Chernak;Requirements Composition Table explained.;http://dx.doi.org/10.1109/RE.2012.6345814;273-278;6;Aspect Oriented RE;
2012;Xiping Song,Beatrice Hwong;Categorizing requirements for a contract-based system integration project.;http://dx.doi.org/10.1109/RE.2012.6345815;279-284;6;Aspect Oriented RE;
2012;Brian Berenbach,Florian Schneider,Helmut Naughton;The use of a requirements modeling language for industrial applications.;http://dx.doi.org/10.1109/RE.2012.6345816;285-290;6;Natural Language vs. Formalized Specification;
2012;Daniel Ott;Defects in natural language requirement specifications at Mercedes-Benz: An investigation using a combination of legacy data and expert opinion.;http://dx.doi.org/10.1109/RE.2012.6345817;291-296;6;Natural Language vs. Formalized Specification;
2012;Odorico Machado Mendizabal,Martin Spier,Rodrigo Saad;Log-based approach for performance requirements elicitation and prioritization.;http://dx.doi.org/10.1109/RE.2012.6345818;297-302;6;Prioritization;
2012;Nupul Kukreja,Barry W. Boehm,Sheetal Swaroop Payyavula,Srinivas Padmanabhuni;Selecting an appropriate framework for value-based requirements prioritization.;http://dx.doi.org/10.1109/RE.2012.6345819;303-308;6;Prioritization;
2012;Dagny Hauksdottir,Arne Vermehren,Juha Savolainen;Requirements reuse at Danfoss.;http://dx.doi.org/10.1109/RE.2012.6345820;309-314;6;Prioritization;
2012;David Ameller,Oriol Collell,Xavier Franch;ArchiTech: Tool support for NFR-guided architectural decision-making.;http://dx.doi.org/10.1109/RE.2012.6345821;315-316;2;Posters and Tool Demonstrations;
2012;Li Yi,Haiyan Zhao,Wei Zhang 0004,Zhi Jin;CoFM: An environment for collaborative feature modeling.;http://dx.doi.org/10.1109/RE.2012.6345822;317-318;2;Posters and Tool Demonstrations;
2012;Daniel Amyot,Stéphane Leblanc,Jason Kealey,Jörg Kienzle;Concern-driven development with jUCMNav.;http://dx.doi.org/10.1109/RE.2012.6345823;319-320;2;Posters and Tool Demonstrations;
2012;Michal Smialek,Tomasz Straszak;Facilitating transition from requirements to code with the ReDSeeDS tool.;http://dx.doi.org/10.1109/RE.2012.6345825;321-322;2;Posters and Tool Demonstrations;
2012;Dustin Wüest,Norbert Seyff,Martin Glinz;Flexible, lightweight requirements modeling with Flexisketch.;http://dx.doi.org/10.1109/RE.2012.6345826;323-324;2;Posters and Tool Demonstrations;
2012;Long Li,Haiyan Zhao,Wei Zhang 0004;MbFM: A matrix-based tool for modeling and configuring feature models.;http://dx.doi.org/10.1109/RE.2012.6345827;325-326;2;Posters and Tool Demonstrations;
2012;Sandeep Reddivari,Zhangji Chen,Nan Niu;ReCVisu: A tool for clustering-based visual exploration of requirements.;http://dx.doi.org/10.1109/RE.2012.6345828;327-328;2;Posters and Tool Demonstrations;
2012;Kristopher Welsh,Nelly Bencomo;Run-time model evaluation for requirements model-driven self-adaptation.;http://dx.doi.org/10.1109/RE.2012.6345829;329-330;2;Posters and Tool Demonstrations;
2012;Elda Paja,Fabiano Dalpiaz,Mauro Poggianella,Pierluigi Roberti,Paolo Giorgini;STS-tool: Socio-technical Security Requirements through social commitments.;http://dx.doi.org/10.1109/RE.2012.6345830;331-332;2;Posters and Tool Demonstrations;
2012;Sam Supakkul,Lawrence Chung;The RE-Tools: A multi-notational requirements modeling toolkit.;http://dx.doi.org/10.1109/RE.2012.6345831;333-334;2;Posters and Tool Demonstrations;
2012;Mira Vrbaski,Dorina C. Petriu,Daniel Amyot;Tool support for combined rule-based and goal-based reasoning in Context-Aware systems.;http://dx.doi.org/10.1109/RE.2012.6345832;335-336;2;Posters and Tool Demonstrations;
2012;Assia Alexandrova;Business requirements analysis and development for legacy system replacement projects in government organizations.;http://dx.doi.org/10.1109/RE.2012.6345833;337-340;4;Doctoral Symposium;
2012;Axel Hoffmann;A Pattern-based approach for analysing requirements in socio-technical systems engineering.;http://dx.doi.org/10.1109/RE.2012.6345834;341-344;4;Doctoral Symposium;
2012;Alessia Knauss;On the usage of context for requirements elicitation: End-user involvement in IT ecosystems.;http://dx.doi.org/10.1109/RE.2012.6345835;345-348;4;Doctoral Symposium;
2012;Norman Riegel;Model-based prioritization in business-process-driven software development.;http://dx.doi.org/10.1109/RE.2012.6345836;349-352;4;Doctoral Symposium;
2012;Irina Todoran;StakeCloud: Stakeholder requirements communication and resource identification in the cloud.;http://dx.doi.org/10.1109/RE.2012.6345837;353-356;4;Doctoral Symposium;
2011;Prahladavaradan Sampath,Silky Arora,S. Ramesh;Evolving specifications formally.;http://dx.doi.org/10.1109/RE.2011.6051651;5-14;10;Research Session 1:Requirements in Motion (1/2);
2011;Neil A. Ernst,Alexander Borgida,Ivan Jureta;Finding incremental solutions for evolving requirements.;http://dx.doi.org/10.1109/RE.2011.6051656;15-24;10;Research Session 1:Requirements in Motion (1/2);
2011;Sharon McGee,Des Greer;Software requirements change taxonomy: Evaluation by case study.;http://dx.doi.org/10.1109/RE.2011.6051641;25-34;10;Research Session 1:Requirements in Motion (1/2);
2011;Elizabeth Bjarnason,Krzysztof Wnuk,Björn Regnell;Requirements are slipping through the gaps - A case study on causes & effects of communication gaps in large-scale software development.;http://dx.doi.org/10.1109/RE.2011.6051639;37-46;10;Research Session 2:Empirical Studies;
2011;Sabrina Marczak,Daniela Damian;How interaction between roles shapes the communication structure in requirements-driven collaboration.;http://dx.doi.org/10.1109/RE.2011.6051643;47-56;10;Research Session 2:Empirical Studies;
2011;Marko Komssi,Marjo Kauppinen,Harri Töhönen,Laura Lehtola,Alan M. Davis;Integrating analysis of customers' processes into roadmapping: The value-creation perspective.;http://dx.doi.org/10.1109/RE.2011.6051662;57-66;10;Research Session 2:Empirical Studies;
2011;Richard Berntsson-Svensson,Tony Gorschek,Björn Regnell,Richard Torkar,Ali Shahrokni,Robert Feldt,Aybüke Aurum;Prioritization of quality requirements: State of practice in eleven companies.;http://dx.doi.org/10.1109/RE.2011.6051652;69-78;10;Research Session 3:Prioritization and Optimization;
2011;William Heaven,Emmanuel Letier;Simulating and optimising design decisions in quantitative goal models.;http://dx.doi.org/10.1109/RE.2011.6051653;79-88;10;Research Session 3:Prioritization and Optimization;
2011;Varsha Veerappa,Emmanuel Letier;Understanding clusters of optimal solutions in multi-objective decision problems.;http://dx.doi.org/10.1109/RE.2011.6051654;89-98;10;Research Session 3:Prioritization and Optimization;
2011;Rehan Rauf,Michal Antkiewicz,Krzysztof Czarnecki;Logical structure extraction from software requirements documents.;http://dx.doi.org/10.1109/RE.2011.6051638;101-110;10;Research Session 4:Traceability and Documentation;
2011;Alex Dekhtyar,Olga Dekhtyar,Jeff Holden,Jane Huffman Hayes,David Cuddeback,Wei-Keat Kong;On human analyst performance in assisted requirements tracing: Statistical analysis.;http://dx.doi.org/10.1109/RE.2011.6051649;111-120;10;Research Session 4:Traceability and Documentation;
2011;Orlena Gotel,Stephen J. Morris;Out of the labyrinth: Leveraging other disciplines for requirements traceability.;http://dx.doi.org/10.1109/RE.2011.6051655;121-130;10;Research Session 4:Traceability and Documentation;
2011;Xavier Franch,Alejandro Maté,Juan Trujillo,Carlos Cares;On the joint use of i;http://dx.doi.org/10.1109/RE.2011.6051642;133-142;10;Research Session 5:Modelling and Analysis;
2011;Naoyasu Ubayashi,Yasutaka Kamei,Masayuki Hirayama,Tetsuo Tamai;A context analysis method for embedded systems - Exploring a requirement boundary between a system and its context.;http://dx.doi.org/10.1109/RE.2011.6051648;143-152;10;Research Session 5:Modelling and Analysis;
2011;Amalinda Post,Jochen Hoenicke,Andreas Podelski;Vacuous real-time requirements.;http://dx.doi.org/10.1109/RE.2011.6051657;153-162;10;Research Session 5:Modelling and Analysis;
2011;Kurt Schneider;Focusing spontaneous feedback to support system evolution.;http://dx.doi.org/10.1109/RE.2011.6051645;165-174;10;Research Session 6:Requirements in Motion (2/2);
2011;Olesia Brill,Eric Knauss;Structured and unobtrusive observation of anonymous users and their context for requirements elicitation.;http://dx.doi.org/10.1109/RE.2011.6051660;175-184;10;Research Session 6:Requirements in Motion (2/2);
2011;Alastair Milne,Neil A. M. Maiden;Power and politics in requirements engineering: A proposed research agenda.;http://dx.doi.org/10.1109/RE.2011.6051646;187-196;10;Research Session 7:Law and Politics;
2011;Jeremy C. Maxwell,Annie I. Antón,Peter P. Swire;A legal cross-references taxonomy for identifying conflicting software requirements.;http://dx.doi.org/10.1109/RE.2011.6051647;197-206;10;Research Session 7:Law and Politics;
2011;Aaron K. Massey,Ben Smith,Paul N. Otto,Annie I. Antón;Assessing the accuracy of legal implementation readiness decisions.;http://dx.doi.org/10.1109/RE.2011.6051661;207-216;10;Research Session 7:Law and Politics;
2011;Bihuan Chen,Xin Peng,Yijun Yu,Wenyun Zhao;Are your sites down? Requirements-driven self-tuning for the survivability of Web systems.;http://dx.doi.org/10.1109/RE.2011.6051650;219-228;10;Research Session 8:Failure and Risk Management;
2011;Camilo Fitzgerald,Emmanuel Letier,Anthony Finkelstein;Early failure prediction in feature request management systems.;http://dx.doi.org/10.1109/RE.2011.6051658;229-238;10;Research Session 8:Failure and Risk Management;
2011;Virginia N. L. Franqueira,Thein Than Tun,Yijun Yu,Roel Wieringa,Bashar Nuseibeh;Risk and argument: A risk-based argumentation method for practical security.;http://dx.doi.org/10.1109/RE.2011.6051659;239-248;10;Research Session 8:Failure and Risk Management;
2011;Mikko Raatikainen,Tomi Männistö,Teemu Tommila,Janne Valkonen;Challenges of requirements engineering - A case study in nuclear energy domain.;http://dx.doi.org/10.1109/RE.2011.6051629;253-258;6;Industry Session 1:RE for Complex Systems;
2011;Andy J. Nolan,Silvia Abrahão,Paul C. Clements,Andy Pickard;Managing requirements uncertainty in engine control systems development.;http://dx.doi.org/10.1109/RE.2011.6051622;259-264;6;Industry Session 1:RE for Complex Systems;
2011;Daniel Dietsch,Sergio Feo Arenis,Bernd Westphal,Andreas Podelski;Disambiguation of industrial standards through formalization and graphical languages.;http://dx.doi.org/10.1109/RE.2011.6051634;265-270;6;Industry Session 1:RE for Complex Systems;
2011;Harald Vogl,Klaus Lehner,Paul Grünbacher,Alexander Egyed;Reconciling requirements and architectures with the CBSP approach in an iPhone app project.;http://dx.doi.org/10.1109/RE.2011.6051625;273-278;6;Industry Session 2:Requirements and Architecture;
2011;Kyoko Ohashi,Hidetoshi Kurihara,Yuka Tanaka,Rieko Yamamoto;A means of establishing traceability based on a UML model in business application development.;http://dx.doi.org/10.1109/RE.2011.6051631;279-284;6;Industry Session 2:Requirements and Architecture;
2011;Juan Pablo Carvallo,Xavier Franch;Requirements negotiation for multilayer system components.;http://dx.doi.org/10.1109/RE.2011.6051632;285-290;6;Industry Session 2:Requirements and Architecture;
2011;Anja Wever,Neil A. M. Maiden;What are the day-to-day factors that are preventing business analysts from effective business analysis?;http://dx.doi.org/10.1109/RE.2011.6051624;293-298;6;Industry Session 3:Our Profession;
2011;Bernd Waldmann;There's never enough time: Doing requirements under resource constraints, and what requirements engineering can learn from agile development.;http://dx.doi.org/10.1109/RE.2011.6051626;301-305;5;Industry Session 4:RE Efficiency;
2011;Stefan Pühl,Ralf Fahney;"How to assign cost to ""avoidable requirements creep"": A step towards the waterfall's agilization.";http://dx.doi.org/10.1109/RE.2011.6051623;307-312;6;Industry Session 4:RE Efficiency;
2011;Ekaterina Boutkova,Frank Houdek;Semi-automatic identification of features in requirement specifications.;http://dx.doi.org/10.1109/RE.2011.6051627;313-318;6;Industry Session 4:RE Efficiency;
2011;Alistair Sutcliffe;Emotional requirements engineering.;http://dx.doi.org/10.1109/RE.2011.6051680;321-322;2;Mini-Tutorials;
2011;Björn Regnell;Large-scale feature evolution: Problems and solutions from the mobile domain.;http://dx.doi.org/10.1109/RE.2011.6051681;323;1;Mini-Tutorials;
2011;Jane Cleland-Huang,Daniela Damian;Ready-set-transfer! Technology transfer in the requirements engineering domain.;http://dx.doi.org/10.1109/RE.2011.6051682;327-328;2;Panels and Debates;
2011;Pete Sawyer,Vincenzo Gervasi,Bashar Nuseibeh;Unknown knowns: Tacit knowledge in requirements engineering.;http://dx.doi.org/10.1109/RE.2011.6051683;329;1;Panels and Debates;
2011;Matthias Jarke;Design requirements: Challenges and approaches.;http://dx.doi.org/10.1109/RE.2011.6051684;331;1;Panels and Debates;
2011;Anas Mahmoud,Nan Niu;TraCter: A tool for candidate traceability link clustering.;http://dx.doi.org/10.1109/RE.2011.6051663;335-336;2;Posters & Demos;
2011;Bo Wei,Bin Yin,Zhi Jin,Didar Zowghi;rΣ: Automated reasoning tool for non-functional requirement goal models.;http://dx.doi.org/10.1109/RE.2011.6051664;337-338;2;Posters & Demos;
2011;Shamal Faily,Ivan Flechais;Eliciting usable security requirements with misusability cases.;http://dx.doi.org/10.1109/RE.2011.6051665;339-340;2;Posters & Demos;
2011;Cristina Palomares,Carme Quer,Xavier Franch;PABRE-Man: Management of a requirement patterns catalogue.;http://dx.doi.org/10.1109/RE.2011.6051666;341-342;2;Posters & Demos;
2011;Phil Greenwood,Ruzanna Chitchyan,Awais Rashid,Joost Noppen,Franck Fleurey,Arnor Solberg;Modelling adaptability and variability in requirements.;http://dx.doi.org/10.1109/RE.2011.6051667;343-344;2;Posters & Demos;
2011;Sabine Teufl,Maged Khalil,Dongyue Mou,Eva Geisberger;Experience with content-based requirements engineering assessments.;http://dx.doi.org/10.1109/RE.2011.6051668;345-346;2;Posters & Demos;
2011;Norbert Seyff,Gregor Ollmann,Manfred Bortenschlager;iRequire: Gathering end-user requirements for new apps.;http://dx.doi.org/10.1109/RE.2011.6051669;347-348;2;Posters & Demos;
2011;Isabelle Côté,Maritta Heisel,Holger Schmidt,Denis Hatebur;UML4PF - A tool for problem-oriented requirements analysis.;http://dx.doi.org/10.1109/RE.2011.6051670;349-350;2;Posters & Demos;
2011;Yijun Yu,Thein Than Tun,Alessandra Tedeschi,Virginia N. L. Franqueira,Bashar Nuseibeh;OpenArgue: Supporting argumentation to evolve secure software systems.;http://dx.doi.org/10.1109/RE.2011.6051671;351-352;2;Posters & Demos;
2011;Sotirios Liaskos,Vyacheslav Rogozhkin;Applying preference-based customization.;http://dx.doi.org/10.1109/RE.2011.6051672;353-354;2;Posters & Demos;
2011;Kristopher Welsh,Pete Sawyer,Nelly Bencomo;Run-time resolution of uncertainty.;http://dx.doi.org/10.1109/RE.2011.6051673;355-356;2;Posters & Demos;
2010;Ricardo Gacitua,Peter Sawyer,Vincenzo Gervasi;On the Effectiveness of Abstraction Identification in Requirements Engineering.;http://dx.doi.org/10.1109/RE.2010.12;5-14;10;RE;
2010;Igor Menzel,Mark Mueller,Anne Gross,Jörg Dörr;An Experimental Comparison Regarding the Completeness of Functional Requirements Specifications.;http://dx.doi.org/10.1109/RE.2010.13;15-24;10;RE;
2010;Hui Yang 0004,Anne N. De Roeck,Vincenzo Gervasi,Alistair Willis,Bashar Nuseibeh;Extending Nocuous Ambiguity Analysis for Anaphora in Natural Language Requirements.;http://dx.doi.org/10.1109/RE.2010.14;25-34;10;RE;
2010;Norbert Seyff,Florian Graf,Neil A. M. Maiden;Using Mobile RE Tools to Give End-Users Their Own Voice.;http://dx.doi.org/10.1109/RE.2010.15;37-46;10;RE;
2010;Jessica D. Young,Annie I. Antón;A Method for Identifying Software Requirements Based on Policy Commitments.;http://dx.doi.org/10.1109/RE.2010.17;47-56;10;RE;
2010;Neil A. M. Maiden,Sara Jones,Inger Kristine Karlsen,Roger Neill,Konstantinos Zachos,Alastair Milne;Requirements Engineering as Creative Problem Solving: A Research Agenda for Idea Finding.;http://dx.doi.org/10.1109/RE.2010.16;57-66;10;RE;
2010;Paul C. Clements,Len Bass;Using Business Goals to Inform a Software Architecture.;http://dx.doi.org/10.1109/RE.2010.18;69-78;10;RE;
2010;Remo Ferrari,Nazim H. Madhavji,Oliver Sudmann,Christian Henke,Jens Geisler,Wilhelm Schäfer;Requirements Engineering Decisions in the Context of an Existing Architecture: A Case Study of a Prototypical Project.;http://dx.doi.org/10.1109/RE.2010.19;79-88;10;RE;
2010;Sami Jantunen,Donald C. Gause,Ragnar Wessman;Making Sense of Product Requirements.;http://dx.doi.org/10.1109/RE.2010.20;89-92;4;RE;
2010;Peter Sawyer,Nelly Bencomo,Jon Whittle,Emmanuel Letier,Anthony Finkelstein;Requirements-Aware Systems: A Research Agenda for RE for Self-adaptive Systems.;http://dx.doi.org/10.1109/RE.2010.21;95-103;9;RE;
2010;Xin Peng,Bihuan Chen,Yijun Yu,Wenyun Zhao;Self-Tuning of Software Systems Through Goal-based Feedback Loop Control.;http://dx.doi.org/10.1109/RE.2010.22;104-107;4;RE;
2010;Nauman A. Qureshi,Anna Perini;Requirements Engineering for Adaptive Service Based Applications.;http://dx.doi.org/10.1109/RE.2010.23;108-111;4;RE;
2010;Ivan Jureta,Alexander Borgida,Neil A. Ernst,John Mylopoulos;Techne: Towards a New Generation of Requirements Modeling Languages with Goals, Preferences, and Inconsistency Handling.;http://dx.doi.org/10.1109/RE.2010.24;115-124;10;RE;
2010;Luciano Baresi,Liliana Pasquale,Paola Spoletini;Fuzzy Goals for Requirements-Driven Adaptation.;http://dx.doi.org/10.1109/RE.2010.25;125-134;10;RE;
2010;Sotirios Liaskos,Sheila A. McIlraith,Shirin Sohrabi,John Mylopoulos;Integrating Preferences into Goal Models for Requirements Engineering.;http://dx.doi.org/10.1109/RE.2010.26;135-144;10;RE;
2010;Zornitza Racheva,Maya Daneva,Klaas Sikkel,Andrea Herrmann,Roel Wieringa;Do We Know Enough about Requirements Prioritization in Agile Projects: Insights from a Case Study.;http://dx.doi.org/10.1109/RE.2010.27;147-156;10;RE;
2010;Ahmed Al-Emran,Dietmar Pfahl,Günther Ruhe;Decision Support for Product Release Planning Based on Robustness Analysis.;http://dx.doi.org/10.1109/RE.2010.28;157-166;10;RE;
2010;Samuel Fricker,Martin Glinz;Comparison of Requirements Hand-off, Analysis, and Negotiation: Case Study.;http://dx.doi.org/10.1109/RE.2010.29;167-176;10;RE;
2010;Sam Supakkul,Tom Hill,Lawrence Chung,Thein Than Tun,Julio Cesar Sampaio do Prado Leite;An NFR Pattern Approach to Dealing with NFRs.;http://dx.doi.org/10.1109/RE.2010.31;179-188;10;RE;
2010;David Ameller,Xavier Franch,Jordi Cabot;Dealing with Non-Functional Requirements in Model-Driven Development.;http://dx.doi.org/10.1109/RE.2010.32;189-198;10;RE;
2010;Ayse Morali,Roel Wieringa;Risk-based Confidentiality Requirements Specification for Outsourced IT Systems.;http://dx.doi.org/10.1109/RE.2010.30;199-208;10;RE;
