2008;Octavio Glorio,Jesús Pardillo,Jose-Norberto Mazón,Juan Trujillo;DaWaRA: An Eclipse Plugin for Usingi* on Data Warehouse Requirement Analysis.;http://dx.doi.org/10.1109/RE.2008.40;317-318;2;Posters and Tool Demos;
2008;David Callele,Eric Neufeld,Kevin Schneider;Balancing Security Requirements and Emotional Requirements in Video Games.;http://dx.doi.org/10.1109/RE.2008.45;319-320;2;Posters and Tool Demos;
2008;Neil A. Ernst,John Mylopoulos,Yijun Yu,Tien Nguyen;Supporting Requirements Model Evolution throughout the System Life-Cycle.;http://dx.doi.org/10.1109/RE.2008.11;321-322;2;Posters and Tool Demos;
2008;Steffen Lohmann,Philipp Heim,Kim Lauenroth;Web-based Stakeholder Participation in Distributed Requirements Elicitation.;http://dx.doi.org/10.1109/RE.2008.16;323-324;2;Posters and Tool Demos;
2008;Katharina Wolter,Michal Smialek,Daniel Bildhauer,Hermann Kaindl;Reusing Terminology for Requirements Specifications from WordNet.;http://dx.doi.org/10.1109/RE.2008.56;325-326;2;Posters and Tool Demos;
2008;Kizito Ssamula Mukasa,Hermann Kaindl;An Integration of Requirements and User Interface Specifications.;http://dx.doi.org/10.1109/RE.2008.55;327-328;2;Posters and Tool Demos;
2008;Patrick Mäder,Orlena Gotel,Tobias Kuschke,Ilka Philippow;traceMaintainer - Automated Traceability Maintenance.;http://dx.doi.org/10.1109/RE.2008.25;329-330;2;Posters and Tool Demos;
2008;Leonid Kof;From Textual Scenarios to Message Sequence Charts: Inclusion of Condition Generation and Actor Extraction.;http://dx.doi.org/10.1109/RE.2008.12;331-332;2;Posters and Tool Demos;
2008;Armstrong Nhlabatsi,Robin C. Laney,Bashar Nuseibeh;Building Contingencies into Specifications.;http://dx.doi.org/10.1109/RE.2008.65;333-334;2;Posters and Tool Demos;
2008;Aaron K. Massey,Paul N. Otto,Annie I. Antón;Aligning Requirements with HIPAA in the iTrust System.;http://dx.doi.org/10.1109/RE.2008.53;335-336;2;Posters and Tool Demos;
2008;Masayuki Makino,Atsushi Ohnishi;A Method of Scenario Generation with Differential Scenario.;http://dx.doi.org/10.1109/RE.2008.17;337-338;2;Posters and Tool Demos;
2008;Akos Szoke;A Proposed Method for Automated Project Scheduling using Goals and Scenarios.;http://dx.doi.org/10.1109/RE.2008.23;339-340;2;Posters and Tool Demos;
2008;Eric Knauss,Christian El Boustani;Assessing the Quality of Software Requirements Specifications.;http://dx.doi.org/10.1109/RE.2008.29;341-342;2;Posters and Tool Demos;
2008;Maria Lencastre,Ana Moreira,João Araújo 0001,Jaelson Castro;Aspects Composition in Problem Frames.;http://dx.doi.org/10.1109/RE.2008.20;343-344;2;Posters and Tool Demos;
2007;Ivar Jacobson;Enough of RE Processes- Let's Do Practices.;http://dx.doi.org/10.1109/RE.2007.6;;;Keynotes;
2007;Kris Gopalakrishnan;Requirements Engineering in a Globalized Business Environment.;http://dx.doi.org/10.1109/RE.2007.7;;;Keynotes;
2007;Anthony Finkelstein;Modelling-in-the-Large.;http://dx.doi.org/10.1109/RE.2007.8;;;Keynotes;
2007;Paul N. Otto,Annie I. Antón;Addressing Legal Requirements in Requirements Engineering.;http://dx.doi.org/10.1109/RE.2007.65;5-14;10;Visions and Innovations;
2007;Marjo Kauppinen,Juha Savolainen,Tomi Männistö;Requirements Engineering as a Driver for Innovations.;http://dx.doi.org/10.1109/RE.2007.47;15-20;6;Visions and Innovations;
2007;Martin Glinz;On Non-Functional Requirements.;http://dx.doi.org/10.1109/RE.2007.45;21-26;6;Visions and Innovations;
2007;Neil A. M. Maiden,Cornelius Ncube,Simin Kamali,Norbert Seyff,Paul Grünbacher;Exploring Scenario Forms and Ways of Use to Discover Requirements on Airports that Minimize Environmental Impact.;http://dx.doi.org/10.1109/RE.2007.48;29-38;10;Models, Process and Experience;
2007;Jorge Aranda,Steve M. Easterbrook,Greg Wilson;Requirements in the wild: How small companies do it.;http://dx.doi.org/10.1109/RE.2007.54;39-48;10;Models, Process and Experience;
2007;Neil A. M. Maiden,James Lockerbie,Debbie Randall,Sean Jones,David Bush;Using Satisfaction Arguments to Enhance i* Modelling of an Air Traffic Management System.;http://dx.doi.org/10.1109/RE.2007.14;49-52;4;Models, Process and Experience;
2007;Yijun Yu,Nan Niu,Bruno González-Baixauli,William Candillon,John Mylopoulos,Steve M. Easterbrook,Julio Cesar Sampaio do Prado Leite,Gilles Vanwormhoudt;Tracing and Validating Goal Aspects.;http://dx.doi.org/10.1109/RE.2007.23;53-56;4;Models, Process and Experience;
2007;Daniela Damian,Sabrina Marczak,Irwin Kwan;Collaboration Patterns and the Impact of Distance on Awareness in Requirements-Centred Social Networks.;http://dx.doi.org/10.1109/RE.2007.51;59-68;10;Collaboration and Quality;
2007;Mayumi Itakura Kamata,Tetsuo Tamai;How Does Requirements Quality Relate to Project Success or Failure?;http://dx.doi.org/10.1109/RE.2007.31;69-78;10;Collaboration and Quality;
2007;Chih-Wei Ho,Laurie Williams,Annie I. Antón;Improving Performance Requirements Specifications from Field Failure Reports.;http://dx.doi.org/10.1109/RE.2007.57;79-88;10;Collaboration and Quality;
2007;Vera Kartseva,Jaap Gordijn,Yao-Hua Tan;Value-based Design of Networked Enterprises Using e;http://dx.doi.org/10.1109/RE.2007.37;91-100;10;RE and Business Alignment;
2007;Jörg Dörr,Susanne Hartkopf,Daniel Kerkow,Dennis Landmann,Peter Amthor;Built-in User Satisfaction - Feature Appraisal and Prioritization with AMUSE.;http://dx.doi.org/10.1109/RE.2007.62;101-110;10;RE and Business Alignment;
2007;Alain Wegmann,Philippe Julia,Gil Regev,Olivier Perroud,Irina Rychkova;Early Requirements and Business-IT Alignment with SEAM for Business.;http://dx.doi.org/10.1109/RE.2007.12;111-114;4;RE and Business Alignment;
2007;Alexander Egyed,Paul Grünbacher,Matthias Heindl,Stefan Biffl;Value-Based Requirements Traceability: Lessons Learned.;http://dx.doi.org/10.1109/RE.2007.16;115-118;4;RE and Business Alignment;
2007;Leonid Kof;Scenarios: Identifying Missing Objects and Actions by Means of Computational Linguistics.;http://dx.doi.org/10.1109/RE.2007.38;121-130;10;Natural Language Processing Meets RE-Traceability and Quality;
2007;Paula Laurent,Jane Cleland-Huang,Chuan Duan;Towards Automated Requirements Triage.;http://dx.doi.org/10.1109/RE.2007.63;131-140;10;Natural Language Processing Meets RE-Traceability and Quality;
2007;Alex Dekhtyar,Jane Huffman Hayes,Senthil Karthikeyan Sundaram,Elizabeth Ashlee Holbrook,Olga Dekhtyar;Technique Integration for Requirements Assessment.;http://dx.doi.org/10.1109/RE.2007.17;141-150;10;Natural Language Processing Meets RE-Traceability and Quality;
2007;Laura Lehtola,Marjo Kauppinen,Jarno Vähäniitty;Strengthening the link between business decisions and RE: Long-term product planning in software product companies.;http://dx.doi.org/10.1109/RE.2007.30;153-162;10;RE, Globalisation and Business;
2007;Sami Jantunen,Kari Smolander,Donald C. Gause;How Internationalization of a Product Changes Requirements Engineering Activities: An Exploratory Study.;http://dx.doi.org/10.1109/RE.2007.44;163-172;10;RE, Globalisation and Business;
2007;Davide Bolchini,Franca Garzotto,Paolo Paolini;Branding and Communication Goals for Content-Intensive Interactive Applications.;http://dx.doi.org/10.1109/RE.2007.60;173-182;10;RE, Globalisation and Business;
2007;Mikio Aoyama;Persona-Scenario-Goal Methodology for User-Centered Requirements Engineering.;http://dx.doi.org/10.1109/RE.2007.50;185-194;10;Methods and Frameworks;
2007;Lei Jiang,Thodoros Topaloglou,Alexander Borgida,John Mylopoulos;Goal-Oriented Conceptual Database Design.;http://dx.doi.org/10.1109/RE.2007.32;195-204;10;Methods and Frameworks;
2007;Simeon Hebler,Tuure Tuunanen,Ken Peffers;Blind User Requirements Engineering for Mobile Services.;http://dx.doi.org/10.1109/RE.2007.56;205-208;4;Methods and Frameworks;
2007;Mohammed Salifu,Yijun Yu,Bashar Nuseibeh;Specifying Monitoring and Switching Problems in Context.;http://dx.doi.org/10.1109/RE.2007.21;211-220;10;Models, Specification and Verification;
2007;Mehrdad Sabetzadeh,Shiva Nejati,Sotirios Liaskos,Steve M. Easterbrook,Marsha Chechik;Consistency Checking of Conceptual Models via Model Merging.;http://dx.doi.org/10.1109/RE.2007.18;221-230;10;Models, Specification and Verification;
2007;Robin A. Gandhi,Seok Won Lee;Discovering and Understanding Multi-dimensional Correlations among Certification Requirements with application to Risk Assessment.;http://dx.doi.org/10.1109/RE.2007.46;231-240;10;Models, Specification and Verification;
2007;Andreas Metzger,Patrick Heymans,Klaus Pohl,Pierre-Yves Schobbens,Germain Saval;Disambiguating the Documentation of Variability in Software Product Lines: A Separation of Concerns, Formalization and Automated Analysis.;http://dx.doi.org/10.1109/RE.2007.61;243-253;11;Product Line Engineering;
2007;Anil Kumar Thurimella,Bernd Bruegge;Evolution in Product Line Requirements Engineering: A Rationale Management Approach.;http://dx.doi.org/10.1109/RE.2007.11;254-257;4;Product Line Engineering;
2007;Klaus Pohl,Ernst Sikora;COSMOD-RE: Supporting the Co-Design of Requirements and Architectural Artifacts.;http://dx.doi.org/10.1109/RE.2007.25;258-261;4;Product Line Engineering;
2007;Constance L. Heitmeyer,Ralph D. Jeffords,Ramesh Bharadwaj,Myla Archer;RE Theory Meets Software Practice: Lessons from the Software Development Trenches.;http://dx.doi.org/10.1109/RE.2007.20;265-268;4;Invited Expert Reviews;
2007;Brian Nicholson;Embedded Knowledge and Offshore Software Development.;http://dx.doi.org/10.1109/RE.2007.67;269;1;Invited Expert Reviews;
2007;Carina Frota Alves,Geber Ramalho,Alexandre L. G. Damasceno;Challenges in Requirements Engineering for Mobile Games Development: The Meantime Case Study.;http://dx.doi.org/10.1109/RE.2007.53;275-280;6;Agents, Roles and Models;
2007;Yuxiu Luo,Leon Sterling,Kuldar Taveter;Modelling a Smart Music Player with a Hybrid Agent-Oriented Methodology.;http://dx.doi.org/10.1109/RE.2007.43;281-286;6;Agents, Roles and Models;
2007;Yudistira Asnar,Paolo Giorgini,Roberto Bonato,Valentino Meduri,Carlo Riccucci;Secure and Dependable Patterns in Organizations: An Empirical Approach.;http://dx.doi.org/10.1109/RE.2007.19;287-292;6;Agents, Roles and Models;
2007;Michael C. Panis,Brian Pokrzywa;Deploying a System-wide Requirements Process within a Commercial Engineering Organization.;http://dx.doi.org/10.1109/RE.2007.49;295-300;6;Product Requirements and Prototyping;
2007;Olfa Djebbi,Camille Salinesi,Gauthier Fanmuy;Industry Survey of Product Lines Management Tools: Requirements, Qualities and Open Issues.;http://dx.doi.org/10.1109/RE.2007.29;301-306;6;Product Requirements and Prototyping;
2007;Ganesh Muniraj,Vijayananda Jagannatha;Requirements Engineering using Prototyping Projects in Healthcare Diagnostic Software Applications.;http://dx.doi.org/10.1109/RE.2007.58;307-312;6;Product Requirements and Prototyping;
2007;Dimitris Karagiannis,John Mylopoulos,Margit Schwab;Business Process-Based Regulation Compliance: The Case of the Sarbanes-Oxley Act.;http://dx.doi.org/10.1109/RE.2007.15;315-321;7;Requirements Processes and Management;
2007;Jyoti M. Bhat,Mayank Gupta;Enhancing Requirement Stakeholder Satisfaction during Far-shore Maintenance of Custom Developed Software using Shift-Pattern Model.;http://dx.doi.org/10.1109/RE.2007.52;322-327;6;Requirements Processes and Management;
2007;Andreas Borg,Mikael Patel,Kristian Sandahl;Extending the OpenUP/Basic Requirements Discipline to Specify Capacity Requirements.;http://dx.doi.org/10.1109/RE.2007.24;328-333;6;Requirements Processes and Management;
2007;Sankar R. Kousik,Raman Venkat;Total Requirements Control at Every Stage of Product Development.;http://dx.doi.org/10.1109/RE.2007.13;337-342;6;Methods in Practice;
2007;Nivedita Deshmukh,Sameer Wadhwa;A Meta Model for Iterative Development of Requirements Leveraging.;http://dx.doi.org/10.1109/RE.2007.59;343-349;7;Methods in Practice;
2007;Ian Alexander;Choosing a Tram Route: An Experience in Trading-Off Constraints.;http://dx.doi.org/10.1109/RE.2007.10;350-355;6;Methods in Practice;
2007;Alistair G. Sutcliffe;Requirements in the Global Economy-Experience, Problems and Prospects.;http://dx.doi.org/10.1109/RE.2007.68;359-360;2;Panels;
2007;Jane Cleland-Huang;Quality Requirements and their Role in Successful Products.;http://dx.doi.org/10.1109/RE.2007.64;361;1;Panels;
2007;Norbert Seyff,Florian Graf,Paul Grünbacher,Neil A. M. Maiden;The Mobile Scenario Presenter: A Tool for in situ Requirements Discovery with Scenarios.;http://dx.doi.org/10.1109/RE.2007.27;365-366;2;Posters;
2007;Rick Rabiser,Deepak Dhungana,Paul Grünbacher,Klaus Lehner,Christian Federspiel;Involving Non-Technicians in Product Derivation and Requirements Engineering: A Tool Suite for Product Line Engineering.;http://dx.doi.org/10.1109/RE.2007.26;367-368;2;Posters;
2007;Irwin Kwan,Sabrina Marczak,Daniela Damian;Viewing Project Collaborators WhoWork on Interrelated Requirements.;http://dx.doi.org/10.1109/RE.2007.55;369-370;2;Posters;
2007;Asarnusch Rashid;OpenProposal: Towards Collaborative End-User Participation in Requirements Management By Usage of Visual Requirement Specifications.;http://dx.doi.org/10.1109/RE.2007.22;371-374;4;Posters;
2007;Matthew Klassen,Stephen Denman,Herman Driessen;Requirements Quality for a Virtual World.;http://dx.doi.org/10.1109/RE.2007.71;375-376;2;Posters;
2007;Lorena Delgadillo,Orlena Gotel;Story-Wall: A Concept for Lightweight Requirements Management.;http://dx.doi.org/10.1109/RE.2007.41;377-378;2;Posters;
2007;Renel Smith,Orlena Gotel;Using a Game to Introduce Lightweight Requirements Engineering.;http://dx.doi.org/10.1109/RE.2007.40;379-380;2;Posters;
2007;Ivan Jureta,Stéphane Faulkner,Philippe Thiran;Dynamic Requirements Specification for Adaptable and Open Service Systems.;http://dx.doi.org/10.1109/RE.2007.28;381-382;2;Posters;
2007;Seok Won Lee,Robin A. Gandhi,Siddharth J. Wagle,Ajeet B. Murty;r-AnalytiCA: Requirements Analytics for Certification & Accreditation.;http://dx.doi.org/10.1109/RE.2007.34;383-384;2;Posters;
2007;Artemios K. Laskaris,Nektarios Psycharis,Eirini Ninou;Developing User Requirements for an Airport Flight Information System.;http://dx.doi.org/10.1109/RE.2007.39;385-386;2;Posters;
2007;Samuel Fricker;Explaining Stakeholder Negotiation Using Social Goal Networks.;http://dx.doi.org/10.1109/RE.2007.36;387-388;2;Posters;
2007;Claudia Cappelli,Julio Cesar Sampaio do Prado Leite,Antonio de Pádua Albuquerque Oliveira;Exploring Business Process Transparency Concepts.;http://dx.doi.org/10.1109/RE.2007.35;389-390;2;Posters;
2007;José María Conejero,Juan Hernández,Ana Moreira,João Araújo 0001;Discovering Volatile and Aspectual Requirements Using a Crosscutting Pattern.;http://dx.doi.org/10.1109/RE.2007.33;391-392;2;Posters;
2007;M. P. S. Bhatia,Abha Vasal;Localisation and Requirement Engineering in Context to Indian Scenario.;http://dx.doi.org/10.1109/RE.2007.42;393-394;2;Posters;
2006;Mary Beth Rosson;End Users Who Meet Their Own Requirements.;http://dx.doi.org/10.1109/RE.2006.20;2;1;Keynotes;
2006;Dorothy Graham;Testing to Improve Requirements - Mission Impossible?;http://dx.doi.org/10.1109/RE.2006.64;3;1;Keynotes;
2006;John Mylopoulos;Goal-Oriented Requirements Engineering, Part II.;http://dx.doi.org/10.1109/RE.2006.27;4;1;Keynotes;
2006;Kimberly S. Wasson;A Case Study in Systematic Improvement of Language for Requirements.;http://dx.doi.org/10.1109/RE.2006.5;6-15;10;Research Papers;
2006;Jon Whittle,Praveen K. Jayaraman;Generating Hierarchical State Machines from Use Case Charts.;http://dx.doi.org/10.1109/RE.2006.25;16-25;10;Research Papers;
2006;Neil A. M. Maiden,Norbert Seyff,Paul Grünbacher,Omo Otojare,Karl Mitteregger;Making Mobile Requirements Engineering Tools Usable and Useful.;http://dx.doi.org/10.1109/RE.2006.38;26-35;10;Research Papers;
2006;Jane Cleland-Huang,Raffaella Settimi,Xuchang Zou,Peter Solc;The Detection and Classification of Non-Functional Requirements with Application to Early Aspects.;http://dx.doi.org/10.1109/RE.2006.65;36-45;10;Research Papers;
2006;Travis D. Breaux,Matthew W. Vail,Annie I. Antón;Towards Regulatory Compliance: Extracting Rights and Obligations to Align Requirements with Regulations.;http://dx.doi.org/10.1109/RE.2006.68;46-55;10;Research Papers;
2006;Francis Chantree,Bashar Nuseibeh,Anne N. De Roeck,Alistair Willis;Identifying Nocuous Ambiguities in Natural Language Requirements.;http://dx.doi.org/10.1109/RE.2006.31;56-65;10;Research Papers;
2006;Katharina Mehner,Mattia Monga,Gabriele Taentzer;Interaction Analysis in Aspect-Oriented Models.;http://dx.doi.org/10.1109/RE.2006.35;66-75;10;Research Papers;
2006;Sotirios Liaskos,Alexei Lapouchnian,Yijun Yu,Eric S. K. Yu,John Mylopoulos;On Goal-based Variability Acquisition and Analysis.;http://dx.doi.org/10.1109/RE.2006.45;76-85;10;Research Papers;
2006;Fredrik Törner,Martin Ivarsson,Fredrik Pettersson,Peter Öhman;An Empirical Quality Assessment of Automotive Use Cases.;http://dx.doi.org/10.1109/RE.2006.9;86-95;10;Research Papers;
2006;Mohamed El-Attar,James Miller;Matching Antipatterns to Improve the Quality of Use Case Models.;http://dx.doi.org/10.1109/RE.2006.42;96-105;10;Research Papers;
2006;Oliver Creighton,Martin Ott,Bernd Brügge;Software Cinema-Video-based Requirements Engineering.;http://dx.doi.org/10.1109/RE.2006.59;106-115;10;Research Papers;
2006;Ivan Jureta,Stéphane Faulkner,Pierre-Yves Schobbens;Justifying Goal Models.;http://dx.doi.org/10.1109/RE.2006.37;116-125;10;Research Papers;
2006;Jaap Gordijn,Michaël Petit,Roel Wieringa;Understanding Business Strategies of Networked Value Constellations Using Goal- and Value Modeling.;http://dx.doi.org/10.1109/RE.2006.69;126-135;10;Research Papers;
2006;Pierre-Yves Schobbens,Patrick Heymans,Jean-Christophe Trigaux;Feature Diagrams: A Survey and a Formal Semantics.;http://dx.doi.org/10.1109/RE.2006.23;136-145;10;Research Papers;
2006;Mark-Oliver Reiser,Matthias Weber;Managing Highly Complex Product Families with Multi-Level Feature Trees.;http://dx.doi.org/10.1109/RE.2006.39;146-155;10;Research Papers;
2006;Björn Axenath,Holger Giese,Florian Klein,Ursula Frank;Systematic Requirements-Driven Evaluation and Synthesis of Alternative Principle Solutions for Advanced Mechatronic Systems.;http://dx.doi.org/10.1109/RE.2006.62;156-165;10;Research Papers;
2006;Robert Seater,Daniel Jackson;Requirement Progression in Problem Frames Applied to a Proton Therapy System.;http://dx.doi.org/10.1109/RE.2006.53;166-175;10;Research Papers;
2006;Alan M. Davis,Óscar Dieste Tubío,Ann M. Hickey,Natalia Juristo Juzgado,Ana María Moreno;Effectiveness of Requirements Elicitation Techniques: Empirical Results Derived from a Systematic Review.;http://dx.doi.org/10.1109/RE.2006.17;176-185;10;Research Papers;
2006;Haruhiko Kaiya,Motoshi Saeki;Using Domain Ontology as Domain Knowledge for Requirements Elicitation.;http://dx.doi.org/10.1109/RE.2006.72;186-195;10;Research Papers;
2006;Lei Jiang,Thodoros Topaloglou,Alexander Borgida,John Mylopoulos;Incorporating Goal Analysis in Database Design: A Case Study from Biological Data Management.;http://dx.doi.org/10.1109/RE.2006.33;196-204;9;Research Papers;
2006;Spencer Smith;Systematic Development of Requirements Documentation for General Purpose Scientific Computing Software.;http://dx.doi.org/10.1109/RE.2006.61;205-215;11;Research Papers;
2006;Joel So,Daniel M. Berry;Experiences of Requirements Engineering for Two Consecutive Versions of a Product at VLSC.;http://dx.doi.org/10.1109/RE.2006.21;216-221;6;Industrial Practice and Experience Papers;
2006;Debra Aubrey;Controlling the HMS Program through Managing Requirements.;http://dx.doi.org/10.1109/RE.2006.12;222-227;6;Industrial Practice and Experience Papers;
2006;Karsten Wendland,Claudia Planz,Peter Oldorf;Optimal Solutions for Hospital Websites.;http://dx.doi.org/10.1109/RE.2006.47;228-233;6;Industrial Practice and Experience Papers;
2006;Paul Arkley,Steve Riddle,Tom Brookes;Tailoring Traceability Information to Business Needs.;http://dx.doi.org/10.1109/RE.2006.63;234-239;6;Industrial Practice and Experience Papers;
2006;Andreas Borg,Mikael Patel,Kristian Sandahl;Good Practice and Improvement Model of Handling Capacity Requirements of Large Telecommunication Systems.;http://dx.doi.org/10.1109/RE.2006.28;240-245;6;Industrial Practice and Experience Papers;
2006;Mario Pichler,Hildegard Rumetshofer,Wilhelm Wahler;Agile Requirements Engineering for a Social Insurance for Occupational Risks Organization: A Case Study.;http://dx.doi.org/10.1109/RE.2006.8;246-251;6;Industrial Practice and Experience Papers;
2006;Barbara Paech,Bernd Reuschenbach;Open Source Requirements Engineering.;http://dx.doi.org/10.1109/RE.2006.46;252-259;8;Industrial Practice and Experience Papers;
2006;Brian Berenbach;Requirements Engineering: An Industrial Perspective.;http://dx.doi.org/10.1109/RE.2006.56;260;1;Invited Industrial Contributions;
2006;Steven P. Miller;Proving the Shalls: Requirements, Proofs, and Model-Based Development.;http://dx.doi.org/10.1109/RE.2006.49;261;1;Invited Industrial Contributions;
2006;Anette Prindahl;Modeling Requirements.;http://dx.doi.org/10.1109/RE.2006.44;262;1;Invited Industrial Contributions;
2006;Ralph Young;Putting Requirements Theory into Practice at Northrop Grumman.;http://dx.doi.org/10.1109/RE.2006.50;263;1;Invited Industrial Contributions;
2006;Jeremy Dick;A Requirements Guide For All (REGAL): An INCOSE Initiative.;http://dx.doi.org/10.1109/RE.2006.7;264;1;Invited Industrial Contributions;
2006;Hans Akkermans,Jaap Gordijn;What is This Science Called Requirements Engineering?;http://dx.doi.org/10.1109/RE.2006.73;266-271;6;Vision Papers;
2006;Steven L. Cornford,Martin S. Feather,Vance A. Heron,J. Steven Jenkins;Fusing Quantitative Requirements Analysis with Model-based Systems Engineering.;http://dx.doi.org/10.1109/RE.2006.24;272-277;6;Vision Papers;
2006;Colin Potts;Re-Framing Requirements Engineering.;http://dx.doi.org/10.1109/RE.2006.51;278-283;6;Vision Papers;
2006;Gil Regev,Donald C. Gause,Alain Wegmann;Creativity and the Age-Old Resistance to Change Problem in RE.;http://dx.doi.org/10.1109/RE.2006.13;284-291;8;Vision Papers;
2006;David Callele,Eric Neufeld,Kevin Schneider;Emotional Requirements in Video Games.;http://dx.doi.org/10.1109/RE.2006.19;292-295;4;Short Papers;
2006;Nan Niu,Steve M. Easterbrook;Managing Terminological Interference in Goal Models with Repertory Grid.;http://dx.doi.org/10.1109/RE.2006.41;296-299;4;Short Papers;
2006;Kun Chen,Haiyan Zhao,Wei Zhang 0004,Hong Mei;Identification of Crosscutting Requirements Based on Feature Dependency Analysis.;http://dx.doi.org/10.1109/RE.2006.30;300-303;4;Short Papers;
2006;Maya Daneva,Roel Wieringa;A Coordination Complexity Model to Support Requirements Engineering for Cross-organizational ERP.;http://dx.doi.org/10.1109/RE.2006.6;304-307;4;Short Papers;
2006;Paolo Giorgini,Fabio Massacci,John Mylopoulos,Nicola Zannone;Detecting Conflicts of Interest.;http://dx.doi.org/10.1109/RE.2006.16;308-311;4;Short Papers;
2006;Inge van de Weerd,Sjaak Brinkkemper,Richard Nieuwenhuis,Johan Versendaal,Lex Bijlsma;Towards a Reference Framework for Software Product Management.;http://dx.doi.org/10.1109/RE.2006.66;312-315;4;Short Papers;
2006;Juan Pablo Carvallo,Xavier Franch,Carme Quer;Managing Non-Technical Requirements in COTS Components Selection.;http://dx.doi.org/10.1109/RE.2006.40;316-321;6;Short Papers;
2006;Christof Ebert,Sjaak Brinkkemper;Have You Spoken to Your Product Manager Recently?;http://dx.doi.org/10.1109/RE.2006.29;322;1;Panels;
2006;Jane Cleland-Huang;Requirements Traceability - When and How does it Deliver more than it Costs?;http://dx.doi.org/10.1109/RE.2006.57;323;1;Panels;
2006;David Bush,Bashar Nuseibeh;Requirements Engineering Research in Some Future Worlds: An Exercise in Scenario Planning.;http://dx.doi.org/10.1109/RE.2006.55;324;1;Panels;
2006;Fernanda M. R. Alencar,Ana Moreira,João Araújo 0001,Jaelson Castro,Carla T. L. L. Silva,John Mylopoulos;Using Aspects to Simplify iModels.;http://dx.doi.org/10.1109/RE.2006.71;328-329;2;Posters;
2006;Ban Al-Ani,Susan Elliott Sim;So, You Think You Are a Requirements Engineer?;http://dx.doi.org/10.1109/RE.2006.58;330-331;2;Posters;
2006;Lúcia R. D. Bastos,Jaelson Castro,John Mylopoulos;Deriving Architectures from Requirements.;http://dx.doi.org/10.1109/RE.2006.14;332-333;2;Posters;
2006;Isabel Sofia Brito,Ana Moreira;Towards an Integrated Approach for Aspectual Requirements.;http://dx.doi.org/10.1109/RE.2006.67;334-335;2;Posters;
2006;Ali Ebnenasir,Betty H. C. Cheng,Sascha Konrad;Use Case-Based Modeling and Analysis of Failsafe Fault-Tolerance.;http://dx.doi.org/10.1109/RE.2006.70;336-337;2;Posters;
2006;Heather Goldsby,Betty H. C. Cheng;Goal-Oriented Modeling of Requirements Engineering for Dynamically Adaptive System.;http://dx.doi.org/10.1109/RE.2006.26;338-339;2;Posters;
2006;Bruno González-Baixauli,Julio Cesar Sampaio do Prado Leite,Miguel A. Laguna;Eliciting Non-Functional Requirements Interactions Using the Personal Construct Theory.;http://dx.doi.org/10.1109/RE.2006.18;340-341;2;Posters;
2006;Lin Liu 0001,Zhi Jin;Integrating Goals and Problem Frames in Requirements Analysis.;http://dx.doi.org/10.1109/RE.2006.34;342-343;2;Posters;
2006;Javier Muñoz,Pedro Valderas,Vicente Pelechano,Oscar Pastor;Requirements Engineering for Pervasive Systems. A Transformational Approach.;http://dx.doi.org/10.1109/RE.2006.54;344-345;2;Posters;
2006;Andrew Stone,Peter Sawyer;Exposing Tacit Knowledge via Pre-Requirements Tracing.;http://dx.doi.org/10.1109/RE.2006.22;346-347;2;Posters;
2006;Jian Tang,Donglin Liang;Improving the Modeling of Use Case Relationship.;http://dx.doi.org/10.1109/RE.2006.32;348-351;4;Posters;
2006;Gemma Grau,Xavier Franch,Sebastián Ávila;J-PRiM: A Java Tool for a Process Reengineering i* Methodology.;http://dx.doi.org/10.1109/RE.2006.36;352-353;2;Research Tool Demonstrations;
