2014;Paul W. McBurney,Collin McMillan;Automatic documentation generation via source code summarization of method context.;http://doi.acm.org/10.1145/2597008.2597149;279-290;12;Novel Development Tooling;
2014;Paul W. McBurney,Cheng Liu,Collin McMillan,Tim Weninger;Improving topic model source code summarization.;http://doi.acm.org/10.1145/2597008.2597793;291-294;4;Novel Development Tooling;
2014;Aniket Kulkarni,Ravindra Metta;A code obfuscation framework using code clones.;http://doi.acm.org/10.1145/2597008.2597807;295-299;5;Novel Development Tooling;
2014;Ahmad Jbara,Dror G. Feitelson;JCSD: visual support for understanding code control structure.;http://doi.acm.org/10.1145/2597008.2597801;300-303;4;Novel Development Tooling;
2014;Zhenzhou Tian,Qinghua Zheng,Ting Liu,Ming Fan,Xiaodong Zhang,Zijiang Yang;Plagiarism detection for multithreaded software based on thread-aware software birthmarks.;http://doi.acm.org/10.1145/2597008.2597143;304-313;10;Novel Development Tooling;
2014;Mark Grechanik,Collin McMillan,Tathagata Dasgupta,Denys Poshyvanyk,Malcom Gethers;Redacting sensitive information in software artifacts.;http://doi.acm.org/10.1145/2597008.2597138;314-325;12;Novel Development Tooling;
2013;Samir Gupta,Sana Malik,Lori L. Pollock,K. Vijay-Shanker;Part-of-speech tagging of program identifiers for improved text-based software engineering tools.;http://dx.doi.org/10.1109/ICPC.2013.6613828;3-12;10;Textual Analysis;
2013;Brian P. Eddy,Jeffrey A. Robinson,Nicholas A. Kraft,Jeffrey Carver;Evaluating source code summarization techniques: Replication and expansion.;http://dx.doi.org/10.1109/ICPC.2013.6613829;13-22;10;Textual Analysis;
2013;Laura Moreno,Jairo Aponte,Giriprasad Sridhara,Andrian Marcus,Lori L. Pollock,K. Vijay-Shanker;Automatic generation of natural language summaries for Java classes.;http://dx.doi.org/10.1109/ICPC.2013.6613830;23-32;10;Textual Analysis;
2013;Zohreh Sharafi,Alessandro Marchetto,Angelo Susi,Giuliano Antoniol,Yann-Gael Gueheneuc;An empirical study on the efficiency of graphical vs. textual representations in requirements comprehension.;http://dx.doi.org/10.1109/ICPC.2013.6613831;33-42;10;The Role of Visualization in Program Comprehension;
2013;Kenichi Kobayashi,Manabu Kamimura,Keisuke Yano,Koki Kato,Akihiko Matsuo;SArF map: Visualizing software architecture from feature and layer viewpoints.;http://dx.doi.org/10.1109/ICPC.2013.6613832;43-52;10;The Role of Visualization in Program Comprehension;
2013;Jonas Trumper,Jurgen Dollner,Alexandru Telea;Multiscale visual comparison of execution traces.;http://dx.doi.org/10.1109/ICPC.2013.6613833;53-62;10;The Role of Visualization in Program Comprehension;
2013;Fabian Beck,Oliver Moseler,Stephan Diehl 0001,Gunter Daniel Rey;In situ understanding of performance bottlenecks through visually augmented code.;http://dx.doi.org/10.1109/ICPC.2013.6613834;63-72;10;The Role of Visualization in Program Comprehension;
2013;Tobias Roehm,Nigar Gurbanova,Bernd Brugge,Christophe Joubert,Walid Maalej;Monitoring user interactions for supporting failure reproduction.;http://dx.doi.org/10.1109/ICPC.2013.6613835;73-82;10;Software Quality;
2013;Daniela Steidl,Benjamin Hummel,Elmar Jurgens;Quality analysis of source code comments.;http://dx.doi.org/10.1109/ICPC.2013.6613836;83-92;10;Software Quality;
2013;Hiroaki Murakami,Keisuke Hotta,Yoshiki Higo,Hiroshi Igaki,Shinji Kusumoto;Gapped code clone detection with lightweight source code analysis.;http://dx.doi.org/10.1109/ICPC.2013.6613837;93-102;10;Source Code Comprehension;
2013;Manishankar Mondal,Chanchal Kumar Roy,Kevin A. Schneider;Insight into a method co-change pattern to identify highly coupled methods: An empirical study.;http://dx.doi.org/10.1109/ICPC.2013.6613838;103-112;10;Source Code Comprehension;
2013;Philip Mayer,Andreas Schroeder;Patterns of cross-language linking in java frameworks.;http://dx.doi.org/10.1109/ICPC.2013.6613839;113-122;10;Source Code Comprehension;
2013;Diana Diaz,Gabriele Bavota,Andrian Marcus,Rocco Oliveto,Silvia Takahashi,Andrea De Lucia;Using code ownership to improve IR-based Traceability Link Recovery.;http://dx.doi.org/10.1109/ICPC.2013.6613840;123-132;10;Traceability and Feature Location;
2013;Blake Bassett,Nicholas A. Kraft;Structural information based term weighting in text retrieval for feature location.;http://dx.doi.org/10.1109/ICPC.2013.6613841;133-141;9;Traceability and Feature Location;
2013;Yingying Zhang,Daqing Hou;Extracting problematic API features from forum discussions.;http://dx.doi.org/10.1109/ICPC.2013.6613842;142-151;10;Comprehending API;
2013;Coen De Roover,Ralf Lammel,Ekaterina Pek;Multi-dimensional exploration of API usage.;http://dx.doi.org/10.1109/ICPC.2013.6613843;152-161;10;Comprehending API;
2013;Anas Mahmoud,Nan Niu;Evaluating software clustering algorithms in the context of program comprehension.;http://dx.doi.org/10.1109/ICPC.2013.6613844;162-171;10;Comprehending Software Architectures;
2013;Leo Pruijt,Christian Koppe,Sjaak Brinkkemper;On the accuracy of Architecture Compliance Checking support Accuracy of dependency analysis and violation reporting.;http://dx.doi.org/10.1109/ICPC.2013.6613845;172-181;10;Comprehending Software Architectures;
2013;Mohamed Aly,Anis Charfi,Mira Mezini;Building extensions for applications: Towards the understanding of extension possibilities.;http://dx.doi.org/10.1109/ICPC.2013.6613846;182-191;10;Comprehending Software Architectures;
2013;Mario Bernhart,Thomas Grechenig;On the understanding of programs with continuous code reviews.;http://dx.doi.org/10.1109/ICPC.2013.6613847;192-198;7;Industry Track;
2013;Yuki Yamanaka,Eunjong Choi,Norihiro Yoshida,Katsuro Inoue,Tateki Sano;Applying clone change notification system into an industrial development process.;http://dx.doi.org/10.1109/ICPC.2013.6613848;199-206;8;Industry Track;
2013;Michele Lanza,Marco D'Ambros,Alberto Bacchelli,Lile Hattori,Francesco Rigotti;Manhattan: Supporting real-time visual team activity awareness.;http://dx.doi.org/10.1109/ICPC.2013.6613849;207-210;4;Early Reserarch Achievements Track;
2013;Chris Parnin,Christoph Treude,Margaret-Anne D. Storey;Blogging developer knowledge: Motivations, challenges, and future directions.;http://dx.doi.org/10.1109/ICPC.2013.6613850;211-214;4;Early Reserarch Achievements Track;
2013;Manabu Kamimura,Gail C. Murphy;Towards generating human-oriented summaries of unit test cases.;http://dx.doi.org/10.1109/ICPC.2013.6613851;215-218;4;Early Reserarch Achievements Track;
2013;Cataldo Basile,Mariano Ceccato;Towards a unified software attack model to assess software protections.;http://dx.doi.org/10.1109/ICPC.2013.6613852;219-222;4;Early Reserarch Achievements Track;
2013;Manishankar Mondal,Chanchal Kumar Roy,Kevin A. Schneider;Improving the detection accuracy of evolutionary coupling.;http://dx.doi.org/10.1109/ICPC.2013.6613853;223-226;4;Early Reserarch Achievements Track;
2013;Toshihiro Kamiya;Agec: An execution-semantic clone detection tool.;http://dx.doi.org/10.1109/ICPC.2013.6613854;227-229;3;Tool Demonstrations;
2013;Laura Moreno,Andrian Marcus,Lori L. Pollock,K. Vijay-Shanker;JSummarizer: An automatic generator of natural language summaries for Java classes.;http://dx.doi.org/10.1109/ICPC.2013.6613855;230-232;3;Tool Demonstrations;
2013;Michael Falcone,Bonita Sharif;OnionUML: An Eclipse plug-in for visualizing UML class diagrams in onion graph notation.;http://dx.doi.org/10.1109/ICPC.2013.6613856;233-235;3;Tool Demonstrations;
2013;Md. Sharif Uddin,Chanchal Kumar Roy,Kevin A. Schneider;SimCad: An extensible and faster clone detection tool for large scale software systems.;http://dx.doi.org/10.1109/ICPC.2013.6613857;236-238;3;Tool Demonstrations;
2012;Bernhard Katzmarski,Rainer Koschke;Program complexity metrics and programmer opinions.;http://dx.doi.org/10.1109/ICPC.2012.6240486;17-26;10;Cognitive Processes;
2012;Zohreh Sharafi,Zephyrin Soh,Yann-Gael Gueheneuc,Giuliano Antoniol;Women and men - Different but equal: On the impact of identifier style on source code reading.;http://dx.doi.org/10.1109/ICPC.2012.6240505;27-36;10;Cognitive Processes;
2012;Takashi Ishio,Shogo Etsuda,Katsuro Inoue;A lightweight visualization of interprocedural data-flow paths for source code reading.;http://dx.doi.org/10.1109/ICPC.2012.6240506;37-46;10;Cognitive Processes;
2012;Janet Feigenspan,Don S. Batory,Taylor L. Riche;Is the derivation of a model easier to understand than the model itself?;http://dx.doi.org/10.1109/ICPC.2012.6240508;47-52;6;Cognitive Processes;
2012;Chandan Raj Rupakheti,Daqing Hou;Evaluating forum discussions to inform the design of an API critic.;http://dx.doi.org/10.1109/ICPC.2012.6240509;53-62;10;The Role of the Developer;
2012;Sebastiano Panichella,Jairo Aponte,Massimiliano Di Penta,Andrian Marcus,Gerardo Canfora;Mining source code descriptions from developer communications.;http://dx.doi.org/10.1109/ICPC.2012.6240510;63-72;10;The Role of the Developer;
2012;Janet Feigenspan,Christian Kastner,Jorg Liebig,Sven Apel,Stefan Hanenberg;Measuring programming experience.;http://dx.doi.org/10.1109/ICPC.2012.6240511;73-82;10;The Role of the Developer;
2012;Ahmad Jbara,Adam Matan,Dror G. Feitelson;High-MCC functions in the Linux kernel.;http://dx.doi.org/10.1109/ICPC.2012.6240512;83-92;10;Measurement;
2012;John-Jose Nunez,Gregor Kiczales;Understanding registration-based abstractions: A quantitative user study.;http://dx.doi.org/10.1109/ICPC.2012.6240513;93-102;10;Measurement;
2012;Bruno Carreiro da Silva,Claudio Sant'Anna,Christina von Flach G. Chavez,Alessandro Garcia;Concern-based cohesion: Unveiling a hidden dimension of cohesion measurement.;http://dx.doi.org/10.1109/ICPC.2012.6240476;103-112;10;Measurement;
2012;Israel J. Mojica Ruiz,Meiyappan Nagappan,Bram Adams,Ahmed E. Hassan;Understanding reuse in the Android Market.;http://dx.doi.org/10.1109/ICPC.2012.6240477;113-122;10;Measurement;
2012;Chris Parnin,Spencer Rugaber;Programmer information needs after memory failure.;http://dx.doi.org/10.1109/ICPC.2012.6240479;123-132;10;Understanding and Architecture;
2012;Luay Alawneh,Abdelwahab Hamou-Lhadj;Identifying computational phases from inter-process communication traces of HPC applications.;http://dx.doi.org/10.1109/ICPC.2012.6240481;133-142;10;Understanding and Architecture;
2012;Amir Reza Yazdanshenas,Leon Moonen;Tracking and visualizing information flow in component-based systems.;http://dx.doi.org/10.1109/ICPC.2012.6240482;143-152;10;Understanding and Architecture;
2012;Sebastian Kleinschmager,Stefan Hanenberg,Romain Robbes,Eric Tanter,Andreas Stefik;Do static type systems improve the maintainability of software systems? An empirical study.;http://dx.doi.org/10.1109/ICPC.2012.6240483;153-162;10;Empirical Studies;
2012;Zephyrin Soh,Zohreh Sharafi,Bertrand Van den Plas,Gerardo Cepeda Porras,Yann-Gael Gueheneuc,Giuliano Antoniol;Professional status and expertise for UML class diagram comprehension: An empirical study.;http://dx.doi.org/10.1109/ICPC.2012.6240484;163-172;10;Empirical Studies;
2012;Christopher S. Corley,Elizabeth A. Kammer,Nicholas A. Kraft;Modeling the ownership of source code topics.;http://dx.doi.org/10.1109/ICPC.2012.6240485;173-182;10;Semantics and Traceability;
2012;Anas Mahmoud,Nan Niu,Songhua Xu;A semantic relatedness approach for traceability link recovery.;http://dx.doi.org/10.1109/ICPC.2012.6240487;183-192;10;Semantics and Traceability;
2012;Andrea De Lucia,Massimiliano Di Penta,Rocco Oliveto,Annibale Panichella,Sebastiano Panichella;Using IR methods for labeling source code artifacts: Is it worthwhile?;http://dx.doi.org/10.1109/ICPC.2012.6240488;193-202;10;Semantics and Traceability;
2012;Bogdan Dit,Evan Moritz,Denys Poshyvanyk;A TraceLab-based solution for creating, conducting, and sharing feature location experiments.;http://dx.doi.org/10.1109/ICPC.2012.6240489;203-208;6;Semantics and Traceability;
2012;Benedikt Hauptmann,Maximilian Junker,Sebastian Eder,Elmar Jurgens,Rudolf Vaas;Can clone detection support test comprehension?;http://dx.doi.org/10.1109/ICPC.2012.6240490;209-218;10;Source-Code Analysis;
2012;Jan Harder,Rebecca Tiarks;A controlled experiment on software clones.;http://dx.doi.org/10.1109/ICPC.2012.6240491;219-228;10;Source-Code Analysis;
2012;Carlos Noguera,Coen De Roover,Andy Kellens,Viviane Jonckers;Code querying by UML.;http://dx.doi.org/10.1109/ICPC.2012.6240492;229-238;10;Source-Code Analysis;
2012;Chandan Raj Rupakheti,Daqing Hou;CriticAL: A critic for APIs and libraries.;http://dx.doi.org/10.1109/ICPC.2012.6240493;241-243;3;Tool Demonstrations;
2012;Janet Feigenspan,Norbert Siegmund;Supporting comprehension experiments with human subjects.;http://dx.doi.org/10.1109/ICPC.2012.6240494;244-246;3;Tool Demonstrations;
2012;Iman Keivanloo,Chanchal Kumar Roy,Juergen Rilling;SeByte: A semantic clone detection tool for intermediate languages.;http://dx.doi.org/10.1109/ICPC.2012.6240495;247-249;3;Tool Demonstrations;
2012;Keisuke Hotta,Yoshiki Higo,Hiroshi Igaki,Shinji Kusumoto;CRat: A refactoring support tool for Form Template Method.;http://dx.doi.org/10.1109/ICPC.2012.6240496;250-252;3;Tool Demonstrations;
2012;Hiroshi Kazato,Shinpei Hayashi,Satoshi Okada,Shunsuke Miyata,Takashi Hoshino,Motoshi Saeki;Toward structured location of features.;http://dx.doi.org/10.1109/ICPC.2012.6240497;255-256;2;Poster Presentations;
2012;Bo Zhang;Extraction and improvement of conditionally compiled product line code.;http://dx.doi.org/10.1109/ICPC.2012.6240498;257-258;2;Poster Presentations;
2012;Vasil L. Tenev,Slawomir Duszynski;Applying bioinformatics in the analysis of software variants.;http://dx.doi.org/10.1109/ICPC.2012.6240499;259-260;2;Poster Presentations;
2012;Hitesh Sajnani,Joel Ossher,Cristina Videira Lopes;Parallel code clone detection using MapReduce.;http://dx.doi.org/10.1109/ICPC.2012.6240500;261-262;2;Poster Presentations;
2012;Hitesh Sajnani;Automatic software architecture recovery: A machine learning approach.;http://dx.doi.org/10.1109/ICPC.2012.6240501;265-268;4;Student Research Symposium;
2012;Anas Mahmoud;Toward an effective automated tracing process.;http://dx.doi.org/10.1109/ICPC.2012.6240502;269-272;4;Student Research Symposium;
2012;Ahmad Jbara;Characterization of the Linux configuration system.;http://dx.doi.org/10.1109/ICPC.2012.6240503;273-276;4;Student Research Symposium;
2012;Iman Keivanloo;Leveraging clone detection for Internet-scale source code search.;http://dx.doi.org/10.1109/ICPC.2012.6240504;277-280;4;Student Research Symposium;
2011;Giuseppe Scanniello,Andrian Marcus;Clustering Support for Static Concept Location in Source Code.;http://dx.doi.org/10.1109/ICPC.2011.13;1-10;10;Concept and Feature Location;
2011;Bogdan Dit,Latifa Guerrouj,Denys Poshyvanyk,Giuliano Antoniol;Can Better Identifier Splitting Techniques Help Feature Location?;http://dx.doi.org/10.1109/ICPC.2011.47;11-20;10;Concept and Feature Location;
2011;Andrea De Lucia,Massimiliano Di Penta,Rocco Oliveto,Annibale Panichella,Sebastiano Panichella;Improving IR-based Traceability Recovery Using Smoothing Filters.;http://dx.doi.org/10.1109/ICPC.2011.34;21-30;10;Concept and Feature Location;
2011;Annie T. T. Ying,Martin P. Robillard;The Influence of the Task on Programmer Behaviour.;http://dx.doi.org/10.1109/ICPC.2011.35;31-40;10;Empirical Studies of Programmers;
2011;Oleksandr Panchenko,Jan Karstens,Hasso Plattner,Alexander Zeier;Precise and Scalable Querying of Syntactical Source Code Patterns Using Sample Code Snippets and a Database.;http://dx.doi.org/10.1109/ICPC.2011.31;41-50;10;Empirical Studies of Programmers;
2011;Stefan Endrikat,Stefan Hanenberg;Is Aspect-Oriented Programming a Rewarding Investment into Future Code Changes? A Socio-technical Study on Development and Maintenance Time.;http://dx.doi.org/10.1109/ICPC.2011.46;51-60;10;Empirical Studies of Programmers;
2011;David Rothlisberger,Oscar Nierstrasz,Stephane Ducasse;SmartGroups: Focusing on Task-Relevant Source Artifacts in IDEs.;http://dx.doi.org/10.1109/ICPC.2011.20;61-70;10;Automated Support for Program Comprehension;
2011;Giriprasad Sridhara,Lori L. Pollock,K. Vijay-Shanker;Generating Parameter Comments and Integrating with Method Summaries.;http://dx.doi.org/10.1109/ICPC.2011.28;71-80;10;Automated Support for Program Comprehension;
2011;Marouane Kessentini,Wael Kessentini,Houari A. Sahraoui,Mounir Boukadoum,Ali Ouni 0001;Design Defects Detection and Correction by Example.;http://dx.doi.org/10.1109/ICPC.2011.22;81-90;10;Automated Support for Program Comprehension;
2011;Daqing Hou,Lin Li;Obstacles in Using Frameworks and APIs: An Exploratory Study of Programmers' Newsgroup Discussions.;http://dx.doi.org/10.1109/ICPC.2011.21;91-100;10;Collaborative Program Comprehension;
2011;Anja Guzzi,Lile Hattori,Michele Lanza,Martin Pinzger,Arie van Deursen;Collective Code Bookmarks for Program Comprehension.;http://dx.doi.org/10.1109/ICPC.2011.19;101-110;10;Collaborative Program Comprehension;
2011;Nasir Ali,Yann-Gael Gueheneuc,Giuliano Antoniol;Trust-Based Requirements Traceability.;http://dx.doi.org/10.1109/ICPC.2011.42;111-120;10;Collaborative Program Comprehension;
2011;Johan Fabry,Andy Kellens,Stephane Ducasse;AspectMaps: A Scalable Visualization of Join Point Shadows.;http://dx.doi.org/10.1109/ICPC.2011.11;121-130;10;Aspect-Oriented Programming;
2011;Rachel Burrows,Francois Taiani,Alessandro Garcia,Fabiano Cutigi Ferrari;Reasoning about Faults in Aspect-Oriented Programs: A Metrics-Based Evaluation.;http://dx.doi.org/10.1109/ICPC.2011.30;131-140;10;Aspect-Oriented Programming;
2011;Dominik Stein,Stefan Hanenberg;Comparison of a Visual and a Textual Notation to Express Data Constraints in Aspect-Oriented Join Point Selections: A Controlled Experiment.;http://dx.doi.org/10.1109/ICPC.2011.9;141-150;10;Aspect-Oriented Programming;
2011;James R. Cordy;Exploring Large-Scale System Similarity Using Incremental Clone Detection and Live Scatterplots.;http://dx.doi.org/10.1109/ICPC.2011.25;151-160;10;Software Evolution;
2011;Lile Hattori,Marco D'Ambros,Michele Lanza,Mircea Lungu;Software Evolution Comprehension: Replay to the Rescue.;http://dx.doi.org/10.1109/ICPC.2011.39;161-170;10;Software Evolution;
2011;Elmar Jurgens,Martin Feilkas,Markus Herrmannsdorfer,Florian Deissenboeck,Rudolf Vaas,Karl-Heinz Prommer;Feature Profiling for Evolving Systems.;http://dx.doi.org/10.1109/ICPC.2011.12;171-180;10;Software Evolution;
2011;Luay Alawneh,Abdelwahab Hamou-Lhadj;MTF: A Scalable Exchange Format for Traces of High Performance Computing Systems.;http://dx.doi.org/10.1109/ICPC.2011.15;181-184;4;Short Papers;
2011;Nicolas Bettenburg,Bram Adams,Ahmed E. Hassan,Michel Smidt;A Lightweight Approach to Uncover Technical Artifacts in Unstructured Data.;http://dx.doi.org/10.1109/ICPC.2011.36;185-188;4;Short Papers;
2011;Nir Eitan,Michal Gordon-Kiwkowitz,David Harel,Assaf Marron,Gera Weiss;On Visualization and Comprehension of Scenario-Based Programs.;http://dx.doi.org/10.1109/ICPC.2011.10;189-192;4;Short Papers;
2011;Nan Niu,Anas Mahmoud,Xiaoyong Yang;Faceted Navigation for Software Exploration.;http://dx.doi.org/10.1109/ICPC.2011.18;193-196;4;Short Papers;
2011;Chris Parnin;Subvocalization - Toward Hearing the Inner Thoughts of Developers.;http://dx.doi.org/10.1109/ICPC.2011.49;197-200;4;Short Papers;
2011;Gabriella Toth,Adam Zoltan Vegh,Arpad Beszedes,Tibor Gyimothy;Adding Process Metrics to Enhance Modification Complexity Prediction.;http://dx.doi.org/10.1109/ICPC.2011.41;201-204;4;Short Papers;
2011;Mengliao Wang,Xiaoyu Shi,Kenny Wong;Capturing Expert Knowledge for Automated Configuration Fault Diagnosis.;http://dx.doi.org/10.1109/ICPC.2011.24;205-208;4;Short Papers;
2011;Salima Hassaine,Ferdaous Boughanmi,Yann-Gael Gueheneuc,Sylvie Hamel,Giuliano Antoniol;Change Impact Analysis: An Earthquake Metaphor.;http://dx.doi.org/10.1109/ICPC.2011.54;209-210;2;Posters;
2011;Gayani Samaraweera,Macneil Shonle,John Quarles;Programming from the Reader's Perspective: Toward an Expectations Approach.;http://dx.doi.org/10.1109/ICPC.2011.32;211-212;2;Posters;
2011;Andreas Stefik,Susanna Siebert,Kim Slattery,Melissa Stefik;Toward Intuitive Programming Languages.;http://dx.doi.org/10.1109/ICPC.2011.33;213-214;2;Posters;
2011;Mark D. Syer,Bram Adams,Ahmed E. Hassan;Industrial Case Study on Supporting the Comprehension of System Behaviour under Load.;http://dx.doi.org/10.1109/ICPC.2011.38;215-216;2;Posters;
2011;James R. Cordy,Chanchal Kumar Roy;DebCheck: Efficient Checking for Open Source Code Clones in Software Systems.;http://dx.doi.org/10.1109/ICPC.2011.27;217-218;2;Tool Demonstrations;
2011;James R. Cordy,Chanchal Kumar Roy;The NiCad Clone Detector.;http://dx.doi.org/10.1109/ICPC.2011.26;219-220;2;Tool Demonstrations;
2011;Liang Huang,Kenny Wong;Anomaly Detection by Monitoring Filesystem Activities.;http://dx.doi.org/10.1109/ICPC.2011.23;221-222;2;Tool Demonstrations;
2011;Iman Keivanloo,Juergen Rilling,Philippe Charland;SeClone - A Hybrid Approach to Internet-Scale Real-Time Code Clone Search.;http://dx.doi.org/10.1109/ICPC.2011.29;223-224;2;Tool Demonstrations;
2011;Heidar Pirzadeh,Sara Shanian,Abdelwahab Hamou-Lhadj,Ali Mehrabian;The Concept of Stratified Sampling of Execution Traces.;http://dx.doi.org/10.1109/ICPC.2011.17;225-226;2;Tool Demonstrations;
2011;Andrew Begel,Jochen Quante;Industrial Program Comprehension Challenge 2011: Archeology and Anthropology of Embedded Control Systems.;http://dx.doi.org/10.1109/ICPC.2011.50;227-229;3;Industrial Challenge;
2011;Nasir Ali;Trustrace: Improving Automated Trace Retrieval through Resource Trust Analysis.;http://dx.doi.org/10.1109/ICPC.2011.55;230-233;4;Student Symposium;
2011;Sonia Haiduc,Andrian Marcus;On the Effect of the Query in IR-based Concept Location.;http://dx.doi.org/10.1109/ICPC.2011.48;234-237;4;Student Symposium;
2011;Soumaya Medini;Scalable Automatic Concept Mining from Execution Traces.;http://dx.doi.org/10.1109/ICPC.2011.44;238-241;4;Student Symposium;
2011;Manishankar Mondal,Md. Saidur Rahman 0002,Ripon Kumar Saha,Chanchal Kumar Roy,Jens Krinke,Kevin A. Schneider;An Empirical Study of the Impacts of Clones in Software Maintenance.;http://dx.doi.org/10.1109/ICPC.2011.14;242-245;4;Student Symposium;
2011;Scott David Ohlemacher,Andrian Marcus;Towards a Benchmark and Automatic Calibration for IR-Based Concept Location.;http://dx.doi.org/10.1109/ICPC.2011.56;246-249;4;Student Symposium;
2011;Chandan Raj Rupakheti,Daqing Hou;Satisfying Programmers' Information Needs in API-Based Programming.;http://dx.doi.org/10.1109/ICPC.2011.16;250-253;4;Student Symposium;
2011;Zohreh Sharafi;A Systematic Analysis of Software Architecture Visualization Techniques.;http://dx.doi.org/10.1109/ICPC.2011.40;254-257;4;Student Symposium;
2011;Zephyrin Soh;Context and Vision: Studying Two Factors Impacting Program Comprehension.;http://dx.doi.org/10.1109/ICPC.2011.37;258-261;4;Student Symposium;
2011;Wei Wu;Modeling Framework API Evolution as a Multi-objective Optimization Problem.;http://dx.doi.org/10.1109/ICPC.2011.43;262-265;4;Student Symposium;
2011;Minhaz Fahim Zibran,Chanchal Kumar Roy;Conflict-Aware Optimal Scheduling of Code Clone Refactoring: A Constraint Programming Approach.;http://dx.doi.org/10.1109/ICPC.2011.45;266-269;4;Student Symposium;
2010;Jean-Remy Falleri,Marianne Huchard,Mathieu Lafourcade,Clementine Nebut,Violaine Prince,Michel Dao;Automatic Extraction of a WordNet-Like Identifier Network from Software.;http://dx.doi.org/10.1109/ICPC.2010.12;4-13;10;Collecting Information;
2010;Meghan Revelle,Bogdan Dit,Denys Poshyvanyk;Using Data Fusion and Web Mining to Support Feature Location in Software.;http://dx.doi.org/10.1109/ICPC.2010.10;14-23;10;Collecting Information;
2010;Alberto Bacchelli,Marco D'Ambros,Michele Lanza;Extracting Source Code from E-Mails.;http://dx.doi.org/10.1109/ICPC.2010.47;24-33;10;Collecting Information;
2010;Janet Feigenspan,Christian Kastner,Mathias Frisch,Raimund Dachselt,Sven Apel;Visual Support for Understanding Product Lines.;http://dx.doi.org/10.1109/ICPC.2010.15;34-35;2;Tool Demonstrations;
2010;Petru Florin Mihancea;Patrools: Visualizing the Polymorphic Usage of Class Hierarchies.;http://dx.doi.org/10.1109/ICPC.2010.35;36-37;2;Tool Demonstrations;
2010;Patricia Jablonski,Daqing Hou;Renaming Parts of Identifiers Consistently within Code Clones.;http://dx.doi.org/10.1109/ICPC.2010.23;38-39;2;Tool Demonstrations;
2010;Dirk Beyer 0001,Ashgan Fararooy;DepDigger: A Tool for Detecting Complex Low-Level Dependencies.;http://dx.doi.org/10.1109/ICPC.2010.52;40-41;2;Tool Demonstrations;
2010;Dirk Beyer 0001,Ashgan Fararooy;CheckDep: A Tool for Tracking Software Dependencies.;http://dx.doi.org/10.1109/ICPC.2010.51;42-43;2;Tool Demonstrations;
2010;Andrzej Olszak,Bo Norregaard Jorgensen;Featureous: A Tool for Feature-Centric Analysis of Java Software.;http://dx.doi.org/10.1109/ICPC.2010.27;44-45;2;Tool Demonstrations;
2010;Domenico Amalfitano,Anna Rita Fasolino,Armando Polcaro,Porfirio Tramontana;DynaRIA: A Tool for Ajax Web Application Comprehension.;http://dx.doi.org/10.1109/ICPC.2010.16;46-47;2;Tool Demonstrations;
2010;Mario Luca Bernardi,Giuseppe A. Di Lucca;The ConAn Tool to Identify Crosscutting Concerns in Object Oriented Systems.;http://dx.doi.org/10.1109/ICPC.2010.34;48-49;2;Tool Demonstrations;
2010;Daniel Rolls,Carl Joslin,Sven-Bodo Scholz;Unibench: A Tool for Automated and Collaborative Benchmarking.;http://dx.doi.org/10.1109/ICPC.2010.36;50-51;2;Tool Demonstrations;
2010;Lerina Aversano,Fiammetta Marulli,Maria Tortorella;Recovering Traceability Links between Business Process and Software System Components.;http://dx.doi.org/10.1109/ICPC.2010.54;52-53;2;Posters;
2010;Sandro Boccuzzo,Harald C. Gall;Multi-touch for Software Exploration.;http://dx.doi.org/10.1109/ICPC.2010.30;54-55;2;Posters;
