2007;Minh Ngoc Ngo,Hee Beng Kuan Tan;Empirical-based recovery and maintenance of input error-correction features.;419-450;32;Volume 19, Number 6, November/December 2007;
2006;Stephen Cook,Rachel Harrison,Meir M. Lehman,Paul Wernick;Evolution in software systems: foundations of the SPE classification scheme.;1-35;35;Volume 18, Number 1, January - February 2006;
2006;Stephane Ducasse,Oscar Nierstrasz,Matthias Rieger;On the effectiveness of clone detection by string matching.;37-58;22;Volume 18, Number 1, January - February 2006;
2006;Vaclav Rajlich,Tibor Gyimothy;IEEE International Conference on Software Maintenance (ICSM2005).;59-60;2;Volume 18, Number 2, March - April 2006;
2006;Cory Kapser,Michael W. Godfrey;Supporting the analysis of clones in software systems.;61-82;22;Volume 18, Number 2, March - April 2006;
2006;Danny Dig,Ralph E. Johnson;How do APIs evolve? A story of refactoring.;83-107;25;Volume 18, Number 2, March - April 2006;
2006;Ronny Kolb,Dirk Muthig,Thomas Patzke,Kazuyuki Yamauchi;Refactoring a legacy component for reuse in a software product line: a case study.;109-132;24;Volume 18, Number 2, March - April 2006;
2006;Slinger Jansen,Gerco Ballintijn,Sjaak Brinkkemper,Arco van Nieuwland;Integrated development and maintenance for the release, delivery, deployment, and customization of product software: a case study in mass-market ERP software.;133-151;19;Volume 18, Number 2, March - April 2006;
2006;Paolo Tonella,Filippo Ricca,Emanuele Pianta,Christian Girardi;Automatic support for the alignment of multilingual Web sites.;153-179;27;Volume 18, Number 3, May - June 2006;
2006;Qianxiang Wang,Junrong Shen,Xiaopeng Wang,Hong Mei;A component-based approach to online software evolution.;181-205;25;Volume 18, Number 3, May - June 2006;
2006;Tudor Girba,Stephane Ducasse;Modeling history to analyze software evolution.;207-236;30;Volume 18, Number 3, May - June 2006;
2006;Hector M. Olague,Letha H. Etzkorn,Wei Li 0014,Glenn W. Cox;Assessing design instability in iterative (agile) object-oriented projects.;237-266;30;Volume 18, Number 4, July - August 2006;
2006;Stanislaw Jarzabek,Shubiao Li;Unifying clones with a generative programming technique: a case study.;267-292;26;Volume 18, Number 4, July - August 2006;
2006;Susanna Pantsar-Syvaniemi,Jorma Taramaa,Eila Niemela;Organizational evolution of digital signal processing software development.;293-305;13;Volume 18, Number 4, July - August 2006;
2006;Carolyn B. Seaman;Managing Corporate Information Systems Evolution and Maintenance.;307-309;3;Volume 18, Number 4, July - August 2006;
2006;Liguo Yu;Indirectly predicting the maintenance effort of open-source software.;311-332;22;Volume 18, Number 5, September - October 2006;
2006;Frederick T. Sheldon,Hong Chung;Measuring the complexity of class diagrams in reverse engineering.;333-350;18;Volume 18, Number 5, September - October 2006;
2006;Christian Del Rosso;Continuous evolution through software architecture evaluation: a case study.;351-383;33;Volume 18, Number 5, September - October 2006;
2006;Pankaj Bhatt,Gautam Shroff,C. Anantaram,Arun Kumar Misra;An influence model for factors in outsourced software maintenance.;385-423;39;Volume 18, Number 6, November - December 2006;
2006;Orla Greevy,Stephane Ducasse,Tudor Girba;Analyzing software evolution through feature views.;425-456;32;Volume 18, Number 6, November - December 2006;
2006;Sharon Simmons,Dennis Edwards,Norman Wilde,Josh Homan,Michael Groble;Industrial tools for the feature location problem: an exploratory study.;457-474;18;Volume 18, Number 6, November - December 2006;
2005;Shari Lawrence Pfleeger,Chris Verhoef,Johannes C. van Vliet;Analyzing the Evolution of Large-Scale Software.;1-2;2;Volume 17, Number 1, January-February 2005;
2005;Reinder J. Bril,Rene L. Krikhaar,Andre Postma;Architectural support in industry: a reflection using C-POSH.;3-25;23;Volume 17, Number 1, January-February 2005;
2005;Atif M. Memon,Adithya Nagarajan,Qing Xie;Automating regression testing for evolving GUI software.;27-64;38;Volume 17, Number 1, January-February 2005;
2005;Allen P. Nikora,John C. Munson;An approach to the measurement of software evolution.;65-91;27;Volume 17, Number 1, January-February 2005;
2005;Awais Rashid,Peter Sawyer;A database evolution taxonomy for object-oriented databases.;93-141;49;Volume 17, Number 2, March-April 2005;
2005;Dwight J. Makaroff,Norman C. Hutchinson;Development and evolution of a heterogeneous continuous media server: a case study.;143-167;25;Volume 17, Number 2, March-April 2005;
2005;Jehad Al-Dallal,Paul G. Sorenson;Reusing class-based test cases for testing object-oriented framework interface classes.;169-196;28;Volume 17, Number 3, May-June 2005;
2005;Alain April,Jane Huffman Hayes,Alain Abran,Reiner R. Dumke;Software Maintenance Maturity Model (SMmm): the software maintenance process model.;197-223;27;Volume 17, Number 3, May-June 2005;
2005;Marcela Genero Bocco,Daniel L. Moody,Mario Piattini Velthius;Assessing the capability of internal metrics as early indicators of maintenance effort through experimentation.;225-246;22;Volume 17, Number 3, May-June 2005;
2005;Tom Mens,Niels Van Eetvelde,Serge Demeyer,Dirk Janssens;Formalizing refactorings with graph transformations.;247-276;30;Volume 17, Number 4, July-August 2005;
2005;Jilles van Gurp,Sjaak Brinkkemper,Jan Bosch;Design preservation over subsequent releases of a software product: a case study of Baan ERP.;277-306;30;Volume 17, Number 4, July-August 2005;
2005;Gunter Kniesel,Robert E. Filman;Unanticipated Software Evolution.;307-308;2;Volume 17, Number 5, September - October 2005;
2005;Jim Buckley,Tom Mens,Matthias Zenger,Awais Rashid,Gunter Kniesel;Towards a taxonomy of software change.;309-332;24;Volume 17, Number 5, September - October 2005;
2005;Matthias Zenger;KERIS: evolving software with extensible modules.;333-362;30;Volume 17, Number 5, September - October 2005;
2005;Jiri Adamek,Frantisek Plasil;Component composition errors and update atomicity: static analysis.;363-377;15;Volume 17, Number 5, September - October 2005;
2005;Nadine Hanebutte,Paul W. Oman;Software vulnerability mitigation as a proper subset of software maintenance.;379-400;22;Volume 17, Number 6, November - December 2005;
2005;Emilio Bellini,Gerardo Canfora,Felix Garcia,Mario Piattini Velthius,Corrado Aaron Visaggio;Pair designing as practice for enforcing and diffusing design knowledge.;401-423;23;Volume 17, Number 6, November - December 2005;
2004;Cornelia Boldyreff,Paolo Tonella;Web Site Evolution.;1-4;4;Volume 16, Number 1-2, January-April 2004;
2004;Janet Lavery,Cornelia Boldyreff,Bin Ling,Colin Allison;Modelling the evolution of legacy systems to Web-based systems.;5-30;26;Volume 16, Number 1-2, January-April 2004;
2004;Scott R. Tilley,John Gerdes Jr.,Terrance Hamilton,Shihong Huang,Hausi A. Muller,Dennis B. Smith,Kenny Wong;On the business value and technical challenges of adopting Web services.;31-50;20;Volume 16, Number 1-2, January-April 2004;
2004;Marin Litoiu;Migrating to Web services: a performance engineering approach.;51-70;20;Volume 16, Number 1-2, January-April 2004;
2004;Giuseppe A. Di Lucca,Anna Rita Fasolino,Porfirio Tramontana;Reverse engineering Web applications: the WARE approach.;71-101;31;Volume 16, Number 1-2, January-April 2004;
2004;Paolo Tonella,Filippo Ricca;Statistical testing of Web applications.;103-127;25;Volume 16, Number 1-2, January-April 2004;
2004;Mohammad El-Ramly,Eleni Stroulia;Analysis of Web-usage behavior for focused Web sites: a case study.;129-150;22;Volume 16, Number 1-2, January-April 2004;
2004;Francoise Balmas;Displaying dependence graphs: a hierarchical approach.;151-185;35;Volume 16, Number 3, May-June 2004;
2004;Jussi Koskinen,Airi Salminen,Jukka Paakki;Hypertext support for the information needs of software maintainers.;187-215;29;Volume 16, Number 3, May-June 2004;
2004;Mark van den Brand,Gerardo Canfora,Tibor Gyimothy;Seventh European Conference on Software Maintenance and Reengineering (CSMR 2003).;217-218;2;Volume 16, Number 4-5, July-October 2004;
2004;Niels P. Veerman;Revitalizing modifiability of legacy assets.;219-254;36;Volume 16, Number 4-5, July-October 2004;
2004;Lerina Aversano,Maria Tortorella;An assessment strategy for identifying legacy system evolution requirements in eBusiness context.;255-276;22;Volume 16, Number 4-5, July-October 2004;
2004;Marcos Lordello Chaim,Jose Carlos Maldonado,Mario Jino;A debugging strategy based on the requirements of testing.;277-308;32;Volume 16, Number 4-5, July-October 2004;
2004;Mira Kajko-Mattsson;Problems within front-end support.;309-329;21;Volume 16, Number 4-5, July-October 2004;
2004;Ladan Tahvildari,Kostas Kontogiannis;Improving design quality using meta-pattern transformations: a metric-based approach.;331-361;31;Volume 16, Number 4-5, July-October 2004;
2004;Tom Mens,Juan Fernandez-Ramil,Michael W. Godfrey;Analyzing the Evolution of Large-Scale Software.;363-365;3;Volume 16, Number 6, November-December 2004;
2004;Daniel M. German;Using software trails to reconstruct the evolution of software.;367-384;18;Volume 16, Number 6, November-December 2004;
2004;Michael Fischer,Harald C. Gall;Visualizing feature evolution of large-scale software based on problem and modification report data.;385-403;19;Volume 16, Number 6, November-December 2004;
2004;James F. Power,Brian A. Malloy;A metrics suite for grammar-based software.;405-426;22;Volume 16, Number 6, November-December 2004;
2004;Michael P. O'Brien,Jim Buckley,Teresa M. Shaft;Expectation-based, inference-based, and bottom-up software comprehension.;427-447;21;Volume 16, Number 6, November-December 2004;
2003;Ioana Rus,Carolyn B. Seaman,Mikael Lindvall;Process diversity.;1-8;8;Volume 15, Number 1, January-February 2003;
2003;Nils T. Siebel,Stephen Cook,Manoranjan Satpathy,Daniel Rodriguez;Latitudinal and longitudinal process diversity.;9-25;17;Volume 15, Number 1, January-February 2003;
2003;Paolo Donzelli;Tailoring the software maintenance process to better support complex systems evolution projects.;27-40;14;Volume 15, Number 1, January-February 2003;
2003;Per Runeson,Carina Andersson,Martin Host;Test processes in software product evolution - a qualitative survey on the state of practice.;41-59;19;Volume 15, Number 1, January-February 2003;
2003;M. Taylor;Maintaining electronic commerce systems: the legal issues.;61-69;9;Volume 15, Number 2, March-April 2003;
2003;Yunsik Ahn,Jungseok Suh,Seungryeol Kim,Hyunsoo Kim;The software maintenance project effort estimation model based on function points.;71-85;15;Volume 15, Number 2, March-April 2003;
2003;Rainer Koschke;Software visualization in software maintenance, reverse engineering, and re-engineering: a research survey.;87-109;23;Volume 15, Number 2, March-April 2003;
2003;Chih-Wei Lu,William Cheng-Chung Chu,Chih-Hung Chang,Don-Lin Yang,Wen-Da Lian;Integrating diverse paradigms in evolution and maintenance by an XML-based unified model.;111-114;4;Volume 15, Number 3, May-June 2003;
2003;Lawrence Chung,Nary Subramanian;Architecture-based semantic evolution of embedded remotely controlled systems.;145-190;46;Volume 15, Number 3, May-June 2003;
2003;Xiaoni Zhang,John C. Windsor,Robert J. Pavur;Determinants of software volatility: a field study.;191-204;14;Volume 15, Number 3, May-June 2003;
2003;Ettore Merlo,Ian McAdam,Renato de Mori;Feed-forward and recurrent neural networks for source code informal information analysis.;205-244;40;Volume 15, Number 4, July-August 2003;
2003;Susan Bergin,John Keating;A case study on the adaptive maintenance of an Internet application.;254-264;11;Volume 15, Number 4, July-August 2003;
2003;Kamran Sartipi,Kostas Kontogiannis;A user-assisted approach to component clustering.;265-295;31;Volume 15, Number 4, July-August 2003;
2003;Jane Huffman Hayes,Naresh Mohamed,Tina Hong Gao;Observe-mine-adopt (OMA): an agile way to enhance software maintainability.;297-323;27;Volume 15, Number 5, September-October 2003;
2003;Masoud Rahgozar,Farhad Oroumchian;An effective strategy for legacy systems evolution.;325-344;20;Volume 15, Number 5, September-October 2003;
2003;Stephane Ducasse,Sander Tichelaar;Dimensions of reengineering environment infrastructures.;345-373;29;Volume 15, Number 5, September-October 2003;
2003;Carolyn B. Seaman;Advances in Software Maintenance Management: Technologies and Solutions.;375-377;3;Volume 15, Number 5, September-October 2003;
2003;Hee Beng Kuan Tan,Yuan Zhao;Automated elicitation of inclusion dependencies from the source code for database transactions.;379-392;14;Volume 15, Number 6, November-December 2003;
2003;Keith Gallagher,Mark Harman,Sebastian Danicic;Guaranteed inconsistency avoidance during software evolution.;393-416;24;Volume 15, Number 6, November-December 2003;
2002;Michael Goedicke,Uwe Zdun;Piecemeal legacy migrating with an architectural pattern language: a case study.;1-30;30;Volume 14, Number 1, January/Februar 2002;
2002;Alain Abran,Ilionar Silva,Laura Primera;Field studies using functional size measurement in building estimation models for software maintenance.;31-64;34;Volume 14, Number 1, January/Februar 2002;
2002;Dowming Yeh,Jing-Hwa Jeng;An empirical study of the influence of departmentalization and organizational position on software maintenance.;65-82;18;Volume 14, Number 1, January/Februar 2002;
2002;Jussi Koskinen;Experimental evaluation of hypertext access structures.;83-108;26;Volume 14, Number 2, March/April 2002;
2002;Mark John Taylor,J. McWilliam,J. Sheehan,A. Mulhaney;Maintenance issues in the Web site development process.;109-122;14;Volume 14, Number 2, March/April 2002;
2002;Magne Jorgensen,Dag I. K. Sjoberg;Impact of experience on maintenance skills.;123-146;24;Volume 14, Number 2, March/April 2002;
2002;Frederick T. Sheldon,Kshamta Jerath,Hong Chung;Metrics for maintainability of class inheritance hierarchies.;147-160;14;Volume 14, Number 3, May/June 2002;
2002;B. Stewart;Predicting project delivery rates using the Naive-Bayes classifier.;161-179;19;Volume 14, Number 3, May/June 2002;
2002;V. Balaji,B. Sangeetha;Testing and maintaining de-localized software systems in a multi-site environment using Web-based tools.;181-195;15;Volume 14, Number 3, May/June 2002;
2002;Mira Kajko-Mattsson;Problem management maturity within corrective maintenance.;197-227;31;Volume 14, Number 3, May/June 2002;
2002;Lerina Aversano,Gerardo Canfora,Andrea De Lucia,Silvio Stefanucci;Automating the management of software maintenance workflows in a large software enterprise: a case study.;229-255;27;Volume 14, Number 4, July/August 2002;
2002;Katja Cremer,Andre Marburger,Bernhard Westfechtel;Graph-based tools for re-engineering.;257-292;36;Volume 14, Number 4, July/August 2002;
2002;Letha H. Etzkorn,Sampson Gholston,William E. Hughes Jr.;A semantic entropy metric.;293-310;18;Volume 14, Number 4, July/August 2002;
2002;Tom Mens,Michel Wermelinger;Separation of concerns for software evolution.;311-315;5;Volume 14, Number 5, 2002;
2002;Jianjun Zhao,Hongji Yang,Liming Xiang,Baowen Xu;Change impact analysis to support architectural evolution.;317-333;17;Volume 14, Number 5, 2002;
2002;Meir M. Lehman,Goel Kahen,Juan Fernandez-Ramil;Behavioural modelling of long-lived evolution processes - some issues and an example.;335-351;17;Volume 14, Number 5, 2002;
2002;Luis Filipe Andrade,Jose Luiz Fiadeiro,Joao Gouveia,Georgios Koutsoukos;Separating computation, coordination and configuration.;353-369;17;Volume 14, Number 5, 2002;
2002;Reiko Heckel,Gregor Engels;Relating functional requirements and software architecture: separation and consistency of concerns.;371-388;18;Volume 14, Number 5, 2002;
2002;Lina Garcia-Cabrera,Maria Jose Rodriguez-Fortiz,Jose Parets-Llorca;Evolving hypermedia systems: a layered software architecture.;389-405;17;Volume 14, Number 5, 2002;
2002;Jon Heales;A model of factors affecting an information system's change in state.;409-427;19;Volume 14, Number 6, November/December 2002;
2002;Matthew S. Harrison,Gwendolyn H. Walton;Identifying high maintenance legacy software.;429-446;18;Volume 14, Number 6, November/December 2002;
2002;Jesus Bisbal,Jane Grimson;Consistent database sampling as a database prototyping approach.;447-459;13;Volume 14, Number 6, November/December 2002;
2001;Ned Chapin,Aniello Cimitile;Announcement.;1-2;2;Volume 13, Number 1, January/February 2001;
2001;Ned Chapin,Joanne E. Hale,Md. Khaled Khan,Juan Fernandez-Ramil,Wui-Gee Tan;Types of software evolution and software maintenance.;3-30;28;Volume 13, Number 1, January/February 2001;
2001;Yang Li,Hongji Yang,William Cheng-Chung Chu;A concept-oriented belief revision approach to domain knowledge recovery from source code.;31-52;22;Volume 13, Number 1, January/February 2001;
2001;Hee Beng Kuan Tan,Juan Tiang Kow;An approach for extracting code fragments that implement functionality from source programs.;53-75;23;Volume 13, Number 1, January/February 2001;
2001;Macario Polo Usaola,Mario Piattini Velthius,Francisco Ruiz 0001;MANTOOL: a tool for supporting the software maintenance process.;77-95;19;Volume 13, Number 2, March/April 2001;
2001;Miroslav Popovic,Branislav Atlagic,Vladimir Kovacevic;Case study: a maintenance practice used with real-time telecommunications software.;97-126;30;Volume 13, Number 2, March/April 2001;
2001;Shuanglin Wang,Stephen R. Schach,Gillian Z. Heller;A case study in repeated maintenance.;127-141;15;Volume 13, Number 2, March/April 2001;
2001;Carolyn B. Seaman;Software Maintenance: Concepts and Practice.;143-147;5;Volume 13, Number 2, March/April 2001;
2001;Maria Tortorella,Giuseppe Visaggio;Evaluation of a scenario-based reading technique for analysing process components.;149-166;18;Volume 13, Number 3, May/June 2001;
2001;Magnus C. Ohlsson,Anneliese von Mayrhauser,Claes Wohlin;Modelling fault-proneness statistically over a sequence of releases: a case study.;167-199;33;Volume 13, Number 3, May/June 2001;
2001;Girish Parikh,Ned Chapin;Interview with Girish Parikh.;201-221;21;Volume 13, Number 3, May/June 2001;
2001;Takuya Uemura,Shinji Kusumoto,Katsuro Inoue;Function-point analysis using design specifications based on the Unified Modelling Language.;223-243;21;Volume 13, Number 4, July/August 2001;
2001;Rex Eugene Pereira;A model of factors affecting an information system's change in state.;245-261;17;Volume 13, Number 4, July/August 2001;
2001;Sue Black;Computing ripple effect for software maintenance.;263-279;17;Volume 13, Number 4, July/August 2001;
2001;Giuseppe Visaggio;Ageing of a data-intensive legacy system: symptoms and remedies.;281-308;28;Volume 13, Number 5, September/October 2001;
2001;Paolo Tonella,Giuliano Antoniol;Inference of object-oriented design patterns.;309-330;22;Volume 13, Number 5, September/October 2001;
2001;Yoon Kyu Jang,Malcolm Munro,Yong Rae Kwon;An improved method of selecting regression tests for C++ programs.;331-350;20;Volume 13, Number 5, September/October 2001;
2001;Guy Gable,Taizan Chan,Wui-Gee Tan;Large packaged application software maintenance: a research framework.;351-371;21;Volume 13, Number 6, November/December 2001;
2001;Sabine Gabriele Hirt,E. Burton Swanson;Emergent maintenance of ERP: new roles and relationships.;373-38;-334;Volume 13, Number 6, November/December 2001;
2001;Fiona Fui-Hoon Nah,Silvana Faja,Teuta Cata;Characteristics of ERP software maintenance: a multiple case study.;399-414;16;Volume 13, Number 6, November/December 2001;
2001;Ben Light;The maintenance implications of the customization of ERP software.;415-429;15;Volume 13, Number 6, November/December 2001;
2001;Celeste See-Pui Ng;A decision framework for enterprise resource planning maintenance and upgrade: A client perspective.;431-468;38;Volume 13, Number 6, November/December 2001;
2001;Izzet Sahin,Fatemeh Zahedi;Policy analysis for warranty, maintenance, and upgrade of software systems.;469-493;25;Volume 13, Number 6, November/December 2001;
2000;Michelangelo Interesse;Preventive actions for residual Y2K defects: a case study.;1-23;23;Volume 12, Number 1, January/February 2000;
2000;Stephen R. Schach,Amir Tomer;A maintenance-oriented approach to software construction.;25-45;21;Volume 12, Number 1, January/February 2000;
2000;Giovanni Cantone;Measure-driven processes and architecture for the empirical evaluation of software technology.;47-78;32;Volume 12, Number 1, January/February 2000;
2000;Michael Mattsson,Jan Bosch;Stability assessment of evolving industrial object-oriented frameworks.;79-102;24;Volume 12, Number 2, March/April 2000;
2000;Frank Niessink,Johannes C. van Vliet;Software maintenance from a service perspective.;103-120;18;Volume 12, Number 2, March/April 2000;
2000;William Cheng-Chung Chu,Chih-Wei Lu,Chih-Peng Shiu,Xudong He;Pattern-based software reengineering: a case study.;121-141;21;Volume 12, Number 2, March/April 2000;
2000;Reinder J. Bril,Loe M. G. Feijs,Andre Glas,Rene L. Krikhaar,Thijs Winter;Maintaining a legacy: towards support at the architectural level.;143-170;28;Volume 12, Number 3, May/June 2000;
2000;Sebastian G. Elbaum,John C. Munson;Evaluating regression test suites based on their fault exposure capability.;171-184;14;Volume 12, Number 3, May/June 2000;
2000;Johannes C. van Vliet;Review of Frank Niessink's thesis.;185;1;Volume 12, Number 3, May/June 2000;
2000;Ned Chapin;Review of Perspectives on Improving Software Maintenance by Frank Niessink.;187-195;9;Volume 12, Number 3, May/June 2000;
2000;Hongji Yang,Xiaodong Liu,Hussein Zedan;Abstraction: a key notion for reverse engineering in a system reengineering approach.;197-228;32;Volume 12, Number 4, July/August 2000;
2000;Joel E. Henry;Test case selection for simulations in the maintenance of real-time systems.;229-248;20;Volume 12, Number 4, July/August 2000;
2000;Carolyn B. Seaman;Practical Software Maintenance.;249-253;5;Volume 12, Number 4, July/August 2000;
2000;Mira Kajko-Mattsson,Stefan Forssander,Gunnar Andersson II;Software problem reporting and resolution process at ABB Robotics AB: state of practice.;255-285;31;Volume 12, Number 5, September/October 2000;
2000;Anneliese von Mayrhauser,Magnus C. Ohlsson,Claes Wohlin;Deriving fault architectures from defect history.;287-304;18;Volume 12, Number 5, September/October 2000;
2000;Doris L. Carver,Ramachenga R. Valasareddi;Object localization in procedural programs: a graph-based approach.;305-323;19;Volume 12, Number 5, September/October 2000;
2000;William Cheng-Chung Chu,Chih-Wei Lu,Hongji Yang,Xudong He;A formal approach for component retrieval and integration analysis.;325-342;18;Volume 12, Number 6, November/December 2000;
2000;Anna Rita Fasolino,Domenico Natale,Alessio Poli,Alessandro Alberigi Quaranta;Metrics in the development and maintenance of software: an application in a large scale environment.;343-355;13;Volume 12, Number 6, November/December 2000;
2000;David J. Carney,Scott A. Hissam,Daniel Plakosh;Complex COTS-based software systems: practical steps for their maintenance.;357-376;20;Volume 12, Number 6, November/December 2000;
1999;Taghi M. Khoshgoftaar,Edward B. Allen,Wendell D. Jones,John P. Hudepohl;Which Software Modules have Faults which will be Discovered by Customers?;1-18;18;Volume 11, Number 1, January/February 1999;
1999;Nashat Mansour,Khaled El-Fakih;Simulated Annealing and Genetic Algorithms for Optimal Regression Testing.;19-34;16;Volume 11, Number 1, January/February 1999;
1999;Jagadeesh Nandigam,Arun Lakhotia,Claude G. Cech;Experimental Evaluation of Agreement among Programmers in Applying the Rules of Cohesion.;35-53;19;Volume 11, Number 1, January/February 1999;
1999;Elaine H. Ferneley;Design Metrics as an Aid to Software Maintenance: An Empirical Study.;55-72;18;Volume 11, Number 1, January/February 1999;
1999;Joanne E. Hale,Shane Sharpe,David P. Hale;An evaluation of the cognitive processes of programmers engaged in software debugging.;73-91;19;Volume 11, Number 2, March/April 1999;
1999;Anneliese von Mayrhauser,Ning Zhang;Automated regression testing using DBT and ;93-116;24;Volume 11, Number 2, March/April 1999;
1999;Paolo Tonella,Giuliano Antoniol,Roberto Fiutem,Ettore Merlo;Variable-precision reaching definitions analysis.;117-142;26;Volume 11, Number 2, March/April 1999;
1999;Jeffrey M. Voas;Disposable information systems: the future of software maintenance?;143-150;8;Volume 11, Number 2, March/April 1999;
1999;Uwe Krohn,Cornelia Boldyreff;Application of cluster algorithms for batching of proposed software changes.;151-165;15;Volume 11, Number 3, May/June 1999;
1999;Norman Wilde,Randy Justice,Kristin Blackwell,W. Eric Wong;Dynamic analysis methods for the year 2000 problem.;167-182;16;Volume 11, Number 3, May/June 1999;
1999;Scott A. Hissam,David J. Carney;Isolating faults in complex COTS-based systems.;183-199;17;Volume 11, Number 3, May/June 1999;
1999;Nicolas Anquetil,Timothy C. Lethbridge;Recovering software architecture from the names of source files.;201-221;21;Volume 11, Number 3, May/June 1999;
1999;Richard Fanta,Vaclav Rajlich;Removing clones from the code.;223-243;21;Volume 11, Number 4, July/August 1999;
1999;Byung-Kyoo Kang,James M. Bieman;A quantitative framework for software restructuring.;245-284;40;Volume 11, Number 4, July/August 1999;
1999;Sami Zahran;Software process improvement: practical guidelines for business success, Addison Wesley Longman, UK, 1997, 447 pp.;285-291;7;Volume 11, Number 4, July/August 1999;
1999;George E. Stark,Paul W. Oman,Alan Skillicorn,Alan Ameele;An examination of the effects of requirements changes on software maintenance releases.;293-309;17;Volume 11, Number 5, September/October 1999;
1999;Hai Huang,Wei-Tek Tsai;VSAM conversion for COBOL programs.;311-337;27;Volume 11, Number 5, September/October 1999;
