2012;Volker Ovi Bachmann,Richard Messnarz;Improving the software development for multiple projects by applying a platform strategy for mechatronic systems.;541-549;9;Volume 24, Number 5, August 2012;
2012;Andreas Riel,Anca Draghici,George Draghici,Damian Grajewski,Richard Messnarz;Process and product innovation needs integrated engineering collaboration skills.;551-560;10;Volume 24, Number 5, August 2012;
2012;Padraig O'Leary,Fergal McCaffery,Steffen Thiel,Ita Richardson;An agile process model for product derivation in software product line engineering.;561-571;11;Volume 24, Number 5, August 2012;
2012;Elli Georgiadou,Kerstin V. Siakas;KASL-II: a dynamic four-loop model for knowledge sharing and learning.;573-583;11;Volume 24, Number 5, August 2012;
2012;Alain Abran,Jean-Marc Desharnais,Juan Jose Cuadrado-Gallego;Measurement and quantification are not the same: ISO 15939 and ISO 9126.;585-601;17;Volume 24, Number 5, August 2012;
2012;Allen Milewski,Alberto Avritzer,Yael Dubinsky;Special issue on global software engineering.;603-604;2;Volume 24, Number 6, October 2012;
2012;Darja Smite,Claes Wohlin;Lessons learned from transferring software products to India.;605-623;19;Volume 24, Number 6, October 2012;
2012;Fabio Q. B. da Silva,Rafael Prikladnicki,A. Cesar C. Franca,Cleviton V. F. Monteiro,Catarina Costa,Rodrigo G. C. Rocha;An evidence-based model of distributed software development project management: results from a systematic mapping study.;625-642;18;Volume 24, Number 6, October 2012;
2012;Samireh Jalali,Claes Wohlin;Global software engineering and agile practices: a systematic review.;643-659;17;Volume 24, Number 6, October 2012;
2012;Ansgar Lamersdorf,Jurgen Munch,Alicia Fernandez del Viso Torre,Carlos Rebate Sanchez,Markus Heinz,H. Dieter Rombach;A rule-based model for customized risk identification and evaluation of task assignment alternatives in distributed software development projects.;661-675;15;Volume 24, Number 6, October 2012;
2012;Tuomas Niinimaki,Arttu Piri,Casper Lassenius,Maria Paasivaara;Reflecting the choice and usage of communication tools in global software development projects with media synchronicity theory.;677-692;16;Volume 24, Number 6, October 2012;
2012;Patricia Lago,Henry Muccini,Muhammad Ali Babar;An empirical study of learning by osmosis in global software engineering.;693-706;14;Volume 24, Number 6, October 2012;
2012;Miguel Jimenez 0002,Aurora Vizcaino Barcelo,Mario Piattini Velthius;Cultural and linguistic problems in GSD: a simulator to train engineers in these issues.;707-717;11;Volume 24, Number 6, October 2012;
2012;Vahid Garousi,Qing Wang;Guest editors' introduction.;719-720;2;Volume 24, Number 7, November 2012;
2012;Xu Bai,LiGuo Huang,He Zhang,Supannika Koolmanojwong;Hybrid modeling and simulation for trustworthy software process management: a stakeholder-oriented approach.;721-740;20;Volume 24, Number 7, November 2012;
2012;He Zhang,Barbara A. Kitchenham,D. Ross Jeffery;Toward trustworthy software process models: an exploratory study on transformable process modeling.;741-763;23;Volume 24, Number 7, November 2012;
2012;Reda Bendraou,Jean-Marc Jezequel,Franck Fleurey;Achieving process modeling and execution through the combination of aspect and model-driven engineering approaches.;765-781;17;Volume 24, Number 7, November 2012;
2012;Qi Li,Ye Yang,Mingshu Li,Qing Wang,Barry W. Boehm,Chenyong Hu;Improving software testing process: feature prioritization to make winners of success-critical stakeholders.;783-801;19;Volume 24, Number 7, November 2012;
2012;Dan X. Houston,Douglas Buettner,Myron Hecht;Defectivity profiling with dynamic COQUALMO: An explication and product quality retrospective.;803-814;12;Volume 24, Number 7, November 2012;
2012;Mubarak Mohammad,Vasu S. Alagar;A component-based development process for trustworthy systems.;815-835;21;Volume 24, Number 7, November 2012;
2012;Lan Cao;Dynamic capability for trustworthy software development.;837-850;14;Volume 24, Number 7, November 2012;
2012;Francisco J. Pino,Francisco Ruiz 0001,Felix Garcia,Mario Piattini Velthius;A software maintenance methodology for small organizations: Agile_MANTEMA.;851-876;26;Volume 24, Number 8, December 2012;
2012;Mahmood Niazi;An exploratory study of software process improvement implementation risks.;877-894;18;Volume 24, Number 8, December 2012;
2012;Zador Daniel Kelemen,Rob J. Kusters,Jos J. M. Trienekens;Identifying criteria for multimodel software process improvement solutions - based on a review of current problems and initiatives.;895-909;15;Volume 24, Number 8, December 2012;
2011;Gerardo Canfora,Darren Dalcher,David Raffo;Preparing for a new era.;1-2;2;Volume 23, Number 1, January 2011;
2011;Claudio Riva,Petri Selonen,Tarja Systa,Jianli Xu;A profile-based approach for maintaining software architecture: an industrial experience report.;3-20;18;Volume 23, Number 1, January 2011;
2011;Chengjie Xiong,Min Xie 0001,Szu Hui Ng;Optimal software maintenance policy considering unavailable time.;21-33;13;Volume 23, Number 1, January 2011;
2011;Bernardo Giori Ambrosio,Jose Luis Braga,Moises A. Resende-Filho;Modeling and scenario simulation for decision support in management of requirements activities in software projects.;35-50;16;Volume 23, Number 1, January 2011;
2011;Nashat Mansour,Husam Takkoush,Ali Nehme;UML-based regression testing for OO software.;51-68;18;Volume 23, Number 1, January 2011;
2011;Uzma Raja,Marietta J. Tretter;Classification of software patches: a text mining approach.;69-87;19;Volume 23, Number 2, March 2011;
2011;Miroslaw Staron,Wilhelm Meding,Goran Karlsson,Christer Nilsson;Developing measurement systems: an industrial case study.;89-107;19;Volume 23, Number 2, March 2011;
2011;Gita Alaghband;Relationship model: a network model for integrating human expertise with systematic distributed processes.;109-135;27;Volume 23, Number 2, March 2011;
2011;Gerardo Canfora,Darren Dalcher,David Raffo,Victor R. Basili,Juan Fernandez-Ramil,Vaclav Rajlich,Keith H. Bennett,Elizabeth Burd,Malcolm Munro,Sophia Drossopoulou,Barry W. Boehm,Susan Eisenbach,Greg Michaelson,Peter Ross,Paul Wernick,Dewayne E. Perry;In memory of Manny Lehman, 'Father of Software Evolution'.;137-144;8;Volume 23, Number 3, April 2011;
2011;Abdallah Mohamed,Gunther Ruhe,Armin Eberlein;Mismatch handling for COTS selection: a case study.;145-178;34;Volume 23, Number 3, April 2011;
2011;Min Zhang 0008,Tracy Hall,Nathan Baddoo;Code Bad Smells: a review of current knowledge.;179-202;24;Volume 23, Number 3, April 2011;
2011;Stefanie Rinderle-Ma,Shazia Wasim Sadiq,Frank Leymann;Special Issue on BPM 2009 Workshops.;203;1;Volume 23, Number 4, June 2011;
2011;Vera Kunzle,Manfred Reichert;PHILharmonicFlows: towards a framework for object-aware process management.;205-244;40;Volume 23, Number 4, June 2011;
2011;Keith Miller,Wendy MacCaull;Model checking timed properties of healthcare processes.;245-260;16;Volume 23, Number 4, June 2011;
2011;Chiara Di Francescomarino,Chiara Ghidini,Marco Rospocher,Luciano Serafini,Paolo Tonella;A framework for the collaborative specification of semantically annotated business processes.;261-295;35;Volume 23, Number 4, June 2011;
2011;Giorgio Bruno,Frank Dengler,Ben Jennings,Rania Khalaf,Selmin Nurcan,Michael Prilla,Marcello Sarini,Rainer Schmidt,Antonio Rito Silva;Key challenges for enabling agile BPM with social software.;297-326;30;Volume 23, Number 4, June 2011;
2011;Sami Kollanus;ICMM - a maturity model for software inspections.;327-341;15;Volume 23, Number 5, August 2011;
2011;Yinglong Ma,Haijiang Wu,Xinyv Ma,Beihong Jin,Tao Huang,Jun Wei;Stable cohesion metrics for evolving ontologies.;343-359;17;Volume 23, Number 5, August 2011;
2011;Chong Hyung Lee,Yong-Ha Kim,Dong Ho Park;Evaluation of multi-tasking software system performance with consideration of module dependency.;361-374;14;Volume 23, Number 5, August 2011;
2011;Susan Ferreira,Dan L. Shunk,James S. Collofello,Gerald T. Mackulak,AmyLou Dueck;Reducing the risk of requirements volatility: findings from an empirical survey.;375-393;19;Volume 23, Number 5, August 2011;
2011;Luis Felipe Salin Monteiro,Kathia Marcal de Oliveira;Defining a catalog of indicators to support process performance analysis.;395-422;28;Volume 23, Number 6, October 2011;
2011;Cristiano Tolfo,Raul Sidnei Wazlawick,Marcelo Gitirana Gomes Ferreira,Fernando A. Forcellini;Agile methods and organizational culture: reflections about cultural levels.;423-441;19;Volume 23, Number 6, October 2011;
2011;Timo Kakola,Mervi Koivulahti-Ojala,Jani Liimatainen;An information systems design product theory for the class of integrated requirements and release management systems.;443-463;21;Volume 23, Number 6, October 2011;
2011;E. S. F. Najumudheen,Rajib Mall,Debasis Samanta;Test coverage analysis based on an object-oriented program model.;465-493;29;Volume 23, Number 7, November 2011;
2011;Mahvish Khurum,Tony Gorschek;A method for alignment evaluation of product strategies among stakeholders (MASS) in software intensive product development.;494-516;23;Volume 23, Number 7, November 2011;
2011;Keith M. Heston,William Phifer;The multiple quality models paradox: how much 'best practice' is just enough?;517-531;15;Volume 23, Number 8, December 2011;
2011;Craig Comstock,Zhizhong Jiang,Jim Davies;Economies and diseconomies of scale in software development.;533-548;16;Volume 23, Number 8, December 2011;
2011;Deepti Mishra,Alok Mishra;Complex software project development: agile methods adoption.;549-564;16;Volume 23, Number 8, December 2011;
2010;Raed Shatnawi,Wei Li 0014,James Swain,Tim Newman;Finding software metrics threshold values using ROC curves.;1-16;16;Volume 22, Number 1, January 2010;
2010;N. G. Lester,F. George Wilkie,Donald McFall,Melanie P. Ware;Investigating the role of CMMI with expanding company size for small- to medium-sized enterprises.;17-31;15;Volume 22, Number 1, January 2010;
2010;Peter Axel Nielsen,Gitte Tjornehoj;Social networks in software process improvement.;33-51;19;Volume 22, Number 1, January 2010;
2010;Nina Dzamashvili-Fogelstrom,Tony Gorschek,Mikael Svahnberg,Peo Olsson;The impact of agile principles on market-driven software product development.;53-80;28;Volume 22, Number 1, January 2010;
2010;Rafael Capilla,Juan C. Duenas,Francisco Nava;Viability for codifying and documenting architectural design decisions with tool support.;81-119;39;Volume 22, Number 2, March 2010;
2010;Stamatia Bibi,Ioannis Stamelos,George Gerolimos,Vangelis Kollias;BBN based approach for improving the software development process of an SME - a case study.;;;Volume 22, Number 2, March 2010;
2010;Ahmed E. Hassan,Andy Zaidman,Massimiliano Di Penta;Introduction to the special issue on reverse engineering (WCRE 2008).;141-142;2;Volume 22, Number 3, April 2010;
2010;Martin P. Robillard,Barthelemy Dagenais;Recommending change clusters to support software investigation: an empirical study.;143-164;22;Volume 22, Number 3, April 2010;
2010;Chanchal Kumar Roy,James R. Cordy;Near-miss function clones in open source software: an empirical study.;165-189;25;Volume 22, Number 3, April 2010;
2010;Adrian Kuhn,David Erni,Peter Loretan,Oscar Nierstrasz;Software Cartography: thematic software visualization with consistent layout.;191-210;20;Volume 22, Number 3, April 2010;
2010;Mariano Ceccato,Thomas Roy Dean,Paolo Tonella,Davide Marchignoli;Migrating legacy data structures based on variable overlay to Java.;211-237;27;Volume 22, Number 3, April 2010;
2010;Terence P. Rout;Software process improvement and capability determination: selected articles from SPICE 2009.;239-241;3;Volume 22, Number 4, June 2010;
2010;Tom McBride;Organisational theory perspective on process capability measurement scales.;243-254;12;Volume 22, Number 4, June 2010;
2010;Fergal McCaffery,Alec Dorling;Medi SPICE development.;255-268;14;Volume 22, Number 4, June 2010;
2010;Risto Nevalainen,Tomas Schweigert;A European scheme for software process improvement manager training and certification.;269-277;9;Volume 22, Number 4, June 2010;
2010;Francisco J. Pino,Maria Teresa Baldassarre,Mario Piattini Velthius,Giuseppe Visaggio;Harmonizing maturity levels from CMMI-DEV and ISO/IEC 15504.;279-296;18;Volume 22, Number 4, June 2010;
2010;Terry Rout;Studies on the assessment process: usage of objective evidence in assessing process capability.;297-305;9;Volume 22, Number 4, June 2010;
2010;Fritz Stallinger,Reinhold Plosch,Gustav Pomberger,Jan Vollmar;Integrating ISO/IEC 15504 conformant process assessment and organizational reuse enhancement.;307-324;18;Volume 22, Number 4, June 2010;
2010;Andreas Jedlitschka,Outi Salo,Frank Bomarius;Process Management.;325-328;4;Volume 22, Number 5, August 2010;
2010;Maya Daneva;Balancing uncertainty of context in ERP project estimation: an approach and a case study.;329-357;29;Volume 22, Number 5, August 2010;
2010;Anita Gupta,Daniela Cruzes,Forrest Shull,Reidar Conradi,Harald Ronneberg,Einar Landre;An examination of change profiles in reusable and non-reusable software systems.;359-380;22;Volume 22, Number 5, August 2010;
2010;Jens Heidrich,Jurgen Munch;Goal-oriented customization of software cockpits.;381-405;25;Volume 22, Number 5, August 2010;
2010;Ana Magazinius,Joakim Pernstal,Peter Ohman;Software cost estimation inhibitors - a case study in automotive context.;407-427;21;Volume 22, Number 5, August 2010;
2010;Massimo Mecella,Jian Yang;Introduction to the Special Issue with Best Papers from BPM 2008 Workshops.;431-434;4;Volume 22, Numbers 6-7, October - November 2010;
2010;Silvana Quaglini;Information and communication technology for process management in healthcare: a contribution to change the culture of blame.;435-448;14;Volume 22, Numbers 6-7, October - November 2010;
2010;Selim Erol,Michael Granitzer,Simone Happ,Sami Jantunen,Ben Jennings,Paul Johannesson,Agnes Koschmider,Selmin Nurcan,Davide Rossi,Rainer Schmidt;Combining BPM and social software: contradiction or chance?;449-476;28;Volume 22, Numbers 6-7, October - November 2010;
2010;Dirk Werth,Philipp Walter,Andreas Emrich,Peter Loos;Peer-to-peer business processes - conception, construction, tooling.;477-495;19;Volume 22, Numbers 6-7, October - November 2010;
2010;Scott Buffett,Liqiang Geng;Using classification methods to label tasks in process mining.;497-517;21;Volume 22, Numbers 6-7, October - November 2010;
2010;Alena Hallerbach,Thomas Bauer,Manfred Reichert;Capturing variability in business process models: the Provop approach.;519-546;28;Volume 22, Numbers 6-7, October - November 2010;
2010;Stefan Kuhne,Heiko Kern,Volker Gruhn,Ralf Laue 0001;Business process modeling with continuous validation.;547-566;20;Volume 22, Numbers 6-7, October - November 2010;
2010;Lu Zhang,Jing Luo,He Li,Jiasu Sun,Hong Mei;A biting-down approach to hierarchical decomposition of object-oriented systems based on structure analysis.;567-596;30;Volume 22, Number 8, December 2010;
2010;Janice Ka-Yee Ng,Yann-Gael Gueheneuc,Giuliano Antoniol;Identification of behavioural and creational design motifs through dynamic analysis.;597-627;31;Volume 22, Number 8, December 2010;
2010;Topi Haapio,Anne Eerola;Software project effort assessment.;629-652;24;Volume 22, Number 8, December 2010;
2010;Luyin Zhao,Fadi P. Deek,James A. McHugh;Exploratory inspection - a user-based learning method for improving open source software usability.;653-675;23;Volume 22, Number 8, December 2010;
2009;Muhammad Anan,Hossein Saiedian,Jungwoo Ryoo;An architecture-centric software maintainability assessment using information theory.;1-18;18;Volume 21, Number 1, January / February 2009;
2009;Wei Li 0005;DynaQoS;19-48;30;Volume 21, Number 1, January / February 2009;
2009;Uzma Raja,David P. Hale,Joanne E. Hale;Modeling software evolution defects: a time series approach.;49-71;23;Volume 21, Number 1, January / February 2009;
2009;Ned Chapin;"Software Maintenance Management: Evaluation and Continuous Improvement Authored by Alain April and Alain Abran Wiley-Interscience, Hoboken NJ, U.S.A., and IEEE Computer Society, Los Alamitos CA, U.S.A. Copyright (c) 2008; 314 pages ISBN 978-0470-14707-8 (soft cover) US$65.00.";73-77;5;Volume 21, Number 1, January / February 2009;
2009;Kostas Kontogiannis,Christos Tjortjis,Andreas Winter;Special issue on the 12th conference on software maintenance and reengineering (CSMR 2008).;79-80;2;Volume 21, Number 2, March / April 2009;
2009;Allan Raundahl Gregersen,Bo Norregaard Jorgensen;Dynamic update of Java applications - balancing change flexibility vs programming transparency.;81-112;32;Volume 21, Number 2, March / April 2009;
2009;Marco Glorie,Andy Zaidman,Arie van Deursen,Lennart Hofland;Splitting a large software repository for easing future software evolution - an industrial experience report.;113-141;29;Volume 21, Number 2, March / April 2009;
2009;Thilo Mende,Rainer Koschke,Felix Beckwermert;An evaluation of code similarity identification for the grow-and-prune model.;143-169;27;Volume 21, Number 2, March / April 2009;
2009;John Gerdes Jr.;User Interface Migration of Microsoft Windows Applications.;171-187;17;Volume 21, Number 3, May / June 2009;
2009;Christian Del Rosso;Comprehend and analyze knowledge networks to improve software evolution.;189-215;27;Volume 21, Number 3, May / June 2009;
2009;Marco D'Ambros,Michele Lanza;Visual software evolution reconstruction.;217-232;16;Volume 21, Number 3, May / June 2009;
2009;Diomidis Spinellis;Optimizing header file include directives.;233-251;19;Volume 21, Number 4, July / August 2009;
2009;Alireza Mahdian,Anneliese von Mayrhauser,Orest Pilskalns;Regression testing with UML software designs: A survey.;253-286;34;Volume 21, Number 4, July / August 2009;
2009;Hewijin Christine Jiau,Chia Hung Kao;Assessing the efficacy of user and developer activities in facilitating the development of OSS projects.;287-314;28;Volume 21, Number 5, September / October 2009;
2009;Ying Zou,Jin Guo 0002,King Chun Foo,Maokeng Hung;Recovering business processes from business applications.;315-348;34;Volume 21, Number 5, September / October 2009;
2009;Hans Christian Benestad,Bente Cecilie Dahlum Anda,Erik Arisholm;Understanding software maintenance and evolution by analyzing individual changes: a literature review.;349-378;30;Volume 21, Number 6, November / December 2009;
2009;Yanping Chen 0004,Robert L. Probert,Hasan Ural;Regression test suite reduction based on SDL models of system requirements.;379-405;27;Volume 21, Number 6, November / December 2009;
2008;Filippo Ricca,Emanuele Pianta,Paolo Tonella,Christian Girardi;Improving Web site understanding with keyword-based clustering.;1-29;29;Volume 20, Number 1, January / February 2008;
2008;Denis Kozlov,Jussi Koskinen,Markku Sakkinen,Jouni Markkula;Assessing maintainability change over multiple software releases.;31-58;28;Volume 20, Number 1, January / February 2008;
2008;Teemu Kanstren;Towards a deeper understanding of test coverage.;59-76;18;Volume 20, Number 1, January / February 2008;
2008;Andreas Bollin;Concept location in formal specifications.;77-105;29;Volume 20, Number 2, March / April 2008;
2008;Jim Buckley,Andrew P. LeGear,Christopher Exton,Ross Cadogan,Trevor Johnston,Bill Looby,Rainer Koschke;Encapsulating targeted component abstractions using software Reflexion Modelling.;107-134;28;Volume 20, Number 2, March / April 2008;
2008;Ramya Ravichandar,James D. Arthur,Shawn A. Bohner,David P. Tegarden;Improving change tolerance through Capabilities-based design: an empirical analysis.;135-170;36;Volume 20, Number 2, March / April 2008;
2008;Hector M. Olague,Letha H. Etzkorn,Sherri L. Messimer,Harry S. Delugach;An empirical validation of object-oriented class complexity metrics and their ability to predict error-prone classes in highly iterative, or agile, software: a case study.;171-197;27;Volume 20, Number 3, May / June 2008;
2008;Harvey P. Siy,Parvathi Chundi,Daniel J. Rosenkrantz,Mahadevan Subramaniam;A segmentation-based approach for temporal analysis of software version repositories.;199-222;24;Volume 20, Number 3, May / June 2008;
2008;Andy Zaidman,Abdelwahab Hamou-Lhadj,Orla Greevy;Introduction to the special issue on program comprehension through dynamic analysis (PCODA).;223-225;3;Volume 20, Number 4, July / August 2008;
2008;David Lo,Siau-Cheng Khoo,Chao Liu;Mining temporal rules for software maintenance.;227-247;21;Volume 20, Number 4, July / August 2008;
2008;Zhen Ming Jiang,Ahmed E. Hassan,Gilbert Hamann,Parminder Flora;An automated approach for abstracting execution logs to execution events.;249-267;19;Volume 20, Number 4, July / August 2008;
2008;Neil Walkinshaw,Kirill Bogdanov,Mike Holcombe,Sarah Salahuddin;Improving dynamic software analysis by applying grammar inference principles.;269-290;22;Volume 20, Number 4, July / August 2008;
2008;Chris Bennett,Del Myers,Margaret-Anne D. Storey,Daniel M. German,D. Ouellet,Martin Salois,Philippe Charland;A survey and evaluation of tool features for understanding reverse-engineered sequence diagrams.;291-315;25;Volume 20, Number 4, July / August 2008;
2008;Massimiliano Di Penta,Giuliano Antoniol,Mark Harman;Special Issue on Search-Based Software Maintenance.;317-319;3;Volume 20, Number 5, September / October 2008;
2008;Nicolas Desnos,Marianne Huchard,Guy Tremblay,Christelle Urtado,Sylvain Vauttier;Search-based many-to-one component substitution.;321-344;24;Volume 20, Number 5, September / October 2008;
2008;Mark O'Keeffe,Mel O Cinneide;Search-based refactoring: an empirical study.;345-364;20;Volume 20, Number 5, September / October 2008;
2008;Puneet Kapur,An Ngo-The,Gunther Ruhe,Andrew Smith;Optimized staffing for product releases and its application at Chartwell Technology.;365-386;22;Volume 20, Number 5, September / October 2008;
2008;Andy Zaidman,Serge Demeyer;Automatic identification of key classes in a software system using webmining techniques.;387-417;31;Volume 20, Number 6, November / December 2008;
2008;Lee J. White,Khaled Jaber,Brian P. Robinson,Vaclav Rajlich;Extended firewall for regression testing: an experience report.;419-433;15;Volume 20, Number 6, November / December 2008;
2008;Yoshiki Higo,Shinji Kusumoto,Katsuro Inoue;A metric-based approach to identifying refactoring opportunities for merging code clones in a Java software system.;435-461;27;Volume 20, Number 6, November / December 2008;
2008;Carolyn B. Seaman;"Software Maintenance: Concepts and Practice Authored by Penny Grubb and Armstrong A. Takang World Scientific, New Jersey. Copyright (c) 2003; 349 pages ISBN 981-238-426-X (paperback) US$40.";463-466;4;Volume 20, Number 6, November / December 2008;
2007;Evelyn J. Barry,Chris F. Kemerer,Sandra Slaughter;How software process automation affects software evolution: a longitudinal empirical analysis.;1-31;31;Volume 19, Number 1, January/February 2007;
2007;Michael A. Eierman,Mark T. Dishaw;The process of software maintenance: a comparison of object-oriented and third-generation development languages.;33-47;15;Volume 19, Number 1, January/February 2007;
2007;Anthony Mark Orme,Haining Yao,Letha H. Etzkorn;Indicating ontology data quality, stability, and completeness throughout ontology evolution.;49-75;27;Volume 19, Number 1, January/February 2007;
2007;Huzefa H. Kagdi,Michael L. Collard,Jonathan I. Maletic;A survey and taxonomy of approaches for mining software repositories in the context of software evolution.;77-131;55;Volume 19, Number 2, March/April 2007;
2007;Melanie P. Ware,F. George Wilkie,Mary Shapcott;The application of product measures in directing software maintenance activity.;133-154;22;Volume 19, Number 2, March/April 2007;
2007;Martin Erwig,Zhe Fu,Ben Pflaum;Parametric Fortran: program generation in scientific computing.;155-182;28;Volume 19, Number 3, May/June 2007;
2007;Norman F. Schneidewind;Experience report on using object-oriented design for software maintenance.;183-201;19;Volume 19, Number 3, May/June 2007;
2007;Massimiliano Di Penta,Leon Moonen;Special issue on source code analysis and manipulation (SCAM 2006).;203-204;2;Volume 19, Number 4, July/August 2007;
2007;Dawn Lawrie,Henry Feild,David M. Binkley;An empirical study of rules for well-formed identifiers.;205-229;25;Volume 19, Number 4, July/August 2007;
2007;Weilei Zhang,Barbara G. Ryder;Automatic construction of accurate application call graph with library call abstraction for Java.;231-252;22;Volume 19, Number 4, July/August 2007;
2007;Carlos Noguera,Renaud Pawlak;AVal: an extensible attribute-oriented programming validator for Java.;253-275;23;Volume 19, Number 4, July/August 2007;
2007;Davide Bolchini,Thomas Roy Dean,Damiano Distante,Scott R. Tilley;Special Issue on Web Site Evolution (WSE 2006).;277-279;3;Volume 19, Number 5, September/October 2007;
2007;Andrea De Lucia,Giuseppe Scanniello,Genoveffa Tortora;Identifying similar pages in Web applications using a competitive clustering algorithm.;281-296;16;Volume 19, Number 5, September/October 2007;
2007;Harry M. Sneed,Shihong Huang;The design and use of WSDL-Test: a tool for testing Web services.;297-314;18;Volume 19, Number 5, September/October 2007;
2007;Huzefa H. Kagdi,Jonathan I. Maletic;Mining evolutionary dependencies from web-localization repositories.;315-337;23;Volume 19, Number 5, September/October 2007;
2007;Filippo Ricca,Massimiliano Di Penta,Marco Torchiano,Paolo Tonella,Mariano Ceccato;How design notations affect the comprehension of Web applications.;339-359;21;Volume 19, Number 5, September/October 2007;
2007;Stefan Koch;Software evolution in open source projects - a large-scale investigation.;361-382;22;Volume 19, Number 6, November/December 2007;
2007;Macario Polo Usaola,Ignacio Garcia Rodriguez de Guzman,Mario Piattini Velthius;An MDA-based approach for database re-engineering.;383-417;35;Volume 19, Number 6, November/December 2007;
