2006;Jose Francisco Aldana Montes,M. Roldan-Castro,Ismael Navas Delgado,Maria del Mar Roldan Garcia,Manuel Hidalgo-Conde,Oswaldo Trelles-Salazar;Bio-Broker: a tool for integration of biological data sources and data analysis tools.;1585-1604;20;Volume 36, Number 14, November 2006;
2006;Niels P. Veerman,Ernst-Jan Verhoeven;Cobol minefield detection.;1605-1642;38;Volume 36, Number 14, November 2006;
2006;Lars Engebretsen;Platform-independent code conversion within the C++ locale framework.;1643-1654;12;Volume 36, Number 15, December 2006;
2006;Jingling Xue,Qiong Cai,Lin Gao 0002;Partial dead code elimination on predicated code regions.;1655-1685;31;Volume 36, Number 15, December 2006;
2006;Mike Liddell,Alistair Moffat;Decoding prefix codes.;1687-1710;24;Volume 36, Number 15, December 2006;
2006;Bo Chen,Harry H. Cheng,Joe Palen;Mobile-C: a mobile agent platform for mobile C/C++ agents.;1711-1733;23;Volume 36, Number 15, December 2006;
2005;Yijun Yu,Jianguo Lu,John Mylopoulos,Weiwei Sun,Jing-Hao Xue,Erik H. D'Hollander;Making XML document markup international.;1-14;14;Volume 35, Number 1, January 2005;
2005;Yoo C. Chung,Soo-Mook Moon,Kemal Ebcioglu,Dan Sahlin;Selective sweeping.;15-26;12;Volume 35, Number 1, January 2005;
2005;Jorge R. Ramos,Vernon Rego;Efficient implementation of multiprocessor scheduling algorithms on a simulation testbed.;27-50;24;Volume 35, Number 1, January 2005;
2005;William C. Kreahling,David B. Whalley,Mark W. Bailey,Xin Yuan,Gang-Ryung Uh,Robert van Engelen;Branch elimination by condition merging.;51-74;24;Volume 35, Number 1, January 2005;
2005;Youssef Hassoun,Roger Johnson,Steve Counsell;Applications of dynamic proxies in distributed environments.;75-99;25;Volume 35, Number 1, January 2005;
2005;R. Clinton Whaley,Antoine Petitet;Minimizing development and maintenance costs in supporting persistently optimized BLAS.;101-121;21;Volume 35, Number 2, February 2005;
2005;Grzegorz Czajkowski,Stephen Hahn,Glenn Skinner,Pete Soper,Ciaran Bryce;A resource management interface for the Java platform.;123-157;35;Volume 35, Number 2, February 2005;
2005;Ronald Garcia,Andrew Lumsdaine;MultiArray: a C++ library for generic programming with arrays.;159-188;30;Volume 35, Number 2, February 2005;
2005;James S. Plank,Ying Ding 0002;Note: Correction to the 1997 tutorial on Reed-Solomon coding.;189-194;6;Volume 35, Number 2, February 2005;
2005;Cecilia Mary Fischer Rubira,Rogerio de Lemos,Gisele Rodrigues Mesquita Ferreira,Fernando Castor Filho;Exception handling in the development of dependable component-based systems.;195-236;42;Volume 35, Number 3, March 2005;
2005;Rodrigo A. Vivanco,Nicolino J. Pizzi;Scientific computing with Java and C++: a case study using functional magnetic resonance neuroimages.;237-254;18;Volume 35, Number 3, March 2005;
2005;Dale E. Parson,David J. Murray,Yu Chen;Object-oriented design patterns for debugging heterogeneous languages and virtual machines.;255-279;25;Volume 35, Number 3, March 2005;
2005;Byung-Sun Yang,Soo-Mook Moon,Kemal Ebcioglu;Lightweight monitors for the Java virtual machine.;281-299;19;Volume 35, Number 3, March 2005;
2005;Roberto Latorre,Francisco Lopez,Antonio E. Martinez;Sharing of precompiled database statements in J2EE applications.;301-311;11;Volume 35, Number 3, March 2005;
2005;Paul R. Eggert,Douglas Stott Parker Jr.;Perturbing and evaluating numerical programs without recompilation - the wonglediff way.;313-322;10;Volume 35, Number 4, 10 April 2005;
2005;Ahmed Elfatatry,Paul J. Layzell;A negotiation description language.;323-343;21;Volume 35, Number 4, 10 April 2005;
2005;Roger Zimmermann,Cyrus Shahabi,Kun Fu,Shu-Yuen Didi Yao;Scalability evaluation of the Yima streaming media architecture.;345-359;15;Volume 35, Number 4, 10 April 2005;
2005;Kevin O'Gorman,Amr El Abbadi,Divyakant Agrawal;Multiple query optimization in middleware using query teamwork.;361-391;31;Volume 35, Number 4, 10 April 2005;
2005;Gang-Ryung Uh,Yuhong Wang,David B. Whalley,Sanjay Jinturkar,Yunheung Paek,Vincent Cao,Chris Burns;Compiler transformations for effectively exploiting a zero overhead loop buffer.;393-412;20;Volume 35, Number 4, 10 April 2005;
2005;Jan Gerben Wijnstra;Classifying product families using platform coverage and variation mechanisms.;413-444;32;Volume 35, Number 5, 25 April 2005;
2005;Strahil Ristov;LZ trie and dictionary compression.;445-465;21;Volume 35, Number 5, 25 April 2005;
2005;Dmitry Karasik,Anton Berezin,Vadim Belman,Jon Sporring;A graphical user-interface and an image processing toolkit for Per.;467-490;24;Volume 35, Number 5, 25 April 2005;
2005;Rajkumar Buyya,M. Manzur Murshed,David Abramson,Srikumar Venugopal;Scheduling parameter sweep applications on global Grids: a deadline and budget constrained cost-time optimization algorithm.;491-512;22;Volume 35, Number 5, 25 April 2005;
2005;Alessandro Maccari,Anders Heie;Managing infinite variability in mobile terminal software.;513-537;25;Volume 35, Number 6, May 2005;
2005;Rimon Barr,Zygmunt J. Haas,Robbert van Renesse;JiST: an efficient approach to simulation using virtual machines.;539-576;38;Volume 35, Number 6, May 2005;
2005;Robert P. Cook;Heuristic compression of an English word list.;577-581;5;Volume 35, Number 6, May 2005;
2005;Yoonsik Cheon,Gary T. Leavens,Murali Sitaraman,Stephen H. Edwards;Model variables: cleanly supporting abstraction in design by contract.;583-599;17;Volume 35, Number 6, May 2005;
2005;Yueh-Feng Lee,Ruei-Chuan Chang;Developing dynamic-reconfigurable communication protocol stacks using Java.;601-620;20;Volume 35, Number 6, May 2005;
2005;Michael Davis,Randy K. Smith,Brandon Dixon,Allen S. Parrish,David W. Cordes;Utilizing commodity hardware and software to distribute a real-world application: maximizing reuse while improving performance.;621-641;21;Volume 35, Number 7, June 2005;
2005;Khaled F. Shaalan;Arabic GramCheck: a grammar checker for Arabic.;643-665;23;Volume 35, Number 7, June 2005;
2005;Fabio Kon,Jeferson Roberto Marques,Tomonori Yamane,Roy H. Campbell,M. Dennis Mickunas;Design, implementation, and performance of an automatic configuration service for distributed component systems.;667-703;37;Volume 35, Number 7, June 2005;
2005;Mikael Svahnberg,Jilles van Gurp,Jan Bosch;A taxonomy of variability realization techniques.;705-754;50;Volume 35, Number 8, July 2005;
2005;Vadim Iosevich,Assaf Schuster;Software Distributed Shared Memory: a VIA-based implementation and comparison of sequential consistency with home-based lazy release consistency.;755-786;32;Volume 35, Number 8, July 2005;
2005;Peter M. Maurer;Converting command-line applications into binary components.;787-797;11;Volume 35, Number 8, July 2005;
2005;Howard Chivers,Andrew P. Martin;Editorial.;799-800;2;Volume 35, Number 9, July 2005;
2005;Jim Basney,Marty Humphrey,Von Welch;The MyProxy online credential repository.;801-816;16;Volume 35, Number 9, July 2005;
2005;Marty Humphrey,Jim Basney,Jim Jokl;The case for using Bridge Certificate Authorities for Grid computing.;817-826;10;Volume 35, Number 9, July 2005;
2005;Andrew McNab;The GridSite Web/Grid security system.;827-834;8;Volume 35, Number 9, July 2005;
2005;Sacha Brostoff,Martina Angela Sasse,David W. Chadwick,R. James Cunningham,Uche M. Mbanaso,Sassa Otenko;'R-What?' Development of a role-based access control policy-writing tool for e-Scientists.;835-856;22;Volume 35, Number 9, July 2005;
2005;David J. Power,Eugenia A. Politou,Mark Slaymaker,Andrew Simpson;Towards secure Grid-enabled healthcare.;857-871;15;Volume 35, Number 9, July 2005;
2005;Howard Chivers,Martyn Fletcher;Applying Security Design Analysis to a service-based system.;873-897;25;Volume 35, Number 9, July 2005;
2005;Pao-Ann Hsiung,Trong-Yen Lee,Jih-Ming Fu,Win-Bin See;SESAG: an object-oriented application framework for real-time systems.;899-921;23;Volume 35, Number 10, August 2005;
2005;Ginger Myles,Christian S. Collberg,Zachary V. Heidepriem,Armand Navabi;The evaluation of two software watermarking algorithms.;923-938;16;Volume 35, Number 10, August 2005;
2005;Marco Avvenuti,Alessio Vecchio;MobileRMI: upgrading Java Remote Method Invocation towards mobility.;939-975;37;Volume 35, Number 10, August 2005;
2005;Nicolas E. Gold,Mark Harman,David M. Binkley,Robert M. Hierons;Unifying program slicing and concept assignment for higher-level executable source code extraction.;977-1006;30;Volume 35, Number 10, August 2005;
2005;Manuel J. Fernandez Iglesias,Luis M. Alvarez,C. Lojo-Silva,Luis E. Anido-Rifon;Generating high quality printouts from content management systems: a cost-effective approach.;1007-1026;20;Volume 35, Number 11, September 2005;
2005;Hung-Yan Gu;A large-alphabet-oriented scheme for Chinese and English text compression.;1027-1039;13;Volume 35, Number 11, September 2005;
2005;Michael E. Kounavis,Andrew T. Campbell,Stephen T. Chou,John B. Vicente;Programming the data path in network processor-based routers.;1041-1078;38;Volume 35, Number 11, September 2005;
2005;Carl Staelin;lmbench: an extensible micro-benchmark suite.;1079-1105;27;Volume 35, Number 11, September 2005;
2005;Gonzalo Navarro,Jorma Tarhio;LZgrep: a Boyer-Moore string matching tool for Ziv-Lempel compressed text.;1107-1130;24;Volume 35, Number 12, October 2005;
2005;Sudipto Ghosh,Robert B. France,Devon M. Simmonds,Abhijit Bare,Brahmila Kamalakar,Roopashree P. Shankar,Gagan Tandon,Peter Vile,Shuxin Yin;A middleware-transparent approach to developing distributed applications.;1131-1154;24;Volume 35, Number 12, October 2005;
2005;Nadia Shalaby,Andy C. Bavier,Yitzchak M. Gottlieb,Scott Karlin,Larry L. Peterson,Xiaohu Qie,Tammo Spalink,Mike Wawrzoniak;Building extensible routers using network processors.;1155-1194;40;Volume 35, Number 12, October 2005;
2005;George Goulas,Panayiotis Alefragis,Efthymios Housos;SchedSP: a Grid-based application service provider of scheduling solutions.;1195-1216;22;Volume 35, Number 12, October 2005;
2005;Andrew E. Firth,Timothy C. Bell,Amar Mukherjee,Donald A. Adjeroh;A comparison of BWT approaches to string pattern matching.;1217-1258;42;Volume 35, Number 13, November 2005;
2005;Roger G. Stone;Validation of dynamic Web pages generated by an embedded scripting language.;1259-1274;16;Volume 35, Number 13, November 2005;
2005;Bradley T. Vander Zanden,Richard L. Halterman,Brad A. Myers,Robert C. Miller,Pedro A. Szekely,Dario A. Giuse,David S. Kosbie,Richard G. McDaniel;Lessons learned from programmers' experiences with one-way constraints.;1275-1298;24;Volume 35, Number 13, November 2005;
2005;Mahmoud Moh'd Mhashi;The effect of multiple reference characters on detecting matches in string-searching algorithms.;1299-1315;17;Volume 35, Number 13, November 2005;
2005;Marcello Becucci,Alessandro Fantechi,Marco Giromini,Emilio Spinicci;A comparison between handwritten and automatic generation of C code from SDL using static analysis.;1317-1347;31;Volume 35, Number 14, November 2005;
2005;Tzu-Han Kao,Shyan-Ming Yuan;Automatic adaptation of mobile applications to different user devices using modular mobile agents.;1349-1391;43;Volume 35, Number 14, November 2005;
2005;AbdulMalik S. Al-Salman,Fahad Al-Qahtani;GLAL: An OpenGL Arabization Library.;1393-1407;15;Volume 35, Number 14, November 2005;
2005;Fan Chan,Jiannong Cao,Alvin T. S. Chan,Kang Zhang;Visual programming support for graph-oriented parallel/distributed processing.;1409-1439;31;Volume 35, Number 15, December 2005;
2005;Olivier Chirouze,David Cleary,George G. Mitchell;A software methodology for applied research: eXtreme Researching.;1441-1454;14;Volume 35, Number 15, December 2005;
2005;Przemyslaw Skibinski,Szymon Grabowski,Sebastian Deorowicz;Revisiting dictionary-based compression.;1455-1476;22;Volume 35, Number 15, December 2005;
2005;Iain Milne,Glenn Rowe;Interpreting computer code in a computer-based learning system for novice programmers.;1477-1493;17;Volume 35, Number 15, December 2005;
2004;Jurgen Dunkel,Ralf Bruns,Andreas Holitschke;Comparison of JavaServer Pages and XSLT: a software engineering perspective.;1-13;13;Volume 34, Number 1, January 2004;
2004;Chris Fox,Sebastian Danicic,Mark Harman,Robert M. Hierons;ConSIT: a fully automated conditioned program slicer.;15-46;32;Volume 34, Number 1, January 2004;
2004;David Watson,G. Robert Malan,Farnam Jahanian;An extensible probe architecture for network protocol performance measurement.;47-67;21;Volume 34, Number 1, January 2004;
2004;Michel Jaring,Rene L. Krikhaar,Jan Bosch;Representing variability in a family of MRI scanners.;69-100;32;Volume 34, Number 1, January 2004;
2004;Balachander Krishnamurthy;Editorial: Web Technologies.;101-102;2;Volume 34, Number 2, February 2004;
2004;Jeffrey C. Mogul;Clarifying the fundamentals of HTTP.;103-134;32;Volume 34, Number 2, February 2004;
2004;Jim Whitehead,Yaron Y. Goland;The WebDAV property design.;135-161;27;Volume 34, Number 2, February 2004;
2004;Martin F. Arlitt,Carey Williamson;Understanding Web server configuration issues.;163-186;24;Volume 34, Number 2, February 2004;
2004;Alex Rousskov,Duane Wessels;High-performance benchmarking with Web Polygraph.;187-211;25;Volume 34, Number 2, February 2004;
2004;Dennis Fetterly,Mark S. Manasse,Marc Najork,Janet L. Wiener;A large-scale study of the evolution of Web pages.;213-237;25;Volume 34, Number 2, February 2004;
2004;Bruce W. Watson;Reducing memory requirements in reachability-based finite automata operations.;239-248;10;Volume 34, Number 3, March 2004;
2004;J. Michael Spivey;Fast, accurate call graph profiling.;249-264;16;Volume 34, Number 3, March 2004;
2004;David R. Hanson;lcc.NET: targeting the .NET Common Intermediate Language from Standard C.;265-286;22;Volume 34, Number 3, March 2004;
2004;Patrick Doyle,Carlos Cavanna,Tarek S. Abdelrahman;The design and implementation of a modular and extensible Java Virtual Machine.;287-313;27;Volume 34, Number 3, March 2004;
2004;Eric Jui-Lin Lu,Chang-Chuan Wu;A ReScUE XML/EDI model.;315-338;24;Volume 34, Number 3, March 2004;
2004;Dheeraj Sanghi,Pankaj Jalote,Puneet Agarwal,Nitin Jain,Supriyo Bose;A testbed for performance evaluation of load-balancing strategies for Web server systems.;339-353;15;Volume 34, Number 4, 10 April 2004;
2004;Sara Bouchenak,Daniel Hagimont,Sacha Krakowiak,Noel De Palma,Fabienne Boyer;Experiences implementing efficient Java thread serialization, mobility and persistence.;355-393;39;Volume 34, Number 4, 10 April 2004;
2004;Francesco Bellotti,Riccardo Berta,Alessandro De Gloria;Evaluation and optimization of method calls in Java.;395-431;37;Volume 34, Number 4, 10 April 2004;
2004;Rahul Jain 0006,Sanjeev Kumar Aggarwal,Pankaj Jalote,Shiladitya Biswas;An interactive method for extracting grammar from programs.;433-447;15;Volume 34, Number 5, 25 April 2004;
2004;Michael Schrefl,Thomas Thalhammer;Using roles in Java.;449-464;16;Volume 34, Number 5, 25 April 2004;
2004;Milena Milenkovic,Aleksandar Milenkovic,Jeffrey H. Kulick;Microbenchmarks for determining branch predictor organization.;465-487;23;Volume 34, Number 5, 25 April 2004;
2004;Alessandro Garcia,Carlos Jose Pereira de Lucena,Donald D. Cowan;Agents in object-oriented software engineering.;489-521;33;Volume 34, Number 5, 25 April 2004;
2004;Andy Georges,Mark Christiaens,Michiel Ronsse,Koenraad De Bosschere;JaRec: a portable record/replay environment for multi-threaded Java applications.;523-547;25;Volume 34, Number 6, May 2004;
2004;Shu-Ching Chen,Sneh Gulati,Shahid Hamid,Xin Huang,Lin Luo,Nirva Morisseau-Leroy,Mark D. Powell,Chengjun Zhan,Chengcui Zhang;A Web-based distributed system for hurricane occurrence projection.;549-571;23;Volume 34, Number 6, May 2004;
2004;Jahanzeb Sherwani,Nosheen Ali,Nausheen Lotia,Zahra Hayat,Rajkumar Buyya;Libra: a computational economy-based job scheduling system for clusters.;573-590;18;Volume 34, Number 6, May 2004;
2004;Evgeny B. Krissinel,Kim Henrick;Common subgraph isomorphism detection by backtracking search.;591-607;17;Volume 34, Number 6, May 2004;
2004;Nikolaos S. Papaspyrou,Ioannis T. Kassios;GLU embedded in C++: a marriage between multidimensional and object-oriented programming.;609-630;22;Volume 34, Number 7, June 2004;
2004;Eduardo Huedo,Ruben Santiago Montero,Ignacio Martin Llorente;A framework for adaptive execution in grids.;631-651;21;Volume 34, Number 7, June 2004;
2004;Anthony Sulistio,Chee Shin Yeo,Rajkumar Buyya;A taxonomy of computer-based simulations and its mapping to parallel and distributed systems simulation tools.;653-673;21;Volume 34, Number 7, June 2004;
2004;Silvia Teresita Acuna Castillo,Natalia Juristo Juzgado;Assigning people to roles in software projects.;675-696;22;Volume 34, Number 7, June 2004;
2004;Bruce W. Watson,Loek G. Cleophas;SPARE Parts: a C++ toolkit for string pattern recognition.;697-710;14;Volume 34, Number 7, June 2004;
2004;Paolo Boldi,Bruno Codenotti,Massimo Santini,Sebastiano Vigna;UbiCrawler: a scalable fully distributed Web crawler.;711-726;16;Volume 34, Number 8, 10 July 2004;
2004;Zoltan Adam Mann,Karoly Kondorosi;Tracing system-level communication in distributed systems.;727-755;29;Volume 34, Number 8, 10 July 2004;
2004;Xian Liu,Feilong Xu;A softerware monitor for shared-memory multiprocessor computers.;757-776;20;Volume 34, Number 8, 10 July 2004;
2004;Jing-Chao Chen;Building a new sort function for a C library.;777-795;19;Volume 34, Number 8, 10 July 2004;
2004;Michael H. Hohn;A little language for modularizing numerical PDE solvers.;797-813;17;Volume 34, Number 9, 25 July 2004;
2004;Jonathan J. Cook;P#: a concurrent Prolog for the .NET framework.;815-845;31;Volume 34, Number 9, 25 July 2004;
2004;Jinhwan Kim,Yunheung Paek,Gang-Ryung Uh;Code optimizations for a VLIW-style network processing unit.;847-874;28;Volume 34, Number 9, 25 July 2004;
2004;Takeshi Ogasawara,Hideaki Komatsu,Toshio Nakatani;Optimizing precision overhead for x86 processors.;875-893;19;Volume 34, Number 9, 25 July 2004;
2004;Juan Pablo Hourcade,Benjamin B. Bederson,Allison Druin;Building KidPad: an application for children's collaborative storytelling.;895-914;20;Volume 34, Number 9, 25 July 2004;
2004;Eddy Bernard,Bruno Legeard,Xavier Luck,Fabien Peureux;Generation of test sequences from formal specifications: GSM 11-11 standard case study.;915-948;34;Volume 34, Number 10, August 2004;
2004;Mattias Nystrom,Tore Risch;Engineering information integration using object-oriented mediator technology.;949-975;27;Volume 34, Number 10, August 2004;
2004;Anthony Savidis;The implementation of generic smart pointers for advanced defensive programming.;977-1009;33;Volume 34, Number 10, August 2004;
2004;Owen de Kretser,Alistair Moffat;SEFT: a search engine for text.;1011-1023;13;Volume 34, Number 10, August 2004;
2004;Christoph Csallner,Yannis Smaragdakis;JCrasher: an automatic robustness tester for Java.;1025-1050;26;Volume 34, Number 11, September 2004;
2004;Mirjana Jaksic;Mapping of bibliographical standards into XML.;1051-1064;14;Volume 34, Number 11, September 2004;
2004;Motohiro Kawahito,Hideaki Komatsu,Toshio Nakatani;Partial redundancy elimination for access expressions by speculative code motion.;1065-1090;26;Volume 34, Number 11, September 2004;
2004;M. Brian Blake;A specification language and service-oriented architecture to support distributed data management.;1091-1117;27;Volume 34, Number 11, September 2004;
2004;Renaud Pawlak,Lionel Seinturier,Laurence Duchien,Gerard Florin,Fabrice Legond-Aubry,Laurent Martelli;JAC: an aspect-based distributed dynamic framework.;1119-1148;30;Volume 34, Number 12, October 2004;
2004;Richard M. Sunderland,Robert I. Damper,Richard M. Crowder;Flexible XML-based configuration of physical simulations.;1149-1155;7;Volume 34, Number 12, October 2004;
2004;Holger Eichelberger,Jurgen Wolff von Gudenberg;Object-oriented processing of Java source code.;1157-1185;29;Volume 34, Number 12, October 2004;
2004;Dwight J. Makaroff,Gerald W. Neufeld,Norman C. Hutchinson;Performance evaluation for VBR Continuous Media File Server admission control.;1187-1210;24;Volume 34, Number 12, October 2004;
2004;David R. Hanson,Todd A. Proebsting;A research C# compiler;1211-1224;14;Volume 34, Number 13, 10 November 2004;
2004;Cinzia Bernardeschi,Nicoletta De Francesco,Giuseppe Lettieri,Luca Martini;Checking secure information flow in Java bytecode by code transformation and standard bytecode verification.;1225-1255;31;Volume 34, Number 13, 10 November 2004;
2004;Joefon Jann,Niteesh Dubey,R. Sarma Burugula,Pratap Pattnaik;Dynamic reconfiguration of CPU and WebSphere on IBM pSeries servers.;1257-1272;16;Volume 34, Number 13, 10 November 2004;
2004;Robert W. Schwanke,Robyn R. Lutz;Experience with the architectural design of a modest product family.;1273-1296;24;Volume 34, Number 13, 10 November 2004;
2004;Maozhen Li,Man Qi;Leveraging legacy codes to distributed problem-solving environments: a Web services approach.;1297-1309;13;Volume 34, Number 13, 10 November 2004;
2004;Tony Gorschek,Claes Wohlin;Packaging software process improvement issues: a method and a case study.;1311-1344;34;Volume 34, Number 14, 25 November 2004;
2004;Arie van Deursen,Joost Visser;Source model analysis using the JJTraveler visitor combinator framework.;1345-1379;35;Volume 34, Number 14, 25 November 2004;
2004;Songqing Chen,Xiaodong Zhang 0001;Enforcing direct communications between clients and Web servers to improve proxy performance and security.;1381-1395;15;Volume 34, Number 14, 25 November 2004;
2004;Giovanni Manzini,Marcella Rastero;A simple and fast DNA compressor.;1397-1411;15;Volume 34, Number 14, 25 November 2004;
2004;Thomas VanDrunen,Antony L. Hosking;Anticipation-based partial redundancy elimination for static single assignment form.;1413-1439;27;Volume 34, Number 15, December 2004;
2004;Min-Gu Lee,Sunggu Lee,Kwang-Hae (Kane) Kim;Implementation of a TMO-structured real-time airplane-landing simulator on a distributed computing environment.;1441-1462;22;Volume 34, Number 15, December 2004;
2004;SeungIl Lee,Byung-Sun Yang,Soo-Mook Moon;Efficient Java exception handling in just-in-time compilation.;1463-1480;18;Volume 34, Number 15, December 2004;
2004;Raphael A. Finkel,Victor W. Marek,Miroslaw Truszczynski;Constraint Lingo: towards high-level constraint programming.;1481-1504;24;Volume 34, Number 15, December 2004;
2003;Rod Fatoohi,D. Jensen;Migration of DCE applications into CORBA and SOAP environments.;1-18;18;Volume 33, Number 1, January 2003;
2003;Brian A. Malloy,Tanton H. Gibbs,James F. Power;Decorating tokens to facilitate recognition of ambiguous language constructs.;19-39;21;Volume 33, Number 1, January 2003;
2003;Robert Wing Pong Luk,Benjamin Ka-Yin T'sou,Tom B. Y. Lai,Oi Yee Kwong,Francis C. Y. Chik,Lawrence Y. L. Cheung;Bilingual legal document retrieval and management using XML.;41-59;19;Volume 33, Number 1, January 2003;
2003;Colin Depradine,Pranay Chaudhuri;P;61-76;16;Volume 33, Number 1, January 2003;
2003;Andre van der Hoek,Alexander L. Wolf;Software release management for component-based software.;77-98;22;Volume 33, Number 1, January 2003;
2003;Huw Evans,Malcolm P. Atkinson,Margaret I. Brown,Julie Cargill,Murray Crease,Steve Draper,Philip D. Gray,Richard Thomas;The pervasiveness of evolution in GRUMPS software.;99-120;22;Volume 33, Number 2, February 2003;
2003;Hossein Saiedian,Steve Hill;A comparative evaluation of generic programming in Java and C++.;121-142;22;Volume 33, Number 2, February 2003;
2003;Mengchi Liu;DrawCAD: using deductive object-relational databases in CAD.;143-172;30;Volume 33, Number 2, February 2003;
2003;David Bainbridge,Timothy C. Bell;A music notation construction engine for optical music recognition.;173-200;28;Volume 33, Number 2, February 2003;
2003;Robert Wing Pong Luk,Daniel S. Yeung,Qin Lu,H. L. Leung,S. Y. Li,Fred Leung;ASAB: a Chinese screen reader.;201-219;19;Volume 33, Number 3, March 2003;
2003;Alexandre Gachet,Pius Hattenschwiler;A Jini-based software framework for developing distributed cooperative decision support systems.;221-258;38;Volume 33, Number 3, March 2003;
2003;Jaakko Jarvi,Gary Powell,Andrew Lumsdaine;The Lambda Library: unnamed functions in C++.;259-291;33;Volume 33, Number 3, March 2003;
2003;Rachid Guerraoui;Editorial: Middleware.;293;1;Volume 33, Number 4, April 2003;
2003;Jun He,Matti A. Hiltunen,Mohan Rajagopalan,Richard D. Schlichting;QoS customization in distributed object systems.;295-320;26;Volume 33, Number 4, April 2003;
2003;Rainer Koster,Andrew P. Black,Jie Huang,Jonathan Walpole,Calton Pu;Thread transparency in information flow middleware.;321-349;29;Volume 33, Number 4, April 2003;
2003;Iain Houston,Mark C. Little,Ian Robinson,Santosh K. Shrivastava,Stuart M. Wheater;The CORBA Activity Service Framework for supporting extended transactions.;351-373;23;Volume 33, Number 4, April 2003;
2003;Jean Bacon,Ken Moody,Walt Yao;Access control and trust in the use of widely distributed services.;375-394;20;Volume 33, Number 4, April 2003;
2003;Diego Zamboni;Editorial: Security Software.;395-396;2;Volume 33, Number 5, 25 April 2003;
2003;Sabrina De Capitani di Vimercati,Stefano Paraboschi,Pierangela Samarati;Access control: principles and solutions.;397-421;25;Volume 33, Number 5, 25 April 2003;
2003;Kyung-suk Lhee,Steve J. Chapin;Buffer overflow and format string overflow vulnerabilities.;423-460;38;Volume 33, Number 5, 25 April 2003;
2003;Lujo Bauer,Andrew W. Appel,Edward W. Felten;Mechanisms for secure modular programming in Java.;461-480;20;Volume 33, Number 5, 25 April 2003;
2003;Michael Nidd,Dirk Husemann;CA-PK: conditional access for broadcast networks.;481-496;16;Volume 33, Number 5, 25 April 2003;
2003;AbdulMalik S. Al-Salman,Hend S. Al-Khalifa;Towards a computerized Arabic Braille environment.;497-508;12;Volume 33, Number 6, May 2003;
2003;Rushikesh K. Joshi,Maureen Mascarenhas,Yogesh Murarka;Filter objects for Java.;509-522;14;Volume 33, Number 6, May 2003;
