2012;Yoonho Park,Richard King,Senthil Nathan,Wesley Most,Henrique Andrade;Evaluation of a high-volume, low-latency market data processing system implemented with IBM middleware.;37-56;20;Volume 42, Number 1, January 2012;
2012;Chung-Ming Huang,Hao-Hsiang Ku,Yu-Chang Chao,Cheng-Wei Lin,Yen-Wen Chen;Design and implementation of an adaptive Web2.0 QoS-based home appliance control service platform.;57-87;31;Volume 42, Number 1, January 2012;
2012;Herwig Mannaert,Jan Verelst,Kris Ven;Towards evolvable software architectures based on systems theoretic stability.;89-116;28;Volume 42, Number 1, January 2012;
2012;James Stanier,Des Watson;A study of irreducibility in C programs.;117-130;14;Volume 42, Number 1, January 2012;
2012;Xiaohu Yang,Liping Zhao,Xinyu Wang,Ye Wang,Jie Sun,Albert Jerry Cristoforo;Satisfying quality requirements in the design of a partition-based, distributed stock trading system.;131-157;27;Volume 42, Number 2, February 2012;
2012;Ricardo Perez-Castillo,Ignacio Garcia Rodriguez de Guzman,Mario Piattini Velthius,Angeles S. Places;A case study on business process recovery using an e-government system.;159-189;31;Volume 42, Number 2, February 2012;
2012;Pieter H. Hartel,Henk L. Muller;Simple algebraic data types for C.;191-210;20;Volume 42, Number 2, February 2012;
2012;Mazeiar Salehie,Ladan Tahvildari;Towards a goal-driven approach to action selection in self-adaptive software.;211-233;23;Volume 42, Number 2, February 2012;
2012;Guillermo Jimenez-Diaz,Pedro A. Gonzalez-Calero,Mercedes Gomez-Albarran;Role-play virtual worlds for teaching object-oriented design: the ViRPlay development experience.;235-253;19;Volume 42, Number 2, February 2012;
2012;Peter M. Fenwick;PPM compression without escapes.;255-260;6;Volume 42, Number 2, February 2012;
2012;Simon Edward Parkin,Graham Morgan;Toward reusable SLA monitoring capabilities.;261-280;20;Volume 42, Number 3, March 2012;
2012;Paola Caymes-Scutari,Anna Morajko,Tomas Margalef,Emilio Luque Fadon;A methodology for transparent knowledge specification in a dynamic tuning environment.;281-302;22;Volume 42, Number 3, March 2012;
2012;Ting-Chang Huang,Da-Wei Chang;VM aware journaling: improving journaling file system performance in virtualization environments.;303-330;28;Volume 42, Number 3, March 2012;
2012;Engineer Bainomugisha,Jorge Vallejos,Elisa Gonzalez Boix,Pascal Costanza,Theo D'Hondt,Wolfgang De Meuter;Bringing Scheme programming to the iPhone - Experience.;331-356;26;Volume 42, Number 3, March 2012;
2012;Yali Wu,Andrew A. Allen,Frank Hernandez,Robert B. France,Peter J. Clarke;A domain-specific modeling approach to realizing user-centric communication.;357-390;34;Volume 42, Number 3, March 2012;
2012;Rajiv Ranjan,Rajkumar Buyya,Boualem Benatallah;Special section: software architectures and application development environments for Cloud computing.;391-394;4;Volume 42, Number 4, April 2012;
2012;Johannes Kirschnick,Jose M. Alcaraz Calero,Patrick Goldsack,Andrew Farrell,Julio Guijarro,Steve Loughran,Nigel Edwards,Lawrence Wilcock;Towards an architecture for deploying elastic services in the cloud.;395-408;14;Volume 42, Number 4, April 2012;
2012;Zhiwei Yu,Chaokun Wang,Clark D. Thompson,Jianmin Wang 0001,Shiguo Lian,Thanos Vasilakos;A novel watermarking method for software protection in the cloud.;409-430;22;Volume 42, Number 4, April 2012;
2012;Gaofeng Zhang,Yun Yang,Dong Yuan,Jinjun Chen;A trust-based noise injection strategy for privacy protection in cloud.;431-445;15;Volume 42, Number 4, April 2012;
2012;Ali Khajeh-Hosseini,David Greenwood,James W. Smith,Ian Sommerville;The Cloud Adoption Toolkit: supporting cloud adoption decisions in the enterprise.;447-465;19;Volume 42, Number 4, April 2012;
2012;Peishun Wang,Yi Mu,Willy Susilo,Jun Yan;Privacy preserving protocol for service aggregation in cloud computing.;467-483;17;Volume 42, Number 4, April 2012;
2012;Georg Birkenheuer,Andre Brinkmann,Jurgen Kaiser,Axel Keller,Matthias Keller,Christoph Kleineweber,Christoph Konersmann,Oliver Niehorster,Thorsten Schafer,Jens Simon,Maximilian Wilhelm;Virtualized HPC: ;485-500;16;Volume 42, Number 4, April 2012;
2012;Amir Vahid Dastjerdi,Sayed Gholam Hassan Tabatabaei,Rajkumar Buyya;A dependency-aware ontology-based approach for deploying service level agreement monitoring services in Cloud.;501-518;18;Volume 42, Number 4, April 2012;
2012;Yu-Sik Park,Hyung-Min Koo,In-Young Ko;A task-based and resource-aware approach to dynamically generate optimal software architecture for intelligent service robots.;519-541;23;Volume 42, Number 5, May 2012;
2012;Alina Girbea,Septimiu Nechifor,Francisc Sisak,Liviu Perniu;Efficient address space generation for an OPC UA server.;543-557;15;Volume 42, Number 5, May 2012;
2012;Lionel Seinturier,Philippe Merle,Romain Rouvoy,Daniel Romero 0002,Valerio Schiavoni,Jean-Bernard Stefani;A component-based middleware platform for reconfigurable service-oriented architectures.;559-583;25;Volume 42, Number 5, May 2012;
2012;Thomas Claveirole,Marcelo Dias de Amorim;Manipulating Wi-Fi packet traces with WiPal: design and experience.;585-599;15;Volume 42, Number 5, May 2012;
2012;Richard B. Arthur,Dan R. Olsen Jr.;Privacy-aware shared UI toolkit for nomadic environments.;601-628;28;Volume 42, Number 5, May 2012;
2012;Raoufehsadat Hashemian,Diwakar Krishnamurthy,Martin F. Arlitt;Web workload generation challenges - an empirical investigation.;629-647;19;Volume 42, Number 5, May 2012;
2012;Robert Gluck;A self-applicable online partial evaluator for recursive flowchart languages.;649-673;25;Volume 42, Number 6, June 2012;
2012;Qing Yi;POET: a scripting language for applying parameterized source-to-source program transformations.;675-706;32;Volume 42, Number 6, June 2012;
2012;Luca Ferrari,Haibin Zhu;Autonomous role discovery for collaborating agents.;707-731;25;Volume 42, Number 6, June 2012;
2012;Paolo Ciancarini,Angelo Di Iorio,Luca Furini,Fabio Vitali;High-quality pagination for publishing.;733-751;19;Volume 42, Number 6, June 2012;
2012;Hiroshi Inoue,Takao Moriyama,Hideaki Komatsu,Toshio Nakatani;A high-performance sorting algorithm for multicore single-instruction multiple-data processors.;753-777;25;Volume 42, Number 6, June 2012;
2012;Kenneth B. Kent,Jerome Hugues;Editorial to the Special Issue of Rapid System Prototyping'10.;779;1;Volume 42, Number 7, July 2012;
2012;Andrew Forward,Omar Bahy Badreddin,Timothy C. Lethbridge,Julian Solano;Model-driven rapid prototyping with Umple.;781-797;17;Volume 42, Number 7, July 2012;
2012;Julien Delange,Laurent Pautet,Fabrice Kordon;Design, implementation and verification of MILS systems.;799-816;18;Volume 42, Number 7, July 2012;
2012;Martin Hillenbrand,Matthias Heinz,Johannes Matheis,Klaus D. Muller-Glaser;Development of electric/electronic architectures for safety-related vehicle functions.;817-851;35;Volume 42, Number 7, July 2012;
2012;Doron Drusinsky,Man-tak Shing;Validating quality attribute requirements via execution-based model checking.;853-875;23;Volume 42, Number 7, July 2012;
2012;Walid Lafi,Didier Lattard,Ahmed Amine Jerraya;An asynchronous hierarchical router for networks-on-chip-based three-dimensional multi-processor system-on-chip.;877-890;14;Volume 42, Number 7, July 2012;
2012;Youcef Bouchebaba,Ali Erdem Ozcan,Pierre G. Paulin,Gabriela Nicolescu;MpAssign: a framework for solving the many-core platform mapping problem.;891-915;25;Volume 42, Number 7, July 2012;
2012;Alexandra Aguiar,Fabiano Hessel;Current techniques and future trends in embedded system's virtualization.;917-944;28;Volume 42, Number 7, July 2012;
2012;Ronald Togl,Thomas Winkler 0002,Mohammad Nauman,Theodore W. Hong;Specification and Standardization of a Java Trusted Computing API.;945-965;21;Volume 42, Number 8, August 2012;
2012;Eric Ying Kwong Chan,Wing Kwong Chan,Pak-Lok Poon,Yuen-Tak Yu;An empirical evaluation of several test-a-few strategies for testing particular conditions.;967-994;28;Volume 42, Number 8, August 2012;
2012;Vijay Nagarajan,Dennis Jeffrey,Rajiv Gupta,Neelam Gupta;A system for debugging via online tracing and dynamic slicing.;995-1014;20;Volume 42, Number 8, August 2012;
2012;Florentino Fernandez Riverola,Daniel Glez-Pena,Hugo Lopez-Fernandez,Miguel Reboiro-Jato,Jose Ramon Mendez Reboredo;A JAVA application framework for scientific software development.;1015-1036;22;Volume 42, Number 8, August 2012;
2012;J. Shane Culpepper,Matthias Petri,Simon J. Puglisi;Revisiting bounded context block-sorting transformations.;1037-1054;18;Volume 42, Number 8, August 2012;
2012;Huai Liu,Fei-Ching Kuo,Tsong Yueh Chen;Comparison of adaptive random testing and random testing under various testing and debugging scenarios.;1055-1074;20;Volume 42, Number 8, August 2012;
2012;Pierluigi Plebani,Cinzia Cappiello,Marco Comuzzi,Barbara Pernici,Sandeep Yadav;MicroMAIS: executing and orchestrating Web services on constrained mobile devices.;1075-1094;20;Volume 42, Number 9, September 2012;
2012;Jan Wassenberg;Lossless asymmetric single instruction multiple data codec.;1095-1106;12;Volume 42, Number 9, September 2012;
2012;Shih-Yao Dai,Fyodor Yarochkin,Ming-Wei Wu,Yennun Huang,Sy-Yen Kuo;Holography: a behavior-based profiler for malware analysis.;1107-1136;30;Volume 42, Number 9, September 2012;
2012;Antonio Monzon,Jose L. Fernandez,Juan Antonio de la Puente;Application of Deadlock Risk Evaluation of Architectural Models.;1137-1163;27;Volume 42, Number 9, September 2012;
2012;Alexandre Bergel,Felipe Banados,Romain Robbes,Walter Binder;Execution profiling blueprints.;1165-1192;28;Volume 42, Number 9, September 2012;
2012;Kirak Hong,Jiin Park,Sungho Kim,Taekhoon Kim,Hwangho Kim,Bernd Burgstaller,Bernhard Scholz;TinyVM: an energy-efficient execution infrastructure for sensor networks.;1193-1209;17;Volume 42, Number 10, October 2012;
2012;I-Ching Hsu;Extending UML to model Web 2.0-based context-aware applications.;1211-1227;17;Volume 42, Number 10, October 2012;
2012;Antonio Navarro 0001,Jesus Cristobal,Carmen Fernandez-Chamizo,Alfredo Fernandez-Valmayor;Architecture of a multiplatform virtual campus.;1229-1246;18;Volume 42, Number 10, October 2012;
2012;Geylani Kardas,Moharram Challenger,Suleyman Yildirim,Ali Yamuc;Design and implementation of a multiagent stock trading system.;1247-1273;27;Volume 42, Number 10, October 2012;
2012;Alessandro Russo 0001,Massimo Mecella,Massimiliano de Leoni;ROME4EU - A service-oriented process-aware information system for mobile devices.;1275-1314;40;Volume 42, Number 10, October 2012;
2012;Michele Welponer,Luca Abeni,Guido Marchetto,Renato Lo Cigno;Measuring and reducing the impact of the operating system kernel on end-to-end latencies in synchronous packet switched networks.;1315-1330;16;Volume 42, Number 11, November 2012;
2012;Javier Ferrer,Francisco Chicano,Enrique Alba Torres;Evolutionary algorithms for the multi-objective test data generation problem.;1331-1362;32;Volume 42, Number 11, November 2012;
2012;Bugra Gedik,Henrique Andrade;A model-based framework for building extensible, high performance stream processing middleware and programming language for IBM InfoSphere Streams.;1363-1391;29;Volume 42, Number 11, November 2012;
2012;Harold W. Thimbleby;Heedless programming: ignoring detectable error is a widespread hazard.;1393-1407;15;Volume 42, Number 11, November 2012;
2012;Matthias Kretz,Volker Lindenstruth;Vc: A C++ library for explicit vectorization.;1409-1430;22;Volume 42, Number 11, November 2012;
2012;Vijay Nagarajan,Dennis Jeffrey,Rajiv Gupta,Neelam Gupta;Erratum: A system for debugging via online tracing and dynamic slicing.;1431;1;Volume 42, Number 11, November 2012;
2012;Pekka Kilpelainen;Using XQuery for problem solving.;1433-1465;33;Volume 42, Number 12, December 2012;
2012;Mathieu Jan,Christophe Jouvray,Fabrice Kordon,Antonio Kung,Jimmy Lalande,Frederic Loiret,Juan F. Navas,Laurent Pautet,Jacques Pulou,Ansgar Radermacher,Lionel Seinturier;Flex-eWare: a flexible model driven solution for designing and implementing embedded distributed systems.;1467-1494;28;Volume 42, Number 12, December 2012;
2012;Ghizlane El-Boussaidi,Hafedh Mili;Understanding design patterns - what is the problem?;1495-1529;35;Volume 42, Number 12, December 2012;
2012;Vijay Kumar,Arun Sharma,Rajesh Kumar,P. S. Grover;Quality aspects for component-based systems: A metrics based approach.;1531-1548;18;Volume 42, Number 12, December 2012;
2011;Yunus Emre Selcuk,Nadia Erdogan;Role models - implementation-based approaches to using roles.;1-22;22;Volume 41, Number 1, January 2011;
2011;Rodrigo N. Calheiros,Rajiv Ranjan,Anton Beloglazov,Cesar Augusto Fonticielha De Rose,Rajkumar Buyya;CloudSim: a toolkit for modeling and simulation of cloud computing environments and evaluation of resource provisioning algorithms.;23-50;28;Volume 41, Number 1, January 2011;
2011;Suneetha Nadella,Dharanipragada Janakiram;Message filters for hardening the Linux kernel.;51-62;12;Volume 41, Number 1, January 2011;
2011;Jacek Rosik,Andrew Le Gear,Jim Buckley,Muhammad Ali Babar,Dave Connolly;Assessing architectural drift in commercial software development: a case study.;63-86;24;Volume 41, Number 1, January 2011;
2011;Najmus Saqib Malik,David Ko,Harry H. Cheng;A secure migration process for mobile agents.;87-101;15;Volume 41, Number 1, January 2011;
2011;Alexandre Sztajnberg,Rodrigo Souza Granja,Jeane Cesario,Andre Felipe Almeida Monteiro;An integration experience of a software architecture and a monitoring infrastructure to deploy applications with non-functional requirements in computing grids.;103-127;25;Volume 41, Number 1, January 2011;
2011;Frederic Gervais,Benoit Fraikin;Tool building in formal methods.;131-132;2;Volume 41, Number 2, February 2011;
2011;Gerd Behrmann,Alexandre David,Kim Guldstrand Larsen,Paul Pettersson,Wang Yi;Developing UPPAAL over 15 years.;133-142;10;Volume 41, Number 2, February 2011;
2011;Jan Friso Groote,Jeroen Keiren,Frank P. M. Stappers,Wieger Wesselink,Tim A. C. Willemse;Experiences in developing the mCRL2 toolset.;143-153;11;Volume 41, Number 2, February 2011;
2011;Paolo Arcaini,Angelo Gargantini,Elvinia Riccobene,Patrizia Scandurra;A model-driven process for engineering a toolset for a formal method.;155-166;12;Volume 41, Number 2, February 2011;
2011;Roozbeh Farahbod,Uwe Glasser;The CoreASM modeling framework.;167-178;12;Volume 41, Number 2, February 2011;
2011;Petra Malik;A retrospective on CZT.;179-188;10;Volume 41, Number 2, February 2011;
2011;Jens Bendisposto,Fabian Fritz,Michael Jastram,Michael Leuschel,Ingo Weigelt;Developing Camille, a text editor for Rodin.;189-198;10;Volume 41, Number 2, February 2011;
2011;Renato Silva,Carine Pascal,Thai Son Hoang,Michael J. Butler;Decomposition tool for event-B.;199-208;10;Volume 41, Number 2, February 2011;
2011;Antonio Ruiz-Martinez,Daniel Sanchez-Martinez,C. Inmaculada Marin-Lopez,Manuel Gil Perez,Antonio Fernandez Gomez-Skarmeta;An advanced certificate validation service and architecture based on XKMS.;209-236;28;Volume 41, Number 3, March 2011;
2011;Fabio Luigi Bellifemine,Giancarlo Fortino,Roberta Giannantonio,Raffaele Gravina,Antonio Guerrieri,Marco Sgroi;SPINE: a domain-specific framework for rapid prototyping of WBSN applications.;237-265;29;Volume 41, Number 3, March 2011;
2011;Amer Diwan,Matthias Hauswirth,Todd Mytkowicz,Peter F. Sweeney;TraceAnalyzer: a system for processing performance traces.;267-282;16;Volume 41, Number 3, March 2011;
2011;Adam Nelson,Tim Menzies,Gregory R. Gay;Sharing experiments using open-source software.;283-305;23;Volume 41, Number 3, March 2011;
2011;Joao Porto de Albuquerque,Heiko Krumm,Paulo Licio de Geus,Rene Jeruschkat;Scalable model-based configuration management of security services in complex enterprise networks.;307-338;32;Volume 41, Number 3, March 2011;
2011;Anthony Schoofs,Phillip Stanley-Marbell;Portability in MAC protocol and transceiver software implementations for LR-WPAN platforms.;339-361;23;Volume 41, Number 4, April 2011;
2011;David Budgen,Andy J. Burn,Pearl Brereton,Barbara A. Kitchenham,Rialette Pretorius;Empirical evidence about the UML: a systematic literature review.;363-392;30;Volume 41, Number 4, April 2011;
2011;Svend E. Knudsen;Using independence to enable parallelism on multicore computers.;393-402;10;Volume 41, Number 4, April 2011;
2011;Ramon Hervas Lucas,Jose Bravo Rodriguez;COIVA: context-aware and ontology-powered information visualization architecture.;403-426;24;Volume 41, Number 4, April 2011;
2011;Daniel Hoffman,David Ly-Gagnon,Paul A. Strooper,Hong-Yi Wang;Grammar-based test generation with YouGen.;427-447;21;Volume 41, Number 4, April 2011;
2011;Abelardo Pardo,Carlos Delgado Kloos;SubCollaboration: large-scale group management in collaborative learning.;449-465;17;Volume 41, Number 4, April 2011;
2011;Iain Bate,Simon M. Poulding;Editorial for the special issue on search-based software engineering.;467-468;2;Volume 41, Number 5, April 2011;
2011;Hiroshi Wada,Junichi Suzuki,Yuji Yamano,Katsuya Oba;Evolutionary deployment optimization for service-oriented clouds.;469-493;25;Volume 41, Number 5, April 2011;
2011;Massimiliano Di Penta,Mark Harman,Giuliano Antoniol;The use of search-based optimization techniques to schedule and staff software projects: an approach and an empirical study.;495-519;25;Volume 41, Number 5, April 2011;
2011;Sukhee Lee,Gigon Bae,Heung Seok Chae,Doo-Hwan Bae,Yong Rae Kwon;Automated scheduling for clone-based refactoring using a competent GA.;521-550;30;Volume 41, Number 5, April 2011;
2011;Dongwon Kang,Jinhwan Jung,Doo-Hwan Bae;Constraint-based human resource allocation in software projects.;551-577;27;Volume 41, Number 5, April 2011;
2011;Kehan Gao,Taghi M. Khoshgoftaar,Huanjing Wang,Naeem Seliya;Choosing software metrics for defect prediction: an investigation on feature selection techniques.;579-606;28;Volume 41, Number 5, April 2011;
2011;Marconi Lanna,Daniel Amyot;Spotting the difference.;607-626;20;Volume 41, Number 6, May 2011;
2011;Roland Ducournau;Coloring, a versatile technique for implementing object-oriented languages.;627-659;33;Volume 41, Number 6, May 2011;
2011;Roland Ducournau,Floreal Morandat;Perfect class hashing and numbering for object-oriented implementation.;661-694;34;Volume 41, Number 6, May 2011;
2011;SeongKi Kim,Ha Yoon Song,Sangyong Han;ZipfAllocation: an algorithm for static allocation of movies in a cluster of video servers.;695-716;22;Volume 41, Number 6, May 2011;
2011;Jonghee M. Youn,Jongwon Lee,Yunheung Paek,Jongeun Lee,Hanno Scharwachter,Rainer Leupers;Fast graph-based instruction selection for multi-output instructions.;717-736;20;Volume 41, Number 6, May 2011;
2011;Yanqin Yang,Haijin Yan,Zili Shao,Minyi Guo;Compiler-assisted dynamic scratch-pad memory management with space overlapping for embedded systems.;737-752;16;Volume 41, Number 7, June 2011;
2011;Andreas Gampe,Jeffery von Ronne,David Niedzielski,Jonathan Vasek,Kleanthis Psarris;Safe, multiphase bounds check elimination in Java.;753-788;36;Volume 41, Number 7, June 2011;
2011;Jose Barranquero Tolosa,Oscar Sanjuan Martinez,Vicente Garcia-Diaz,B. Cristina Pelayo Garcia-Bustelo,Juan Manuel Cueva Lovelle;Towards the systematic measurement of ATL transformation models.;789-815;27;Volume 41, Number 7, June 2011;
2011;Daniel von Dincklage,Amer Diwan;Integrating program analyses with programmer productivity tools.;817-840;24;Volume 41, Number 7, June 2011;
2011;Pengcheng Zhang,Wenrui Li,Dingsheng Wan,Lars Grunske;Monitoring of Probabilistic Timed Property Sequence Charts.;841-866;26;Volume 41, Number 7, June 2011;
2011;Yaser Ghanam,Kendra M. L. Cooper,Frank Maurer;Editorial.;867-869;3;Volume 41, Number 8, July 2011;
2011;Jan Bosch,Petra Bosch-Sijtsema;Introducing agile customer-centered development in a legacy software product line.;871-882;12;Volume 41, Number 8, July 2011;
2011;Geir Kjetil Hanssen;Agile software product line engineering: enabling factors.;883-897;15;Volume 41, Number 8, July 2011;
2011;Ivonei Freitas da Silva,Paulo Anselmo da Mota Silveira Neto,Padraig O'Leary,Eduardo Santana de Almeida,Silvio Romero de Lemos Meira;Agile software product lines: a systematic mapping study.;899-920;22;Volume 41, Number 8, July 2011;
2011;Jessica Diaz,Jennifer Perez,Pedro Pablo Alarcon,Juan Garbajosa;Agile product line engineering - a systematic literature review.;921-941;21;Volume 41, Number 8, July 2011;
2011;Des Greer,Yann Hamon;Agile Software Development.;943-944;2;Volume 41, Number 9, August 2011;
2011;Kevin A. Gary,Andinet Enquobahrie,Luis Ibanez,Patrick Cheng,Ziv Yaniv,Kevin Cleary,Shylaja Kokoori,Benjamin Muffih,John Heidenreich;Agile methods for open source safety-critical software.;945-962;18;Volume 41, Number 9, August 2011;
2011;Jennifer Ferreira,Helen C. Sharp,Hugh Robinson;User experience design and agile development: managing cooperation through articulation work.;963-974;12;Volume 41, Number 9, August 2011;
2011;Kai Petersen,Claes Wohlin;Measuring the flow in lean software development.;975-996;22;Volume 41, Number 9, August 2011;
2011;Ji Wang,Wing Kwong Chan,Fei-Ching Kuo;Introduction to the Special Issue for the 10th International Conference on Quality Software (QSIC 2010).;997-998;2;Volume 41, Number 10, September 2011;
2011;Robert M. Hierons,Mercedes G. Merayo,Manuel Nunez;Scenarios-based testing of systems with distributed ports.;999-1026;28;Volume 41, Number 10, September 2011;
2011;Emad Shihab,Zhen Ming Jiang,Bram Adams,Ahmed E. Hassan,Robert Bowerman;Prioritizing the creation of unit tests in legacy software systems.;1027-1048;22;Volume 41, Number 10, September 2011;
2011;Xulin Zhao,Ying Zou;A business process-driven approach for generating software modules.;1049-1071;23;Volume 41, Number 10, September 2011;
2011;Bo Jiang,T. H. Tse,Wolfgang Grieskamp,Nicolas Kicillof,Yiming Cao,Xiang Li,Wing Kwong Chan;Assuring the model evolution of protocol software specifications by regression testing process improvement.;1073-1103;31;Volume 41, Number 10, September 2011;
2011;Alberto Gonzalez-Sanchez,Eric Piel,Rui Abreu,Hans-Gerhard Gross,Arjan J. C. van Gemund;Prioritizing tests for software fault diagnosis.;1105-1129;25;Volume 41, Number 10, September 2011;
2011;Huai Liu,Xiaodong Xie,Jing Yang 0001,Yansheng Lu,Tsong Yueh Chen;Adaptive random testing through test profiles.;1131-1154;24;Volume 41, Number 10, September 2011;
2011;Anthony Savidis;Integrated implementation of dynamic untyped object-based operator overloading.;1155-1184;30;Volume 41, Number 11, October 2011;
2011;Petr Hnetynka,Frantisek Plasil;Using meta-modeling in design and implementation of component-based systems: the SOFA case study.;1185-1201;17;Volume 41, Number 11, October 2011;
2011;Sandor Dembitz,Mirko Randic,Gordan Gledec;Advantages of online spellchecking: a Croatian example.;1203-1231;29;Volume 41, Number 11, October 2011;
2011;Lars Grunske,Kirsten Winter,Nisansala Yatapanage,Saad Zafar,Peter Alexander Lindsay;Experience with fault injection experiments for FMEA.;1233-1258;26;Volume 41, Number 11, October 2011;
2011;Dennis Jeffrey,Yan Wang,Chen Tian,Rajiv Gupta;Isolating bugs in multithreaded programs using execution suppression.;1259-1288;30;Volume 41, Number 11, October 2011;
2011;Jose M. Such,Juan M. Alberola,Agustin Espinosa Minguet,Ana Garcia-Fornes;A group-oriented secure multiagent platform.;1289-1302;14;Volume 41, Number 11, October 2011;
2011;Masakazu Adachi,Yiannis Papadopoulos,Septavera Sharvia,David Parker 0002,Tetsuya Tohdo;An approach to optimization of fault tolerant architectures using HiP-HOPS.;1303-1327;25;Volume 41, Number 11, October 2011;
2011;Maria-del-Mar Gallardo,Pedro Merino 0001,Laura Panizo,Antonio Linares;A practical use of model checking for synthesis: generating a dam controller for flood management.;1329-1347;19;Volume 41, Number 11, October 2011;
2011;Kostas Saidis,Yannis Smaragdakis,Alex Delis;DOLAR: virtualizing heterogeneous information spaces to support their expansion.;1349-1383;35;Volume 41, Number 11, October 2011;
2011;Roman Obermaisser;Component and service-oriented distributed embedded real-time systems (Extended papers from ISORC 2010).;1385-1386;2;Volume 41, Number 12, November / December 2011;
2011;Kwang-Hae (Kane) Kim,Jing Qian,Zhen Zhang,Qian Zhou,Kyung-Deok Moon,Jun Hee Park,Kwang-Roh Park,Doo-Hyun Kim;A scheme for reliable real-time messaging with bounded delays.;1387-1407;21;Volume 41, Number 12, November / December 2011;
2011;Pablo Basanta-Val,Marisol Garcia-Valls,Iria Estevez-Ayres;Non-functional information transmission patterns for distributed real-time Java.;1409-1435;27;Volume 41, Number 12, November / December 2011;
2011;Paul Lokuciejewski,Sascha Plazar,Heiko Falk,Peter Marwedel,Lothar Thiele;Approximating Pareto optimal compiler optimization sequences - a trade-off between WCET, ACET and code size.;1437-1458;22;Volume 41, Number 12, November / December 2011;
2011;Joseph P. Loyall,Matthew Gillen,Aaron Paulos,Larry Bunch,Marco M. Carvalho,James R. Edmondson,Douglas C. Schmidt,Andrew Martignoni,Asher Sinclair;Dynamic policy-driven quality of service in service-oriented information management systems.;1459-1489;31;Volume 41, Number 12, November / December 2011;
2011;Fabian Scheler,Wolfgang Schroder-Preikschat;The Real-Time Systems Compiler: migrating event-triggered systems to time-triggered systems.;1491-1515;25;Volume 41, Number 12, November / December 2011;
2011;Abhishek Dubey,Gabor Karsai,Nagabhushan Mahadevan;A component model for hard real-time systems: CCM with ARINC-653.;1517-1550;34;Volume 41, Number 12, November / December 2011;
2010;Maria Jump,Kathryn S. McKinley;Detecting memory leaks in managed languages with Cork.;1-22;22;Volume 40, Number 1, January 2010;
