1999;Christopher A. Welty,Michael R. Lowry,Yves Ledru;Guest Editorial.;327-328;2;Volume 6, Number 4, October 1999;
1999;Alessandro Armando,Alan Smaill,Ian Green;Automatic Synthesis of Recursive Programs: The Proof-Planning Paradigm.;329-356;28;Volume 6, Number 4, October 1999;
1999;Jean-Francois Girard,Rainer Koschke,Georg Schied;A Metric-Based Approach to Detect Abstract Data Types and State Encapsulations.;357-386;30;Volume 6, Number 4, October 1999;
1999;Houari A. Sahraoui,Hakim Lounis,Walcélio L. Melo,Hafedh Mili;A Concept Formation Based Approach to Object Identification in Procedural Code.;387-410;24;Volume 6, Number 4, October 1999;
1999;Renaud Marlet,Scott Thibault,Charles Consel;Efficient Implementations of Software Architectures via Partial Evaluation.;411-440;30;Volume 6, Number 4, October 1999;
1999;David Stuart Robertson;Desert Island Column: The Books Don't Work.;441-443;3;Volume 6, Number 4, October 1999;
1998;Elisabetta Di Nitto,Alfonso Fuggetta;Special Issue on Process Technology.;5-6;2;Volume 5, Number 1, January 1998;
1998;Wolfgang Deiters,Volker Gruhn;Process Management in Practice Applying the FUNSOFT Net Approach to Large-Scale Processes.;7-25;19;Volume 5, Number 1, January 1998;
1998;John C. Grundy,John G. Hosking;Serendipity: Integrated Environment Support for Process Modelling, Enactment and Work Coordination.;27-60;34;Volume 5, Number 1, January 1998;
1998;Samir Dami,Jacky Estublier,Mahfoud Amiour;Apel: A Graphical Yet Executable Formalism for Process Modeling.;61-96;36;Volume 5, Number 1, January 1998;
1998;Israel Ben-Shaul,Gail E. Kaiser;Federating Process-Centered Environments: The Oz Experience.;97-132;36;Volume 5, Number 1, January 1998;
1998;Dorothy E. Setliff;A Guide to Rearing Perfect Software: A Desert Island Column.;133-137;5;Volume 5, Number 1, January 1998;
1998;Steven G. Woods,Qiang Yang 0001;Program Understanding as Constraint Satisfaction: Representation and Reasoning Techniques.;147-181;35;Volume 5, Number 2, April 1998;
1998;Jane Hesketh,David Stuart Robertson,Norbert E. Fuchs,Alan Bundy;Lightweight Formalisation in Support of Requirements Engineering.;183-210;28;Volume 5, Number 2, April 1998;
1998;Prodromos D. Chatzoglou,Linda A. Macaulay;A Rule-Based Approach to Developing Software Development Prediction Models.;211-243;33;Volume 5, Number 2, April 1998;
1998;David Budgen;Desert Island Column.;245-247;3;Volume 5, Number 2, April 1998;
1998;Christopher A. Welty;Editorial.;259;1;Volume 5, Number 3, July 1998;
1998;Jason E. Robbins,David M. Hilbert,David F. Redmiles;Extending Design Environments to Software Architecture Design.;261-290;30;Volume 5, Number 3, July 1998;
1998;Thomas Ellman,Takahiro Murata;Deductive Synthesis of Numerical Simulation Programs from Networks of Algebraic and Ordinary Differential Equations.;291-319;29;Volume 5, Number 3, July 1998;
1998;Terence J. Harmer,Patrick J. McParland,James M. Boyle;Transformations to Restructure and Re-engineer COBOL Programs.;321-345;25;Volume 5, Number 3, July 1998;
1998;Alex Quilici,Qiang Yang 0001,Steven Woods;Applying Plan Recognition Algorithms To Program Understanding.;347-372;26;Volume 5, Number 3, July 1998;
1998;Michael D. Harrison;Desert Island Reading.;373-375;3;Volume 5, Number 3, July 1998;
1998;Alistair G. Sutcliffe,David Benyon;Guest Editors' Introduction.;385-387;3;Volume 5, Number 4, October 1998;
1998;Jürgen Angele,Dieter Fensel,Dieter Landes,Rudi Studer;Developing Knowledge-Based Systems with MIKE.;389-418;30;Volume 5, Number 4, October 1998;
1998;Neil A. M. Maiden;CREWS-SAVRE: Scenarios for Acquiring and Validating Requirements.;419-446;28;Volume 5, Number 4, October 1998;
1998;Gerhard Fischer;Seeding, Evolutionary Growth and Reseeding: Constructing, Capturing and Evolving Knowledge in Domain-Oriented Design Environments.;447-464;18;Volume 5, Number 4, October 1998;
1998;Christopher A. Welty;Desert Island Column.;465-469;5;Volume 5, Number 4, October 1998;
1997;Howard B. Reubenstein,Dorothy E. Setliff;Introduction.;5;1;Volume 4, Number 1, January 1997;
1997;Sabine Dick,Thomas Santen;Searching for a Global Search Algorithm.;7-31;25;Volume 4, Number 1, January 1997;
1997;Yves Ledru;Specification and Animation of a Bank Transfer using KIDS/VDM.;33-51;19;Volume 4, Number 1, January 1997;
1997;W. Lewis Johnson,Ali Erdem;Interactive Explanation of Software Systems.;53-75;23;Volume 4, Number 1, January 1997;
1997;Adele E. Howe,Anneliese von Mayrhauser,Richard T. Mraz;Test Case Generation as an AI Planning Problem.;77-106;30;Volume 4, Number 1, January 1997;
1997;Wladyslaw M. Turski;Desert Island Column.;107-109;3;Volume 4, Number 1, January 1997;
1997;Mireille Ducassé;Introduction.;119-120;2;Volume 4, Number 2, April 1997;
1997;Henrik Nilsson,Jan Sparud;The Evaluation Dependence Tree as a Basis for Lazy Functional Debugging.;121-150;30;Volume 4, Number 2, April 1997;
1997;Clemens Beckstein,Gerhard Tobermann;Algorithmic Debugging and Hypothetical Reasoning.;151-178;28;Volume 4, Number 2, April 1997;
1997;Thomas Kunz;High-Level Views of Distributed Executions: Convex Abstract Events.;179-197;19;Volume 4, Number 2, April 1997;
1997;Michael R. Lowry,Jeffrey Van Baalen;META-AMPHION: Synthesis of Efficient Domain-Specific Program Synthesis Systems.;199-241;43;Volume 4, Number 2, April 1997;
1997;Shari Lawrence Pfleeger;Desert Island Column.;243-245;3;Volume 4, Number 2, April 1997;
1997;Christopher A. Welty,Peter G. Selfridge;Artificial Intelligence and Software Engineering: Breaking the Toy Mold.;255-270;16;Volume 4, Number 3, July 1997;
1997;Alex Quilici,Steven Woods;Toward A Constraint-Satisfaction Framework for Evaluating Program-Understanding Algorithms.;271-289;19;Volume 4, Number 3, July 1997;
1997;John Mylopoulos,Alexander Borgida,Eric S. K. Yu;Representing Software Engineering Knowledge.;291-317;27;Volume 4, Number 3, July 1997;
1997;Scott Henninger;Case-Based Knowledge Management Tools for Software Development.;319-340;22;Volume 4, Number 3, July 1997;
1997;Robert E. Filman;Applying AI to Software Renovation.;341-360;20;Volume 4, Number 3, July 1997;
1997;Bernard Cohen;Desert Island Column: Neglected Masterpieces.;361-364;4;Volume 4, Number 3, July 1997;
1997;Leah Goldin,Daniel M. Berry;AbstFinder, A Prototype Natural Language Text Abstraction Finder for Use in Requirements Elicitation.;375-412;38;Volume 4, Number 4, October 1997;
1997;Alistair G. Sutcliffe;Commentary on AbstFinder: A Prototype Natural Language Text Abstraction Finder for Use in Requirements Elicitation.;413-414;2;Volume 4, Number 4, October 1997;
1997;Kevin Ryan;Commentary on AbstFinder: A Prototype Natural Language Test Abstraction Finder for Use in Requirements Elicitation.;415;1;Volume 4, Number 4, October 1997;
1997;Leah Goldin,Daniel M. Berry;Reply to Commentaries.;417-418;2;Volume 4, Number 4, October 1997;
1997;Martin S. Feather,Stephen Fickas,Anthony Finkelstein,Axel van Lamsweerde;Requirements and Specification Exemplars.;419-438;20;Volume 4, Number 4, October 1997;
1997;S.-H. Hahn,J. Kim;Automatic Problem Description from Model Program for Knowledge-based Programming Tutor.;439-461;23;Volume 4, Number 4, October 1997;
1997;Colin Potts;Desert Island Column.;463-466;4;Volume 4, Number 4, October 1997;
1996;Jean-Luc Hainaut,Vincent Englebert,Jean Henrard,Jean-Marc Hick,Didier Roland;Database Reverse Engineering: From Requirements to CARE Tools.;9-45;37;Volume 3, Number 1/2, July 1996;
1996;Spencer Rugaber,Kurt Stirewalt,Linda M. Wills;Understanding Interleaved Code.;47-76;30;Volume 3, Number 1/2, July 1996;
1996;Kostas Kontogiannis,Renato de Mori,Ettore Merlo,Michael Galler,Morris Bernstein;Pattern Matching for Clone and Concept Detection.;77-108;32;Volume 3, Number 1/2, July 1996;
1996;David R. Harris,Alexander S. Yeh,Howard B. Reubenstein;Extracting Architectural Features from Source Code.;109-138;30;Volume 3, Number 1/2, July 1996;
1996;Gerald C. Gannod,Betty H. C. Cheng;Strongest Postcondition Semantics as the Formal Basis for Reverse Engineering.;139-164;26;Volume 3, Number 1/2, July 1996;
1996;Linda M. Wills,James H. Cross II;Recent Trends and Open Issues in Reverse Engineering.;165-172;8;Volume 3, Number 1/2, July 1996;
1996;Fraser MacDonald,James Miller,Andrew Brooks,Marc Roper,Murray Wood;Automating the Software Inspection Process.;193-218;26;Volume 3, Number 3/4, August 1996;
1996;Dipayan Gangopadhyay,Subrata Mitra;Design by Framework Completion.;219-237;19;Volume 3, Number 3/4, August 1996;
1996;Scott Henninger;Building an Organization-Specific Infrastructure to Support CASE Tools.;239-259;21;Volume 3, Number 3/4, August 1996;
1996;Keng Ng,Jeff Kramer,Jeff Magee;A CASE Tool for Software Architecture Design.;261-284;24;Volume 3, Number 3/4, August 1996;
1996;Hassan Gomaa,Larry Kerschberg,Vijayan Sugumaran,C. Bosch,I. Tavakoli,L. O'Hara;A Knowledge-Based Software Engineering Environment for Reusable Software Requirements and Architectures.;285-307;23;Volume 3, Number 3/4, August 1996;
1996;Giuseppe Valetto,Gail E. Kaiser;Enveloping Sophisticated Tools into Process-Centered Environments.;309-345;37;Volume 3, Number 3/4, August 1996;
1996;John Krogstie;Use of Methods and CASE-Tools in Norway: Results from a Survey.;347-367;21;Volume 3, Number 3/4, August 1996;
1996;David Abramson,Rok Sosic;A Debugging and Testing Tool for Supporting Software Evolution.;369-390;22;Volume 3, Number 3/4, August 1996;
1995;Shing-Chi Cheung,Jeff Kramer;Contextual Local Analysis in the Design of Distributed Systems.;5-32;28;Volume 2, Number 1, March 1995;
1995;Robert J. Hall;Automatic Extraction of Executable Program Subsets by Simultaneous Dynamic Program Slicing.;33-53;21;Volume 2, Number 1, March 1995;
1995;Panagiotis Katalagarianos,Yannis Vassiliou;On the Reuse of Software: A Case-Based Approach Employing a Repository.;55-86;32;Volume 2, Number 1, March 1995;
1995;Kostas Kontogiannis,Peter G. Selfridge;Workshop Report: The Two-Day Workshop on Research Issues in the Intersection between Software Engineering and Artificial Intelligence (Held in conjunction with ICSE-16).;87-97;11;Volume 2, Number 1, March 1995;
1995;William W. Cohen;Inductive Specification Recovery: Understanding Software by Learning from Example Behaviors.;107-129;23;Volume 2, Number 2, June 1995;
1995;Robert J. Hall;Systematic Incremental Validation of Reactive Systems via Sound Scenario Generalization.;131-166;36;Volume 2, Number 2, June 1995;
1995;Akira Takura,Keizo Kawata,Tadashi Ohta;Process Specification Generation from Communications Service Specifications.;167-182;16;Volume 2, Number 2, June 1995;
1995;Barry W. Boehm,Prasanta K. Bose;Critical Success Factors for Knowledge-Based Software Engineering Applications.;193-202;10;Volume 2, Number 3, September 1995;
1995;Gregory Alan Bolcer;User Interface Design Assistance For Large-Scale Software Development.;203-217;15;Volume 2, Number 3, September 1995;
1995;Raymond J. Madachy;Knowledge-Based Risk Assessment and Cost Estimation.;219-230;12;Volume 2, Number 3, September 1995;
1995;Gregory A. Toth;Automated Method for Identifying and Prioritizing Project Risk Factors.;231-248;18;Volume 2, Number 3, September 1995;
1995;Bashar Nuseibeh;Report on the Second IEEE International Symposium on Requirements Engineering (RE `95), York, UK, 27-29 March 1995.;249-253;5;Volume 2, Number 3, September 1995;
1995;Colin Tully;Desert Island Column.;255-258;4;Volume 2, Number 3, September 1995;
1995;Ugo A. Buy,Robert Moll;A Specification-Based Approach to Concurrency Analysis.;265-309;45;Volume 2, Number 4, December 1995;
1995;George Spanoudakis,Panos Constantopoulos;Integrating Specifications: A Similarity Reasoning Approach.;311-342;32;Volume 2, Number 4, December 1995;
1995;Linda A. Macaulay,John Mylopoulos;Requirements Engineering: An Educational Dilemma.;343-351;9;Volume 2, Number 4, December 1995;
1995;Michael Jackson;Desert Island Column.;353-355;3;Volume 2, Number 4, December 1995;
1994;W. Lewis Johnson,Anthony Finkelstein;Introduction.;7-8;2;Volume 1, Number 1, March 1994;
1994;W. Lewis Johnson;Introduction to the special issue on knowledge based software engineering.;9-10;2;Volume 1, Number 1, March 1994;
1994;Yingsha Liao;Efficiently computing derived performance data.;11-29;19;Volume 1, Number 1, March 1994;
1994;Martin S. Feather;Towards a derivational style of distributed system design - An example.;31-59;29;Volume 1, Number 1, March 1994;
1994;Wojtek Kozaczynski,Jim Q. Ning;Automated program understanding by concept recognition.;61-78;18;Volume 1, Number 1, March 1994;
1994;Richard M. Keller,Michal Rimon,Aseem Das;A knowledge-based prototyping environment for construction of scientific modeling software.;79-128;50;Volume 1, Number 1, March 1994;
1994;Stephan Jacobs,Matthias Jarke,Klaus Pohl;Report on the first international IEEE symposium on requirements engineering (RE93) San Diego, January 4-6, 1993.;129-132;4;Volume 1, Number 1, March 1994;
1994;Peter G. Selfridge;Report on the First Working Conference on Reverse Engineering, May 21-23, 1993, Baltimore, Maryland, in conjunction with the International Conference on Software Engineering.;133-139;7;Volume 1, Number 1, March 1994;
1994;Stephen Fickas;Desert Island column.;141-146;6;Volume 1, Number 1, March 1994;
1994;Tobiah E. Smith,Dorothy E. Setliff;Using simulated annealing to synthesize resource-bounded software.;155-176;22;Volume 1, Number 2, June 1994;
1994;Gerhard Fischer;Domain-oriented design environments.;177-203;27;Volume 1, Number 2, June 1994;
1994;Alistair Sutcliffe;Commentary on 'Domain oriented design environments' by Gerhard Fischer.;205-208;4;Volume 1, Number 2, June 1994;
1994;Dorothy E. Setliff;Birds of a feather: The DODE and domain-specific software synthesis systems.;209-213;5;Volume 1, Number 2, June 1994;
1994;Jim Q. Ning;Developing domain-oriented design environments - The question is;215-218;4;Volume 1, Number 2, June 1994;
1994;Peter G. Selfridge;"Commentary on ""Domain-oriented design environments"" by Gerhard Fischer.";219-222;4;Volume 1, Number 2, June 1994;
1994;Gerhard Fischer;Domain-oriented design environments: Reply to commentaries.;223-229;7;Volume 1, Number 2, June 1994;
1994;Sanjay Bhansali;Software synthesis using generic architectures.;239-279;41;Volume 1, Numbers 3-4, September 1994;
1994;Rattikorn Hewett,Micheal Hewett;A knowledge-based framework for automated software synthesis.;281-314;34;Volume 1, Numbers 3-4, September 1994;
1994;Enn Tyugu;Using classes as specifications for automatic construction of programs in the NUT system.;315-334;20;Volume 1, Numbers 3-4, September 1994;
1994;Chris Welty;The Eighth Annual Knowledge-Based Software Engineering Conference.;335-339;5;Volume 1, Numbers 3-4, September 1994;
