2017;Massila Kamalrudin,John G. Hosking,John Grundy;MaramaAIC: tool support for consistency management and validation of requirements.;1-45;45;Volume 24, Number 1, March 2017;
2017;Zhi-Wu Zhang,Xiao-Yuan Jing,Tiejian Wang;Label propagation based semi-supervised learning for software defect prediction.;47-69;23;Volume 24, Number 1, March 2017;
2017;José Merseguer,Walter Binder,John Murphy 0001;Guest Editorial: Automation in Software Performance Engineering.;71-72;2;Volume 24, Number 1, March 2017;
2017;Ricardo J. Rodríguez;A Petri net tool for software performance estimation based on upper throughput bounds.;73-99;27;Volume 24, Number 1, March 2017;
2017;Yu Sun 0002,Jules White,Bo Li,Michael Walker,Hamilton A. Turner;Automated QoS-oriented cloud resource optimization using containers.;101-137;37;Volume 24, Number 1, March 2017;
2017;Lubomír Bulej,Tomás Bures,Vojtech Horký,Jaroslav Kotrc,Lukás Marek,Tomás Trojánek,Petr Tuma;Unit testing performance with Stochastic Performance Logic.;139-187;49;Volume 24, Number 1, March 2017;
2017;Mark D. Syer,Weiyi Shang,Zhen Ming Jiang,Ahmed E. Hassan;Continuous validation of performance test workloads.;189-231;43;Volume 24, Number 1, March 2017;
2016;Robert J. Hall;Editorial introduction.;1-2;2;Volume 23, Number 1, March 2016;
2016;Tegawendé F. Bissyandé,Laurent Réveillère,Julia L. Lawall,Gilles Muller;Ahead of time static analysis for automatic generation of debugging interfaces to the Linux kernel.;3-41;39;Volume 23, Number 1, March 2016;
2016;Xin Xia,Liang Gong,Tien-Duy B. Le,David Lo,Lingxiao Jiang,Hongyu Zhang;Diversity maximization speedup for localizing faults in single-fault and multi-fault programs.;43-75;33;Volume 23, Number 1, March 2016;
2016;Jeffrey L. Overbey,Ralph E. Johnson,Munawar Hafiz;Differential precondition checking: a language-independent, reusable analysis for refactoring engines.;77-104;28;Volume 23, Number 1, March 2016;
2016;Dietmar Jannach,Thomas Schmitz;Model-based diagnosis of spreadsheet programs: a constraint-based debugging approach.;105-144;40;Volume 23, Number 1, March 2016;
2016;Robert J. Hall;Editorial Introduction.;145-146;2;Volume 23, Number 2, June 2016;
2016;Ebrahim Bagheri,Faezeh Ensan;Semantic tagging and linking of software engineering social content.;147-190;44;Volume 23, Number 2, June 2016;
2016;Olivier Ponsini,Claude Michel,Michel Rueher;Verifying floating-point programs with constraint programming and abstract interpretation techniques.;191-217;27;Volume 23, Number 2, June 2016;
2016;Alejandro Rago,Claudia Marcos,Jorge Andrés Díaz Pace;Assisting requirements analysts to find latent concerns with REAssistant.;219-252;34;Volume 23, Number 2, June 2016;
2016;Thomas R. Devine,Katerina Goseva-Popstojanova,Sandeep Krishnan,Robyn R. Lutz;Assessment and cross-product prediction of software product line quality: accounting for reuse across products, over multiple releases.;253-302;50;Volume 23, Number 2, June 2016;
2016;Robert J. Hall;Editorial introduction.;303-304;2;Volume 23, Number 3, September 2016;
2016;Louise A. Dennis,Michael Fisher,Nicholas Lincoln,Alexei Lisitsa,Sandor M. Veres;Practical verification of decision-making in agent-based autonomous systems.;305-359;55;Volume 23, Number 3, September 2016;
2016;Jácome Cunha,Martin Erwig,Jorge Mendes,João Saraiva;Model inference for spreadsheets.;361-392;32;Volume 23, Number 3, September 2016;
2016;Shaowei Wang,David Lo,Lingxiao Jiang;AutoQuery: automatic construction of dependency queries for code search.;393-425;33;Volume 23, Number 3, September 2016;
2016;Minh Tu Ton That,Salah Sadou,Flávio Oquendo,Régis Fleurquin;Preserving architectural decisions through architectural patterns.;427-467;41;Volume 23, Number 3, September 2016;
2016;Tian Tian,Dunwei Gong;Test data generation for path coverage of message-passing parallel programs based on co-evolutionary genetic algorithms.;469-500;32;Volume 23, Number 3, September 2016;
2016;Santiago A. Vidal,Claudia Marcos,Jorge Andrés Díaz Pace;An approach to prioritize code smells for refactoring.;501-532;32;Volume 23, Number 3, September 2016;
2016;Robert J. Hall;Editorial introduction.;533-534;2;Volume 23, Number 4, December 2016;
2016;Chun-Feng Liao,Kung Chen,Deik Hoong Tan,Jiu-Jye Chen;Automatic query rewriting schemes for multitenant SaaS applications.;535-568;34;Volume 23, Number 4, December 2016;
2016;Tiejian Wang,Zhiwu Zhang,Xiaoyuan Jing,Liqiang Zhang;Multiple kernel ensemble learning for software defect prediction.;569-590;22;Volume 23, Number 4, December 2016;
2016;Daeyoung Kim 0004,Amruta Gokhale,Vinod Ganapathy,Abhinav Srivastava;Detecting plagiarized mobile apps using API birthmarks.;591-618;28;Volume 23, Number 4, December 2016;
2016;Shane McIntosh,Bram Adams,Meiyappan Nagappan,Ahmed E. Hassan;Identifying and understanding header file hotspots in C/C++ build processes.;619-647;29;Volume 23, Number 4, December 2016;
2016;Pierre André Ménard,Sylvie Ratté;Concept extraction from business documents for software engineering projects.;649-686;38;Volume 23, Number 4, December 2016;
2016;Johannes Bürdek,Timo Kehrer,Malte Lochau,Dennis Reuling,Udo Kelter,Andy Schürr;Reasoning about product-line evolution using complex feature model differences.;687-733;47;Volume 23, Number 4, December 2016;
2015;Rachel Harrison,Tim Menzies;Guest editorial: special issue on realizing AI synergies in software engineering.;1-2;2;Volume 22, Number 1, March 2015;
2015;LiGuo Huang,Vincent Ng,Isaac Persing,Mingrui Chen,Zeheng Li,Ruili Geng,Jeff Tian;AutoODC: Automated generation of orthogonal defect classifications.;3-46;44;Volume 22, Number 1, March 2015;
2015;Birgit Hofer,Alexandre Perez,Rui Abreu,Franz Wotawa;On the empirical evaluation of similarity coefficients for spreadsheets fault localization.;47-74;28;Volume 22, Number 1, March 2015;
2015;Xin Xia,David Lo,Emad Shihab,Xinyu Wang,Bo Zhou;Automatic, high accuracy prediction of reopened bugs.;75-109;35;Volume 22, Number 1, March 2015;
2015;Wei Zhang,LiGuo Huang,Vincent Ng,Jidong Ge;SMPLearner: learning to predict software maintainability.;111-141;31;Volume 22, Number 1, March 2015;
2015;Rachel Harrison,Tim Menzies;Guest editorial: special issue on realizing AI synergies in software engineering (part 2).;143-144;2;Volume 22, Number 2, June 2015;
2015;Mika Cohen,Ulrik Franke;An experiment in ontology use for command and control interoperability.;145-157;13;Volume 22, Number 2, June 2015;
2015;Constance L. Heitmeyer,Marc Pickett,Elizabeth I. Leonard,Myla M. Archer,Indrakshi Ray,David W. Aha,J. Gregory Trafton;Building high assurance human-centric decision systems.;159-197;39;Volume 22, Number 2, June 2015;
2015;Aldeida Aleti;Designing automotive embedded systems with adaptive genetic algorithms.;199-240;42;Volume 22, Number 2, June 2015;
2015;Samad Paydar,Mohsen Kahani;A semantic web enabled approach to reuse functional requirements models in web engineering.;241-288;48;Volume 22, Number 2, June 2015;
2015;Tim Menzies,Corina S. Pasareanu;Guest editorial: special multi-issue on selected topics in Automated Software Engineering.;289-290;2;Volume 22, Number 3, September 2015;
2015;Adel Noureddine,Romain Rouvoy,Lionel Seinturier;Monitoring energy hotspots in software - Energy profiling of software code.;291-332;42;Volume 22, Number 3, September 2015;
2015;Xusheng Xiao,Nikolai Tillmann,Manuel Fähndrich,Jonathan de Halleux,Michal Moskal,Tao Xie;User-aware privacy control via extended static-information-flow analysis.;333-366;34;Volume 22, Number 3, September 2015;
2015;Olaf Leßenich,Sven Apel,Christian Lengauer;Balancing precision and performance in structured merge.;367-397;31;Volume 22, Number 3, September 2015;
2015;Ábel Hegedüs,Ákos Horváth,Dániel Varró;A model-driven framework for guided design space exploration.;399-436;38;Volume 22, Number 3, September 2015;
2015;Tim Menzies,Corina S. Pasareanu;Guest editorial: special multi-issue on selected topics in automated software engineering.;437-438;2;Volume 22, Number 4, December 2015;
2015;Kai Pan,Xintao Wu,Tao Xie;Program-input generation for testing database applications using existing database states.;439-473;35;Volume 22, Number 4, December 2015;
2015;Kari Kähkönen,Olli Saarikivi,Keijo Heljanko;Unfolding based automated testing of multithreaded programs.;475-515;41;Volume 22, Number 4, December 2015;
2015;Franjo Ivancic,Gogul Balakrishnan,Aarti Gupta,Sriram Sankaranarayanan,Naoto Maeda,Takashi Imoto,Rakesh Pothengil,Mustafa Hussain;Scalable and scope-bounded software verification in Varvel.;517-559;43;Volume 22, Number 4, December 2015;
2015;Ferdian Thung,Lucia,David Lo,Lingxiao Jiang,Foyzur Rahman,Premkumar T. Devanbu;To what extent could we detect field defects? An extended empirical study of false negatives in static bug-finding tools.;561-602;42;Volume 22, Number 4, December 2015;
2014;Robert J. Hall;Editorial: ASE 2013 Conference Trip Report.;1-2;2;Volume 21, Number 1, March 2014;
2014;Venkata Krishna Suhas Nerella,Swetha Surapaneni,Sanjay Kumar Madria,Thomas Weigert;Exploring optimization and caching for efficient collection operations.;3-40;38;Volume 21, Number 1, March 2014;
2014;Niklas Lavesson,Veselka Boeva,Elena Tsiporkova,Paul Davidsson;A method for evaluation of learning components.;41-63;23;Volume 21, Number 1, March 2014;
2014;Bao N. Nguyen,Bryan Robbins,Ishan Banerjee,Atif M. Memon;GUITAR: an innovative tool for automated testing of GUI-driven software.;65-105;41;Volume 21, Number 1, March 2014;
2014;Omar Chebaro,Pascal Cuoq,Nikolai Kosmatov,Bruno Marre,Anne Pacalet,Nicky Williams,Boris Yakobowski;Behind the scenes in SANTE: a combination of static and dynamic analyses.;107-143;37;Volume 21, Number 1, March 2014;
2014;Robert J. Hall;Editorial introduction.;145-146;2;Volume 21, Number 2, April 2014;
2014;Óscar Sánchez Ramón,Jesús Sánchez Cuadrado,Jesús García Molina;Model-driven reverse engineering of legacy graphical user interfaces.;147-186;40;Volume 21, Number 2, April 2014;
2014;Mohamed Almorsy,John Grundy,Amani S. Ibrahim;Adaptable, model-driven security engineering for SaaS cloud-based applications.;187-224;38;Volume 21, Number 2, April 2014;
2014;Alessandro Armando,Massimo Benerecetti,Jacopo Mantovani;Counterexample-guided abstraction refinement for linear programs with arrays.;225-285;61;Volume 21, Number 2, April 2014;
2014;David Bowes,Tracy Hall,David Gray;DConfusion: a technique to allow cross study performance evaluation of fault prediction studies.;287-313;27;Volume 21, Number 2, April 2014;
2014;Ching-Hsien Hsu,John Grundy;Guest editorial: automated techniques for migrating to the Cloud (I).;315-318;4;Volume 21, Number 3, September 2014;
2014;Claudia Canali,Riccardo Lancellotti;Exploiting ensemble techniques for automatic virtual machine clustering in cloud systems.;319-344;26;Volume 21, Number 3, September 2014;
2014;Young-Woo Kwon,Eli Tilevich;Cloud refactoring: automated transitioning to cloud-based services.;345-372;28;Volume 21, Number 3, September 2014;
2014;Min-Shiang Hwang,Cheng-Chi Lee,Tsuei-Hung Sun;Data error locations reported by public auditing in cloud storage service.;373-390;18;Volume 21, Number 3, September 2014;
2014;Luis Omar Colombo-Mendoza,Giner Alor-Hernández,Alejandro Rodríguez González,Rafael Valencia-García;MobiCloUP!: a PaaS for cloud services-based mobile applications.;391-437;47;Volume 21, Number 3, September 2014;
2014;Ching-Hsien Hsu,John C. Grundy;Guest editorial: automated techniques for migrating to the cloud (II).;439-442;4;Volume 21, Number 4, December 2014;
2014;Kuen-Ming Lee,Wei-Guang Teng,Jin-Neng Wu,Kuo-Ming Huang,Yao-Hsing Ko,Ting-Wei Hou;Multicast and customized deployment of large-scale operating systems.;443-460;18;Volume 21, Number 4, December 2014;
2014;Zhichun Jia,Rong Chen,Xing Xing,Junjie Xu,Yiwu Xie;SFDCloud: top-k service faults diagnosis in cloud computing.;461-488;28;Volume 21, Number 4, December 2014;
2014;Wu-Chun Chung,Hung-Pin Lin,Shih-Chang Chen,Mon-Fong Jiang,Yeh-Ching Chung;JackHare: a framework for SQL to NoSQL translation using MapReduce.;489-508;20;Volume 21, Number 4, December 2014;
2014;Miyuru Dayarathna,Toyotaro Suzumura;Graph database benchmarking on cloud environments with XGDBench.;509-533;25;Volume 21, Number 4, December 2014;
2013;Robert J. Hall;Editorial: ASE 2012 conference trip report.;1-4;4;Volume 20, Number 1, March 2013;
2013;Esther Guerra,Juan de Lara,Manuel Wimmer,Gerti Kappel,Angelika Kusel,Werner Retschitzegger,Johannes Schönböck,Wieland Schwinger;Automated verification of model transformations based on visual contracts.;5-46;42;Volume 20, Number 1, March 2013;
2013;Ali Ouni 0001,Marouane Kessentini,Houari A. Sahraoui,Mounir Boukadoum;Maintainability defects detection and correction: a multi-objective approach.;47-79;33;Volume 20, Number 1, March 2013;
2013;Hui Liu,Zhendong Niu,Zhiyi Ma,Weizhong Shao;Identification of generalization refactoring opportunities.;81-110;30;Volume 20, Number 1, March 2013;
2013;Alberto Sardinha,Ruzanna Chitchyan,Nathan Weston,Phil Greenwood,Awais Rashid;EA-Analyzer: automating conflict detection in a large set of textual aspect-oriented requirements.;111-135;25;Volume 20, Number 1, March 2013;
2013;John Grundy,John G. Hosking;Guest editors introduction: special issue on innovative automated software engineering tools.;137-139;3;Volume 20, Number 2, June 2013;
2013;Thorsten Arendt,Gabriele Taentzer;A tool environment for quality assurance based on the Eclipse Modeling Framework.;141-184;44;Volume 20, Number 2, June 2013;
2013;Ståle Walderhaug;Design and evaluation of the ModelHealth toolchain for continuity of care web services.;185-235;51;Volume 20, Number 2, June 2013;
2013;Colin O'Halloran;Automated verification of code automatically generated from Simulink®.;237-264;28;Volume 20, Number 2, June 2013;
2013;Alexander Nöhrer,Alexander Egyed;C2O configurator: a tool for guided decision-making.;265-296;32;Volume 20, Number 2, June 2013;
2013;John Grundy,John G. Hosking;Guest editors introduction: special issue on innovative automated software engineering tools - part #2.;297-298;2;Volume 20, Number 3, September 2013;
2013;Roberto Silveira Silva Filho,William M. Hasling,Christof J. Budnik,Monica McKenna;Experiences using Tedeso: an extensible and interoperable model-based testing platform.;299-337;39;Volume 20, Number 3, September 2013;
2013;Markus Voelter,Daniel Ratiu,Bernd Kolb,Bernhard Schätz;mbeddr: instantiating a language workbench in the embedded software domain.;339-390;52;Volume 20, Number 3, September 2013;
2013;Corina S. Pasareanu,Willem Visser,David H. Bushnell,Jaco Geldenhuys,Peter C. Mehlitz,Neha Rungta;Symbolic PathFinder: integrating symbolic execution with model checking for Java bytecode analysis.;391-425;35;Volume 20, Number 3, September 2013;
2013;Rita Suzana Pitangueira Maciel,Ramon Araújo Gomes,Ana Patrícia Fontes Magalhães,Bruno Carreiro da Silva,João Pedro B. Queiroz;Supporting model-driven development using a process-centered software engineering environment.;427-461;35;Volume 20, Number 3, September 2013;
2013;Giacomo Ghezzi,Harald C. Gall;A framework for semi-automated software evolution analysis composition.;463-496;34;Volume 20, Number 3, September 2013;
2013;Robert J. Hall;Editorial introduction.;497-498;2;Volume 20, Number 4, December 2013;
2013;Anna Hristoskova,Bruno Volckaert,Filip De Turck;The WTE+ framework: automated construction and runtime adaptation of service mashups.;499-542;44;Volume 20, Number 4, December 2013;
2013;Jacky Keung,Ekrem Kocaguneli,Tim Menzies;Finding conclusion stability for selecting the best effort predictor in software effort estimation.;543-567;25;Volume 20, Number 4, December 2013;
2013;María-del-Mar Gallardo,David Sanán;Verification of complex dynamic data tree with mu-calculus.;569-612;44;Volume 20, Number 4, December 2013;
2012;Robert J. Hall;Editorial: ASE 2011 conference trip report.;1-3;3;Volume 19, Number 1, March 2012;
2012;Louise A. Dennis,Michael Fisher,Matthew P. Webster,Rafael H. Bordini;Model checking agent programming languages.;5-63;59;Volume 19, Number 1, March 2012;
2012;Yves Ledru,Alexandre Petrenko,Sergiy Boroday,Nadine Mandran;Prioritizing test cases with string distances.;65-95;31;Volume 19, Number 1, March 2012;
2012;Yosi Ben-Asher,Tomer Gal,Gadi Haber,Marcel Zalmanovici;Refactoring techniques for aggressive object inlining in Java applications.;97-136;40;Volume 19, Number 1, March 2012;
2012;Ayse Basar Bener,Tim Menzies;Guest editorial: learning to organize testing.;137-140;4;Volume 19, Number 2, June 2012;
2012;Dimitris Liparas,Lefteris Angelis,Robert Feldt;Applying the Mahalanobis-Taguchi strategy for software defect diagnosis.;141-165;25;Volume 19, Number 2, June 2012;
2012;Zhimin He,Fengdi Shu,Ye Yang,Mingshu Li,Qing Wang;An investigation on the feasibility of cross-project defect prediction.;167-199;33;Volume 19, Number 2, June 2012;
2012;Ming Li 0005,Hongyu Zhang,Rongxin Wu,Zhi-Hua Zhou;Sample-based software defect prediction with active and semi-supervised learning.;201-230;30;Volume 19, Number 2, June 2012;
2012;Robert J. Hall;Editorial: analysis in software engineering.;231-232;2;Volume 19, Number 3, September 2012;
2012;Xianghua Deng,Jooyong Lee,Robby;Efficient and formal generalized symbolic execution.;233-301;69;Volume 19, Number 3, September 2012;
2012;Seyed Reza Shahamiri,Wan M. N. Wan-Kadir,Suhaimi Ibrahim,Siti Zaiton Mohd Hashim;Artificial neural networks as multi-networks automated test oracle.;303-334;32;Volume 19, Number 3, September 2012;
2012;Ebrahim Bagheri,Faezeh Ensan,Dragan Gasevic;Decision support for the software product line domain engineering lifecycle.;335-377;43;Volume 19, Number 3, September 2012;
2012;Robert J. Hall;Editorial: selected topics in ASE.;379-380;2;Volume 19, Number 4, December 2012;
2012;Nicolas Mangano,André van der Hoek;The design and evaluation of a tool to support software designers at the whiteboard.;381-421;41;Volume 19, Number 4, December 2012;
2012;David Lo,Shahar Maoz;Scenario-based and value-based specification mining: better together.;423-458;36;Volume 19, Number 4, December 2012;
2012;Adam Duley,Chris Spandikow,Miryung Kim;Vdiff: a program differencing algorithm for Verilog hardware description language.;459-490;32;Volume 19, Number 4, December 2012;
2012;KyungHee Kim,Tuba Yavuz-Kahveci,Beverly A. Sanders;JRF-E: using model checking to give advice on eliminating memory model-related bugs.;491-530;40;Volume 19, Number 4, December 2012;
2012;Pieter Hooimeijer,Westley Weimer;StrSolve: solving string constraints lazily.;531-559;29;Volume 19, Number 4, December 2012;
2011;Robert J. Hall;Editorial: ASE 2010 Conference trip report.;1-3;3;Volume 18, Number 1, March 2011;
2011;Christos Kloukinas,Sergio Yovine;A model-based approach for multiple QoS in scheduling: from models to implementation.;5-38;34;Volume 18, Number 1, March 2011;
2011;Jing Liu,Samik Basu,Robyn R. Lutz;Compositional model checking of software product lines using variation point obligations.;39-76;38;Volume 18, Number 1, March 2011;
2011;Deepak Dhungana,Paul Grünbacher,Rick Rabiser;The DOPLER meta-tool for decision-oriented variability modeling: a multiple case study.;77-114;38;Volume 18, Number 1, March 2011;
2011;Robert J. Hall;Editorial: Controlling change.;115-116;2;Volume 18, Number 2, June 2011;
2011;Khaled Mahbub,George Spanoudakis,Andrea Zisman;A monitoring approach for runtime service discovery.;117-161;45;Volume 18, Number 2, June 2011;
2011;Marko Rosenmüller,Norbert Siegmund,Sven Apel,Gunter Saake;Flexible feature binding in software product lines.;163-197;35;Volume 18, Number 2, June 2011;
2011;Marouane Kessentini,Houari A. Sahraoui,Mounir Boukadoum;Example-based model-transformation testing.;199-224;26;Volume 18, Number 2, June 2011;
2011;Mats Per Erik Heimdahl,Gabriele Taentzer;Guest editorial: special issue on selected topics in automated software engineering - Specification mining and defect detection.;225-226;2;Volume 18, Numbers 3-4, December 2011;
2011;Hao Zhong,Lu Zhang 0023,Tao Xie,Hong Mei;Inferring specifications for resources from natural language API documentation.;227-261;35;Volume 18, Numbers 3-4, December 2011;
2011;Andrzej Wasylkowski,Andreas Zeller;Mining temporal specifications from object usage.;263-292;30;Volume 18, Numbers 3-4, December 2011;
2011;Suresh Thummalapenta,Tao Xie;Alattin: mining alternative patterns for defect detection.;293-323;31;Volume 18, Numbers 3-4, December 2011;
2011;Jyotirmoy V. Deshmukh,E. Allen Emerson,Sriram Sankaranarayanan;Symbolic modular deadlock analysis.;325-362;38;Volume 18, Numbers 3-4, December 2011;
2011;Sangmok Han,David R. Wallace,Robert C. Miller;Code completion of multiple keywords from abbreviated input.;363-398;36;Volume 18, Numbers 3-4, December 2011;
2010;Robert J. Hall;Editorial: ASE 2009 conference trip report.;1-4;4;Volume 17, Number 1, March 2010;
2010;Dan Hao,Tao Xie,Lu Zhang 0023,Xiaoyin Wang,Jiasu Sun,Hong Mei;Test input reduction for result inspection to facilitate fault localization.;5-31;27;Volume 17, Number 1, March 2010;
2010;Karnig Derderian,Robert M. Hierons,Mark Harman,Qiang Guo;Estimating the feasibility of transition paths in extended finite state machines.;33-56;24;Volume 17, Number 1, March 2010;
2010;Hongbing Kou,Philip M. Johnson,Hakan Erdogmus;Operational definition and automated inference of test-driven development with Zorro.;57-85;29;Volume 17, Number 1, March 2010;
2010;Gregory Gay,Tim Menzies,Omid Jalali,Gregory E. Mundy,Beau Gilkerson,Martin S. Feather,James D. Kiper;Finding robust solutions in requirements models.;87-116;30;Volume 17, Number 1, March 2010;
2010;Andrew Ireland,Willem Visser;Guest Editorial.;117-118;2;Volume 17, Number 2, June 2010;
2010;Jesper Andersen,Julia L. Lawall;Generic patch inference.;119-148;30;Volume 17, Number 2, June 2010;
2010;Patrick O'Neil Meredith,Dongyun Jin,Feng Chen,Grigore Rosu;Efficient monitoring of parametric context-free patterns.;149-180;32;Volume 17, Number 2, June 2010;
2010;Romain Robbes,Michele Lanza;Improving code completion with program history.;181-212;32;Volume 17, Number 2, June 2010;
2010;Robert J. Hall;Editorial: software defect detection.;213-215;3;Volume 17, Number 3, September 2010;
2010;Robert M. Hierons,Hasan Ural;Generating a checking sequence with a minimum number of reset transitions.;217-250;34;Volume 17, Number 3, September 2010;
2010;Sven Apel,Christian Kästner,Armin Größlinger,Christian Lengauer;Type safety for feature-oriented product lines.;251-300;50;Volume 17, Number 3, September 2010;
2010;Eric Larson;SUDS: an infrastructure for creating dynamic software defect detection tools.;301-346;46;Volume 17, Number 3, September 2010;
2010;Alex Edwards,Sean Tucker,Brian Demsky;AFID: an automated approach to collecting software faults.;347-372;26;Volume 17, Number 3, September 2010;
2010;Robert J. Hall;Editorial: data mining in software engineering.;373-374;2;Volume 17, Number 4, December 2010;
2010;Tim Menzies,Zach Milton,Burak Turhan,Bojan Cukic,Yue Jiang,Ayse Basar Bener;Defect prediction from static code features: current results, limitations, new approaches.;375-407;33;Volume 17, Number 4, December 2010;
2010;Tim Menzies,Omid Jalali,Jairus Hihn,Daniel Baker,Karen T. Lum;Stable rankings for different effort models.;409-437;29;Volume 17, Number 4, December 2010;
2010;Gregory Gay,Tim Menzies,Misty Davies,Karen Gundy-Burlet;Automatically finding the control variables for complex system behavior.;439-468;30;Volume 17, Number 4, December 2010;
2009;Alexander Egyed,Bernd Fischer 0002;Guest editors' introduction.;1-2;2;Volume 16, Number 1, March 2009;
2009;Yiqiao Wang 0001,Sheila A. McIlraith,Yijun Yu,John Mylopoulos;Monitoring and diagnosing software requirements.;3-35;33;Volume 16, Number 1, March 2009;
2009;Greg Little,Robert C. Miller;Keyword programming in Java.;37-71;35;Volume 16, Number 1, March 2009;
2009;Yannis Smaragdakis,Christoph Csallner,Ranjith Subramanian;Scalable satisfiability checking and test data generation from modeling diagrams.;73-99;27;Volume 16, Number 1, March 2009;
2009;Michal Antkiewicz,Thiago T. Bartolomei,Krzysztof Czarnecki;Fast extraction of high-quality framework-specific models from application code.;101-144;44;Volume 16, Number 1, March 2009;
2009;Shay Artzi,Adam Kiezun,Jaime Quinonez,Michael D. Ernst;Parameter reference immutability: formal definition, inference tool, and comparison.;145-192;48;Volume 16, Number 1, March 2009;
2009;Michael W. Godfrey,Bogdan Korel;Editorial for Special Issue of JASE on Source Code Analysis and Manipulation.;193-195;3;Volume 16, Number 2, June 2009;
2009;Dennis Giffhorn,Christian Hammer 0001;Precise slicing of concurrent programs.;197-234;38;Volume 16, Number 2, June 2009;
2009;Mariano Ceccato,Mila Dalla Preda,Jasvir Nagra,Christian S. Collberg,Paolo Tonella;Trading-off security and performance in barrier slicing for remote software entrusting.;235-261;27;Volume 16, Number 2, June 2009;
2009;Andreas Lochbihler,Gregor Snelting;On temporal path conditions in dependence graphs.;263-290;28;Volume 16, Number 2, June 2009;
2009;Eva Magnusson,Torbjörn Ekman,Görel Hedin;Demand-driven evaluation of collection attributes.;291-322;32;Volume 16, Number 2, June 2009;
2009;Marius Marin,Arie van Deursen,Leon Moonen,Robin van der Rijst;An integrated crosscutting concern migration strategy and its semi-automated application to JHotDraw.;323-356;34;Volume 16, Number 2, June 2009;
2009;Jason Sawin,Atanas Rountev;Improving static resolution of dynamic class loading in Java using dynamically gathered environment information.;357-381;25;Volume 16, Number 2, June 2009;
2009;Robert J. Hall;A first editorial.;383-385;3;Volume 16, Numbers 3-4, December 2009;
