2002;Nasir Al-Darwish;COPS: cooperative problem solving using DCOM.;79-90;12;Volume 63, Number 2, 15 August 2002;
2002;Weng-Long Chang,Chih-Ping Chu,Jia-Hwa Wu;A simple and general approach to parallelize loops with arbitrary control flow and uniform data dependence distances.;91-98;8;Volume 63, Number 2, 15 August 2002;
2002;Weng-Long Chang,Chih-Ping Chu,Jia-Hwa Wu;A precise dependence analysis for multi-dimensional arrays under specific dependence direction.;99-112;14;Volume 63, Number 2, 15 August 2002;
2002;Yung-Cheng Ma,Tien-Fu Chen,Chung-Ping Chung;Posting file partitioning and parallel information retrieval.;113-127;15;Volume 63, Number 2, 15 August 2002;
2002;André M. Barroso,Julius C. B. Leite,Orlando Loques;Treating uncertainty in distributed scheduling.;129-136;8;Volume 63, Number 2, 15 August 2002;
2002;Chyi-Ren Dow,Jong-Shin Chen,Min-Chang Hsieh;Checkpointing MPI applications on symmetric multi-processor machines using SMPCkpt.;137-150;14;Volume 63, Number 2, 15 August 2002;
2002;Abdel Elah Al-Ayyoub,Khaled Day,Abdullah Al-Dhelaan;On the attractiveness of the star network.;151-158;8;Volume 63, Number 2, 15 August 2002;
2002;Orit Hazzan;The reflective practitioner perspective in software engineering education.;161-171;11;Volume 63, Number 3, 15 September 2002;
2002;Kai-Yuan Cai,Lei Chen;Analyzing software science data with partial repeatability.;173-186;14;Volume 63, Number 3, 15 September 2002;
2002;J. Morris Chang,Witawas Srisa-an,Chia-Tien Dan Lo,Edward F. Gehringer;DMMX: Dynamic memory management extensions.;187-199;13;Volume 63, Number 3, 15 September 2002;
2002;LihChyun Shu,Michal Young;Versioning concurrency control for hard real-time systems.;201-218;18;Volume 63, Number 3, 15 September 2002;
2002;Malik Ayed Tubaishat,Sanjay Kumar Madria,Bharat K. Bhargava;Performance evaluation of linear hash structure model in a nested transaction environment.;219-239;21;Volume 63, Number 3, 15 September 2002;
2002;Ann Q. Gates,Oscar Mondragon;FasTLInC: a constraint-based tracing approach.;241-258;18;Volume 63, Number 3, 15 September 2002;
2002;J. Christopher Westland;The cost of errors in software development: evidence from industry.;1-9;9;Volume 62, Number 1, 1 May 2002;
2002;René Klösch,Paul W. Glaser,Robert J. Truschnegg;A testing approach for large system portfolios in industrial environments.;11-20;10;Volume 62, Number 1, 1 May 2002;
2002;Richard Lai;A survey of communication protocol testing.;21-46;26;Volume 62, Number 1, 1 May 2002;
2002;Ray Giguette,Johnette Hassell;Designing a resourceful fault-tolerance system.;47-57;11;Volume 62, Number 1, 1 May 2002;
2002;Pierre Bourque,Robert Dupuis,Alain Abran,James W. Moore,Leonard L. Tripp,Sybille Wolff;Fundamental principles of software engineering - a journey.;59-70;12;Volume 62, Number 1, 1 May 2002;
2002;Austen Rainer,Tracy Hall;Key success factors for implementing software process improvement: a maturity-based analysis.;71-84;14;Volume 62, Number 2, 15 May 2002;
2002;Nathan Baddoo,Tracy Hall;Motivators of Software Process Improvement: an analysis of practitioners' views.;85-96;12;Volume 62, Number 2, 15 May 2002;
2002;Ting-Chao Hou,Chorng-Horng Yang,Kim-Joan Chen;Optimizing controllability of an interactive videoconferencing system with Web-based control interfaces.;97-109;13;Volume 62, Number 2, 15 May 2002;
2002;Chang Sik Yoo,Poong-Hyun Seong;Experimental analysis of specification language diversity impact on NPP software diversity.;111-122;12;Volume 62, Number 2, 15 May 2002;
2002;Anand R. Tripathi,Neeran M. Karnik,Tanvir Ahmed 0002,Ram D. Singh,Arvind Prakash,Vineet Kakani,Manish K. Vora,Mukta Pathak;Design of the Ajanta system for mobile agent programming.;123-140;18;Volume 62, Number 2, 15 May 2002;
2002;Rodolfo Castelló,Rym Mili,Ioannis G. Tollis;ViSta: a tool suite for the visualization of behavioral requirements.;141-159;19;Volume 62, Number 3, 15 June 2002;
2002;Ho-Hyun Park,Hyung-Ju Cho,Chin-Wan Chung;Heuristic approach for early separated filter and refinement strategy in spatial query optimization.;161-179;19;Volume 62, Number 3, 15 June 2002;
2002;Yin-Fu Huang,Jung-Hau Lin;A placement strategy of multimedia objects in multimedia information systems.;181-193;13;Volume 62, Number 3, 15 June 2002;
2002;Wei-Bin Lee,Tzungher Chen;A public verifiable copy protection technique for still images.;195-204;10;Volume 62, Number 3, 15 June 2002;
2002;Tzong-Sun Wu,Chien-Lung Hsu;Convertible authenticated encryption scheme.;205-209;5;Volume 62, Number 3, 15 June 2002;
2002;Chi-Kwong Chan,Lee-Ming Cheng;Security of Lin's image watermarking system.;211-215;5;Volume 62, Number 3, 15 June 2002;
2002;Kam-yiu Lam,Tei-Wei Kuo,Tony S. H. Lee;Strategies for resolving inter-class data conflicts in mixed real-time database systems.;1-14;14;Volume 61, Number 1, 1 March 2002;
2002;Quazi N. Ahmed,Susan V. Vrbsky;Maintaining security and timeliness in real-time database system.;15-29;15;Volume 61, Number 1, 1 March 2002;
2002;Leigh A. Davis,Rose F. Gamble,Jamie Payton;The impact of component architectures on interoperability.;31-45;15;Volume 61, Number 1, 1 March 2002;
2002;Nico H. Lassing,PerOlof Bengtsson,Hans van Vliet,Jan Bosch;Experiences with ALMA: Architecture-Level Modifiability Analysis.;47-57;11;Volume 61, Number 1, 1 March 2002;
2002;Bonnie Brinton Anderson,Akhilesh Bajaj,Wilpen Gorr;An estimation of the decision models of senior IS managers when evaluating the external quality of organizational software.;59-75;17;Volume 61, Number 1, 1 March 2002;
2002;Yaxin Bi,M. Elizabeth C. Hull,Peter N. Nicholl;An XML approach for legacy code reuse.;77-89;13;Volume 61, Number 2, 15 March 2002;
2002;Sangwon Park,Hyoung-Joo Kim;SigDAQ: an enhanced XML query optimization technique.;91-103;13;Volume 61, Number 2, 15 March 2002;
2002;Jilles van Gurp,Jan Bosch;Design erosion: problems and causes.;105-119;15;Volume 61, Number 2, 15 March 2002;
2002;Kiejin Park,Sungsoo Kim;Availability analysis and improvement of Active/Standby cluster systems using software rejuvenation.;121-128;8;Volume 61, Number 2, 15 March 2002;
2002;Deng-Jyi Chen,Wu-Chi Chen,Krishna M. Kavi;Visual requirement representation.;129-143;15;Volume 61, Number 2, 15 March 2002;
2002;Hong Zhu,Lingzi Jin,Dan Diaper,Ganghong Bai;Software requirements validation via task analysis.;145-169;25;Volume 61, Number 2, 15 March 2002;
2002;Hossein Saiedian;Best practices in software engineering.;171-172;2;Volume 61, Number 3, 1 April 2002;
2002;Marek Leszak,Dewayne E. Perry,Dieter Stoll;Classification and evaluation of defects in a project retrospective.;173-187;15;Volume 61, Number 3, 1 April 2002;
2002;Maurizio Morisio,Carolyn B. Seaman,Victor R. Basili,Amy T. Parra,Steve E. Kraft,Steven E. Condon;COTS-based software development: Processes and open issues.;189-199;11;Volume 61, Number 3, 1 April 2002;
2002;Ivica Crnkovic,Magnus Larsson;Challenges of component-based development.;201-212;12;Volume 61, Number 3, 1 April 2002;
2002;Carol S. Smidts,Xin Huang,James C. Widmaier;Producing reliable software: an experiment.;213-224;12;Volume 61, Number 3, 1 April 2002;
2002;Rayford B. Vaughn,Ronda R. Henning,Kevin L. Fox;An empirical study of industrial security-engineering practices.;225-232;8;Volume 61, Number 3, 1 April 2002;
2002;David L. Andrews,Paul Austin,Peter Costello,David LeVan;Interprocess communications in the AN/BSY-2 distributed computer system: a case study.;233-242;10;Volume 61, Number 3, 1 April 2002;
2002;Robert L. Glass;A Final Good-bye.;1-;1;Volume 60, Number 1, January 2002;
2002;David N. Card;Stepping up to the Plate.;3-;1;Volume 60, Number 1, January 2002;
2002;J. Miller;On the independence of software inspectors.;5-10;6;Volume 60, Number 1, January 2002;
2002;Andrew Lim,Wee-Chong Oon,Chi-Hung Chi;A matching-based algorithm for page access sequencing in join processing.;11-19;9;Volume 60, Number 1, January 2002;
2002;H. Richard Kendall,Vincent W. Freeh,Paul W. Schermerhorn,Robert J. Minerick,Peter W. Rijks;Streaming extensibility in the Modify-on-Access file system.;21-36;16;Volume 60, Number 1, January 2002;
2002;Dong Ho Kim,Keun Ho Ryu,Chee Hang Park;Design and implementation of spatiotemporal database query processing system.;37-49;13;Volume 60, Number 1, January 2002;
2002;Manuel J. Fernández Iglesias,Francisco J. González-Castaño,Martín Llamas Nistal,José M. Pousada Carballo,Javier Vales-Alonso;On the application of formal description techniques to the design of interception systems for GSM mobile terminals.;51-58;8;Volume 60, Number 1, January 2002;
2002;Marsha Chechik,Andre Wong;Formal modeling in a commercial setting: A case study.;59-82;24;Volume 60, Number 1, January 2002;
2002;Daniel M. Berry;The importance of ignorance in requirements engineering: An earlier sighting and a revisitation.;83-85;3;Volume 60, Number 1, January 2002;
2002;Kamel Barkaoui,Mohamed Jmaiel,Ali Mili;Guest editorial.;87-89;3;Volume 60, Number 2, February 2002;
2002;Peter Pepper,Michael Cebulla,Klaus Didrich,Wolfgang Grieskamp;From program languages to software languages.;91-101;11;Volume 60, Number 2, February 2002;
2002;Richard St.-Denis;Designing reactive systems: integration of abstraction techniques into a synthesis procedure.;103-112;10;Volume 60, Number 2, February 2002;
2002;Etienne Roblet,Khalil Drira,Michel Diaz;Formal design and development of a Corba-based application for cooperative HTML group editing support.;113-127;15;Volume 60, Number 2, February 2002;
2002;Dimitri Tabary,Mourad Abed;A software environment task object-oriented design (ETOOD).;129-140;12;Volume 60, Number 2, February 2002;
2002;Mohamed Jarraya,Didier El Baz;Implementation of distributed iterative algorithm for optimal control problems on several parallel architectures.;141-148;8;Volume 60, Number 2, February 2002;
2002;Ali Jaoua,Samir Elloumi;Galois connection, formal concepts and Galois lattice in real relations: application in a real classifier.;149-163;15;Volume 60, Number 2, February 2002;
2002;Guy G. Helmer,Johnny S. Wong,Vasant Honavar,Les Miller;Automated discovery of concise predictive rules for intrusion detection.;165-175;11;Volume 60, Number 3, February 2002;
2002;Shundong Xia,Jinyuan You;A group signature scheme with strong separability.;177-182;6;Volume 60, Number 3, February 2002;
2002;Choon Seong Leem,Cho-Li Wang;Special section on Industrial information systems: progresses and perspectives in Pacific Rim.;183-;1;Volume 60, Number 3, February 2002;
2002;Hongfei Yan,Jianyong Wang,Xiaoming Li,Lin Guo;Architectural design and evaluation of an efficient Web-crawling system.;185-193;9;Volume 60, Number 3, February 2002;
2002;Kitae Shin,Choon Seong Leem;A reference system for internet based inter-enterprise electronic commerce.;195-209;15;Volume 60, Number 3, February 2002;
2002;Tianhan Wang,Sheng Uei Guan,Tai Khoon Chan;Integrity protection for Code-on-Demand mobile agents in e-commerce.;211-221;11;Volume 60, Number 3, February 2002;
2002;Bongju Jeong,Hosang Jung,Nam-Kyu Park;A computerized causal forecasting system using genetic algorithms in supply chain management.;223-237;15;Volume 60, Number 3, February 2002;
2002;Stephen Chi-fai Chan,Tharam S. Dillon,Andrew Siu;Applying a mediator architecture employing XML to retailing inventory control.;239-248;10;Volume 60, Number 3, February 2002;
2002;Choon Seong Leem,Sangkyun Kim;Introduction to an integrated methodology for development and implementation of enterprise information systems.;249-261;13;Volume 60, Number 3, February 2002;
2001;Elaine J. Weyuker;Transitioning from Academia to Industrial Research.;1-2;2;Volume 59, Number 1, October 2001;
2001;Lionel C. Briand,Jürgen Wüst;Integrating scenario-based and measurement-based software product assessment.;3-22;20;Volume 59, Number 1, October 2001;
2001;Khaled El Emam,Ho-Won Jung;An empirical evaluation of the ISO/IEC 15504 assessment model.;23-41;19;Volume 59, Number 1, October 2001;
2001;Ho-Won Jung,Robin Hunter;The relationship between ISO/IEC 15504 process capability levels, ISO 9001 certification and organization size: An empirical study.;43-55;13;Volume 59, Number 1, October 2001;
2001;Girish H. Subramanian,William Corbin;An empirical study of certain object-oriented software metrics.;57-63;7;Volume 59, Number 1, October 2001;
2001;Witold Pedrycz,Giancarlo Succi,Petr Musílek,Xiao Bai 0003;Using self-organizing maps to analyze object-oriented software measures.;65-82;18;Volume 59, Number 1, October 2001;
2001;Gursaran;Viewpoint representation validation: a case study on two metrics from the Chidamber and Kemerer suite.;83-97;15;Volume 59, Number 1, October 2001;
2001;June M. Verner,William M. Evanco,Katherine W. McCain,Gregory W. Hislop,Vera J. Cole;The determinants of visibility of software engineering researchers.;99-106;8;Volume 59, Number 1, October 2001;
2001;Robert L. Glass,Tsong Yueh Chen;An assessment of Systems and Software Engineering scholars and institutions (1996-2000).;107-113;7;Volume 59, Number 1, October 2001;
2001;Eleanor Wynn;Some informal thoughts about reviewing as a social process.;115-117;3;Volume 59, Number 2, November 2001;
2001;Byong G. Lee,N. Hari Narayanan,Kai-Hsiung Chang;An integrated approach to distributed version management and role-based access control in computer supported collaborative writing.;119-134;16;Volume 59, Number 2, November 2001;
2001;David N. Wilson,Tracy Hall,Nathan Baddoo;A framework for evaluation and prediction of software process improvement success.;135-142;8;Volume 59, Number 2, November 2001;
2001;Hsung-Pin Chang,Ray-I Chang,Wei-Kuan Shih,Ruei-Chuan Chang;Reschedulable-Group-SCAN scheme for mixed real-time/non-real-time disk scheduling in a multimedia system.;143-152;10;Volume 59, Number 2, November 2001;
2001;Sadahiro Isoda;Object-oriented real-world modeling revisited.;153-162;10;Volume 59, Number 2, November 2001;
2001;Steven D. Sheetz,David P. Tegarden;Illustrating the cognitive consequences of object-oriented systems development.;163-179;17;Volume 59, Number 2, November 2001;
2001;Giuliano Antoniol,Gerardo Casazza,Massimiliano Di Penta,Roberto Fiutem;Object-oriented design patterns recovery.;181-196;16;Volume 59, Number 2, November 2001;
2001;Alessandro F. Garcia,Cecília M. F. Rubira,Alexander B. Romanovsky,Jie Xu;A comparative study of exception handling mechanisms for building dependable object-oriented software.;197-222;26;Volume 59, Number 2, November 2001;
2001;David Raffo,Paul Wernick;Software Process Simulation Modelling.;223-225;3;Volume 59, Number 3, December 2001;
2001;Paolo Donzelli,Giuseppe Iazeolla;Hybrid simulation modelling of the software process.;227-235;9;Volume 59, Number 3, December 2001;
2001;Robert H. Martin,David Raffo;Application of a hybrid process simulation model to a software development project.;237-246;10;Volume 59, Number 3, December 2001;
2001;Dan X. Houston,Gerald T. Mackulak,James S. Collofello;Stochastic simulation of risk factor potential effects for software development risk management.;247-257;11;Volume 59, Number 3, December 2001;
2001;Dan X. Houston,Susan Ferreira,James S. Collofello,Douglas C. Montgomery,Gerald T. Mackulak,Dan L. Shunk;Behavioral characterization: finding and using the influential factors in software process simulation models.;259-270;12;Volume 59, Number 3, December 2001;
2001;Goel Kahen,Meir M. Lehman,Juan F. Ramil,Paul Wernick;System dynamics modelling of software evolution processes for policy investigation: Approach and example.;271-281;11;Volume 59, Number 3, December 2001;
2001;Dietmar Pfahl,Marco Klemm,Günther Ruhe;A CBT module with integrated simulation component for software project management education and training.;283-298;16;Volume 59, Number 3, December 2001;
2001;Mercedes Ruiz,Isabel Ramos,Miguel Toro;A simplified model of software project dynamics.;299-309;11;Volume 59, Number 3, December 2001;
2001;Friedrich Stallinger,Paul Grünbacher;System dynamics modelling and simulation of collaborative requirements engineering.;311-321;11;Volume 59, Number 3, December 2001;
2001;Martin Höst,Björn Regnell,Johan Natt och Dag,Josef Nedstam,Christian Nyberg;Exploring bottlenecks in market-driven requirements management processes with discrete event simulation.;323-332;10;Volume 59, Number 3, December 2001;
2001;Volker Gruhn,Ursula Wellen;Analysing a process landscape by simulation.;333-342;10;Volume 59, Number 3, December 2001;
2001;S. James Choi,Walt Scacchi;Modeling and simulating software acquisition process architectures.;343-354;12;Volume 59, Number 3, December 2001;
2001;Peter Henderson,Yvonne Margaret Howard,Robert John Walters;A tool for evaluation of the software development process.;355-362;8;Volume 59, Number 3, December 2001;
2001;Noritaka Kobayashi,Tatsuhiro Tsuchiya,Tohru Kikuno;Minimizing the mean delay of quorum-based mutual exclusion schemes.;1-9;9;Volume 58, Number 1, August 2001;
2001;Hwakyung Rim,Ju-wook Jang,Sun-Chun Kim;Hiding communication overheads in dynamic load balancing for multicomputers.;11-22;12;Volume 58, Number 1, August 2001;
2001;Ching-Wen Chen,Chung-Ping Chung;Fault-tolerant gamma interconnection network without backtracking.;23-31;9;Volume 58, Number 1, August 2001;
2001;Mohammed Zaki,Hany Harb,Tarek S. Sobh;A learning database system to observe malfunctions and to support network planning.;33-46;14;Volume 58, Number 1, August 2001;
2001;Kai-Yuan Cai,Lin Cai 0002,Wei-Dong Wang,Zhou-Yi Yu,David Zhang;On the neural network approach in software reliability modeling.;47-62;16;Volume 58, Number 1, August 2001;
2001;;Editor's Corner.;63-;1;Volume 58, Number 1, August 2001;
2001;Tsong Yueh Chen,T. H. Tse,Yuen-Tak Yu;Proportional sampling strategy: a compendium and some insights.;65-81;17;Volume 58, Number 1, August 2001;
2001;Chin-Chen Chang,Min-Shiang Hwang,Tung-Shou Chen;A new encryption algorithm for image cryptosystems.;83-91;9;Volume 58, Number 2, September 2001;
2001;Shin-Young Lim,Jeong-Ho Ko,Eun-Ah Jun,Gang-Soo Lee;Specification and analysis of n-way key recovery system by Extended Cryptographic Timed Petri Net.;93-106;14;Volume 58, Number 2, September 2001;
2001;Andy Dowling,John G. Keating;A proxy-based security architecture for Internet applications in an extranet environment.;107-118;12;Volume 58, Number 2, September 2001;
2001;Chien-Lung Hsu,Tzong-Sun Wu,Tzong-Chen Wu;New nonrepudiable threshold proxy signature scheme with known signers.;119-124;6;Volume 58, Number 2, September 2001;
2001;Yung-Cheng Ma,Chung-Ping Chung;A dominance relation enhanced branch-and-bound task allocation.;125-134;10;Volume 58, Number 2, September 2001;
2001;Der-Lin Pean,Chao-Chin Wu,Huey-Ting Chua,Cheng Chen;Design of a scalable multiprocessor architecture and its simulation.;135-152;18;Volume 58, Number 2, September 2001;
2001;Sumit Ghosh;Understanding complex, real-world systems through asynchronous, distributed decision-making algorithms.;153-167;15;Volume 58, Number 2, September 2001;
2001;;Controversy Corner.;169-;1;Volume 58, Number 2, September 2001;
2001;Bashar Nuseibeh,Steve M. Easterbrook,Alessandra Russo;Making inconsistency respectable in software development.;171-180;10;Volume 58, Number 2, September 2001;
2001;Jyrki Akkanen,Jukka K. Nurminen;Case study of the evolution of routing algorithms in a network planning tool.;181-198;18;Volume 58, Number 3, September 2001;
2001;Li Wang 0004,Wanlei Zhou,Weijia Jia;The design and implementation of an active replication scheme for distributing services in a cluster of workstations.;199-210;12;Volume 58, Number 3, September 2001;
2001;Jin Hyun Son,Myoung-Ho Kim;Improving the performance of time-constrained workflow processing.;211-219;9;Volume 58, Number 3, September 2001;
2001;Yin-Fu Huang,Bo-Wei Chao;A priority-based resource allocation strategy in distributed computing networks.;221-233;13;Volume 58, Number 3, September 2001;
2001;Chia-Tien Dan Lo,Witawas Srisa-an,J. Morris Chang;A study of page replacement performance in garbage collection heap.;235-245;11;Volume 58, Number 3, September 2001;
2001;Taehyoun Kim,Naehyuck Chang,Heonshik Shin;Joint scheduling of garbage collector and hard real-time tasks for embedded applications.;247-260;14;Volume 58, Number 3, September 2001;
2001;Brian Huston;The effects of design pattern application on metric scores.;261-269;9;Volume 58, Number 3, September 2001;
2001;Eric Jui-Lin Lu,Ru-Hui Tsai,Shihyu Chou;An empirical study of XML/EDI.;271-279;9;Volume 58, Number 3, September 2001;
2001;David E. Drehmer,Sasa M. Dekleva;A note on the evolution of software engineering practices.;1-7;7;Volume 57, Number 1, April 2001;
2001;Peter Middleton,Barry McCollum;Management of process improvement by prescription.;9-19;11;Volume 57, Number 1, April 2001;
2001;Andreas Zendler,Till Pfeiffer,Michael Eicks,Franz Lehner;Experimental comparison of coarse-grained concepts in UML, OML, and TOS.;21-30;10;Volume 57, Number 1, April 2001;
2001;Daniel Häggander,Lars Lundberg;A simple process for migrating server applications to SMP: s.;31-43;13;Volume 57, Number 1, April 2001;
2001;Robert G. Fichman,Chris F. Kemerer;Incentive compatibility and systematic software reuse.;45-60;16;Volume 57, Number 1, April 2001;
2001;Gyeung-min J. Kim,Rohae Myung,Ali F. Emdad;A simulation study on coordination strategies: decision cycle-time perspective.;61-72;12;Volume 57, Number 1, April 2001;
2001;Xuemei Zhang,Mi-Young Shin,Hoang Pham;Exploratory analysis of environmental factors for enhancing the software reliability assessment.;73-78;6;Volume 57, Number 1, April 2001;
2001;Nashat Mansour,Rami Bahsoon,Ghinwa Baradhi;Empirical comparison of regression test selection algorithms.;79-90;12;Volume 57, Number 1, April 2001;
2001;Anol Bhattacherjee,Kurt DeShazer,James H. Gerlach,Bill Rierden;A hybrid approach to OO development: the SUMMITrak project at TCI.;91-98;8;Volume 57, Number 2, June 2001;
2001;William B. Frakes,Giancarlo Succi;An industrial study of reuse, quality, and productivity.;99-106;8;Volume 57, Number 2, June 2001;
2001;J. Morris Chang,Woo Hyong Lee,Witawas Srisa-an;A study of the allocation behavior of C++ programs.;107-118;12;Volume 57, Number 2, June 2001;
2001;Andreas L. Opdahl,Brian Henderson-Sellers;Grounding the OML metamodel in ontology.;119-143;25;Volume 57, Number 2, June 2001;
2001;Tsung-Chuan Huang,Cheng-Ming Yang;Non-linear array data dependence test.;145-154;10;Volume 57, Number 2, June 2001;
2001;Martin Naedele;An approach to modeling and evaluation of functional and timing specifications of real-time systems.;155-174;20;Volume 57, Number 2, June 2001;
2001;Ricardo Chalmeta,Cristina Campos,Reyes Grangel;References architectures for enterprise integration.;175-191;17;Volume 57, Number 3, July 2001;
2001;Allen S. Parrish,Brandon Dixon,David Cordes;A conceptual foundation for component-based software deployment.;193-200;8;Volume 57, Number 3, July 2001;
2001;Marcus Fontoura,Carlos José Pereira de Lucena,Alexandre A. Andreatta,Sérgio E. Carvalho,Celso C. Ribeiro;Using UML-F to enhance framework development: a case study in the local search heuristics domain.;201-206;6;Volume 57, Number 3, July 2001;
2001;Jeff Tian,Anthony Nguyen,Curt Allen,Ravi Appan;Experience with identifying and characterizing problem-prone modules in telecommunication software systems.;207-215;9;Volume 57, Number 3, July 2001;
2001;Benny Hall,George Orr,Thomas E. Reeves;A technique for function block counting.;217-220;4;Volume 57, Number 3, July 2001;
2001;Suleiman H. Mustafa,Fawaz Ahmed Masoud;How good is the critical factor concept in estimating the average number of character comparisons per item in string sorting?;221-226;6;Volume 57, Number 3, July 2001;
2001;Hai Zhuge,Xiaoqing Shi;Communication cost of cognitive co-operation for distributed team development.;227-233;7;Volume 57, Number 3, July 2001;
2001;Eric Jui-Lin Lu,Rong-Ji Hwang;A distributed EDI model.;1-7;7;Volume 56, Number 1, February 2001;
2001;Johnny Wong,Guy G. Helmer,Venkatraman Naganathan,Sriniwas Polavarapu,Vasant Honavar,Les Miller;SMART mobile agent facility.;9-22;14;Volume 56, Number 1, February 2001;
2001;Jorng-Tzong Horng,Chi-Wei Chen;A mechanism for view consistency in a data warehousing system.;23-37;15;Volume 56, Number 1, February 2001;
2001;Gail-Joon Ahn,Ravi S. Sandhu;Decentralized user group assignment in Windows NT.;39-49;11;Volume 56, Number 1, February 2001;
2001;Edward Chan,Daoxu Chen,Victor C. S. Lee;Effectiveness of the FDDI-M protocol in supporting synchronous traffic.;51-62;12;Volume 56, Number 1, February 2001;
2001;Khaled El Emam,Walcélio L. Melo,Javam C. Machado;The prediction of faulty classes using object-oriented design metrics.;63-75;13;Volume 56, Number 1, February 2001;
2001;Joseph P. Hoffbeck,S. Mansoor Sarwar,Eric J. Rix;Interfacing MATLAB with a parallel virtual processor for matrix algorithms.;77-80;4;Volume 56, Number 1, February 2001;
2001;Paolo Donzelli,Giuseppe Iazeolla;A dynamic simulator of software processes to test process assumptions.;81-90;10;Volume 56, Number 1, February 2001;
2001;Diomidis Spinellis;Notable design patterns for domain-specific languages.;91-99;9;Volume 56, Number 1, February 2001;
2001;Avi Shama;Dot-coms' coma.;101-104;4;Volume 56, Number 1, February 2001;
2001;Hanns-Helmuth Deubler;Employing multiple views to separate large-scale software systems.;105-113;9;Volume 56, Number 2, March 2001;
2001;Woojong Suh,Heeseok Lee;A methodology for building content-oriented hypermedia systems.;115-131;17;Volume 56, Number 2, March 2001;
2001;Chung-Ming Huang,Hsu-Yang Kung,Jiong-Liang Yang;Synchronization and flow adaptation schemes for reliable multiple-stream transmission in multimedia presentations.;133-151;19;Volume 56, Number 2, March 2001;
2001;Der-Chyuan Lou,Te-Lung Yin;Spatial database with each picture self-contained multiscape and access control in a hierarchy.;153-163;11;Volume 56, Number 2, March 2001;
