2008;Qingtian Zeng,Huaiqing Wang,Dongming Xu,Hua Duan,Yanbo Han;Conflict detection and resolution for workflows constrained by resources and non-determined durations.;1491-1504;14;Volume 81, Number 9, September 2008;
2008;Ming-Ni Wu,Chia-Chen Lin,Chin-Chen Chang;An embedding technique based upon block prediction.;1505-1516;12;Volume 81, Number 9, September 2008;
2008;Ying-Dar Lin,Szu-Hao Chen,Po-Ching Lin,Yuan-Cheng Lai;Designing and evaluating interleaving decompressing and virus scanning in a stream-based mail proxy.;1517-1524;8;Volume 81, Number 9, September 2008;
2008;Deok-Hwan Kim,Seung-Hoon Yu;A new region filtering and region weighting approach to relevance feedback in content-based image retrieval.;1525-1538;14;Volume 81, Number 9, September 2008;
2008;Jake Cobb,Hala ElAarag;Web proxy cache replacement scheme based on back-propagation neural network.;1539-1558;20;Volume 81, Number 9, September 2008;
2008;Mario Döller,Harald Kosch;The MPEG-7 Multimedia Database System (MPEG-7 MMDB).;1559-1580;22;Volume 81, Number 9, September 2008;
2008;Tzungher Chen,Wei-Bin Lee,Hsing-Bai Chen;A round- and computation-efficient three-party authenticated key exchange protocol.;1581-1590;10;Volume 81, Number 9, September 2008;
2008;Xiaoying Wang,Zhihui Du,Yinong Chen,Sanli Li;Virtualization-based autonomic resource management for multi-tier Web applications in shared data center.;1591-1608;18;Volume 81, Number 9, September 2008;
2008;Eric T. G. Wang,Sheng-Pao Shih,James J. Jiang,Gary Klein 0001;The consistency among facilitating factors and ERP implementation success: A holistic view of fit.;1609-1621;13;Volume 81, Number 9, September 2008;
2008;Aditya P. Mathur,Johnny Wong;Message from the guest editors.;1623-1624;2;Volume 81, Number 10, October 2008;
2008;Yaw-Chung Chen,Wen-Yen Chen;An agent-based metric for quality of services over wireless networks.;1625-1639;15;Volume 81, Number 10, October 2008;
2008;Yi Deng,Seyed Masoud Sadjadi,Peter J. Clarke,Vagelis Hristidis,Raju Rangaswami,Yingbo Wang;CVM - A communication virtual machine.;1640-1662;23;Volume 81, Number 10, October 2008;
2008;Stephen S. Yau,Haishan Gong,Dazhi Huang,Wei Gao,Luping Zhu;Specification, decomposition and agent synthesis for situation-aware service-based systems.;1663-1680;18;Volume 81, Number 10, October 2008;
2008;Jun Yan,Jian Zhang 0001;A backtracking search tool for constructing combinatorial test suites.;1681-1693;13;Volume 81, Number 10, October 2008;
2008;Michela Montesi,Patricia Lago;Software engineering article types: An analysis of the literature.;1694-1714;21;Volume 81, Number 10, October 2008;
2008;Andreas Ekelhart,Stefan Fenz,Gernot Goluch,Markus Steinkellner,Edgar R. Weippl;XML security - A comparative literature review.;1715-1724;10;Volume 81, Number 10, October 2008;
2008;Konstantinos G. Kouskouras,Alexander Chatzigeorgiou,George Stephanides;Facilitating software extension with design patterns and Aspect-Oriented Programming.;1725-1737;13;Volume 81, Number 10, October 2008;
2008;Olga Ormandjieva,Vangalur S. Alagar,Mao Zheng;Early quality monitoring in the development of real-time reactive systems.;1738-1753;16;Volume 81, Number 10, October 2008;
2008;Gerardo Canfora,Massimiliano Di Penta,Raffaele Esposito,Maria Luisa Villani;A framework for QoS-aware binding and re-binding of composite web services.;1754-1769;16;Volume 81, Number 10, October 2008;
2008;Hwai-Jung Hsu,Feng-Jian Wang;An incremental analysis for resource conflicts to workflow specifications.;1770-1783;14;Volume 81, Number 10, October 2008;
2008;Samuel A. Ajila,Ali B. Kaba;Evolution support mechanisms for software product line process.;1784-1801;18;Volume 81, Number 10, October 2008;
2008;Cengiz Togay,Ali H. Dogru,John Urcun Tanik;Systematic Component-Oriented development with Axiomatic Design.;1803-1815;13;Volume 81, Number 11, November 2008;
2008;Samuil Angelov,Paul W. P. J. Grefen;An e-contracting reference architecture.;1816-1844;29;Volume 81, Number 11, November 2008;
2008;Ahmed Seffah,Mohamed Taleb,Halima Habieb-Mammar,Alain Abran;Reconciling usability and interactive system architecture using patterns.;1845-1852;8;Volume 81, Number 11, November 2008;
2008;K. Vinay Kumar,Vadlamani Ravi,Mahil Carr,N. Raj Kiran;Software development cost estimation using wavelet neural networks.;1853-1867;15;Volume 81, Number 11, November 2008;
2008;Raed Shatnawi,Wei Li 0014;The effectiveness of software metrics in identifying error-prone classes in post-release software evolution process.;1868-1882;15;Volume 81, Number 11, November 2008;
2008;Anastasis A. Sofokleous,Andreas S. Andreou;Automatic, evolutionary test data generation for dynamic software testing.;1883-1898;16;Volume 81, Number 11, November 2008;
2008;Asif Qumer,Brian Henderson-Sellers;A framework to support the evaluation, adoption and improvement of agile methods in practice.;1899-1919;21;Volume 81, Number 11, November 2008;
2008;Lorin Hochstein,Victor R. Basili,Uzi Vishkin,John Gilbert;A pilot study to compare programming effort for two parallel programming models.;1920-1930;11;Volume 81, Number 11, November 2008;
2008;Seo-Young Noh,Shashi K. Gadia;Benchmarking temporal database models with interval-based and temporal element-based timestamping.;1931-1943;13;Volume 81, Number 11, November 2008;
2008;Javier Aroba Páez,Juan Jose Cuadrado-Gallego,Miguel-Ángel Sicilia,Isabel Ramos,Elena García Barriocanal;Segmented software cost estimation models based on fuzzy clustering.;1944-1950;7;Volume 81, Number 11, November 2008;
2008;Xiaoming Hu,Shangteng Huang;Analysis of ID-based restrictive partially blind signatures and applications.;1951-1954;4;Volume 81, Number 11, November 2008;
2008;Cristiano Tolfo,Raul Sidnei Wazlawick;The influence of organizational culture on the adoption of extreme programming.;1955-1967;13;Volume 81, Number 11, November 2008;
2008;Lars-Ola Damm,Lars Lundberg,Claes Wohlin;A model for software rework reduction through a combination of anomaly metrics.;1968-1982;15;Volume 81, Number 11, November 2008;
2008;Michel dos Santos Soares,Stéphane Julia,Jos L. M. Vrancken;Real-time scheduling of batch systems using Petri nets and linear logic.;1983-1996;14;Volume 81, Number 11, November 2008;
2008;Wayne O'Brien;Avoiding semantic and temporal gaps in developing software intensive systems.;1997-2013;17;Volume 81, Number 11, November 2008;
2008;Xingwei Wang,Lei Guo 0005,Fei Yang,Tengfei Wu,Wei Ji;Multi-layer survivable routing mechanism in GMPLS based optical networks.;2014-2023;10;Volume 81, Number 11, November 2008;
2008;Zakarya A. Alzamil;Application of redundant computation in program debugging.;2024-2033;10;Volume 81, Number 11, November 2008;
2008;Sudipto Ghosh,John L. Kelly;Bytecode fault injection for Java software.;2034-2043;10;Volume 81, Number 11, November 2008;
2008;Mei-Ling Chiang,Yu-Chen Lin,Lian-Feng Guo;Design and implementation of an efficient web cluster with content-based request distribution and file caching.;2044-2058;15;Volume 81, Number 11, November 2008;
2008;Hitoshi Oi;Local variable access behavior of a hardware-translation based Java virtual machine.;2059-2068;10;Volume 81, Number 11, November 2008;
2008;Atanas Radenski,Jeff Furlong,Vladimir Zanev;The Java 5 generics compromise orthogonality to keep compatibility.;2069-2078;10;Volume 81, Number 11, November 2008;
2008;Jong Myoung Ko,Chang Ouk Kim,Ick-Hyun Kwon;Quality-of-service oriented web service composition algorithm and planning architecture.;2079-2090;12;Volume 81, Number 11, November 2008;
2008;Jun-Hong Shen,Ye-In Chang;An efficient nonuniform index in the wireless broadcast environments.;2091-2103;13;Volume 81, Number 11, November 2008;
2008;John C. Grundy,Jun Han;Introduction to the Special Issue.;2105;1;Volume 81, Number 12, December 2008;
2008;Kjetil Moløkken-Østvold,Nils Christian Haugen,Hans Christian Benestad;Using planning poker for combining expert estimates in software projects.;2106-2117;12;Volume 81, Number 12, December 2008;
2008;Paul L. Bannerman;Risk and risk management in software projects: A reassessment.;2118-2133;16;Volume 81, Number 12, December 2008;
2008;Yan Liu,Ian Gorton,Vinh Kah Lee;The architecture of an event correlation service for adaptive middleware-based applications.;2134-2145;12;Volume 81, Number 12, December 2008;
2008;Tsong Yueh Chen,Fei-Ching Kuo,Huai Liu;Distributing test cases more evenly in adaptive random testing.;2146-2162;17;Volume 81, Number 12, December 2008;
2008;Robert Colvin,Lars Grunske,Kirsten Winter;Timed Behavior Trees for Failure Mode and Effects Analysis of time-critical systems.;2163-2182;20;Volume 81, Number 12, December 2008;
2008;Jens Dietrich,Nathan Jones,Jevon M. Wright;Using social networking and semantic web technology in software engineering - Use cases, patterns, and a case study.;2183-2193;11;Volume 81, Number 12, December 2008;
2008;Ali Mesbah 0001,Arie van Deursen;A component- and push-based architectural style for ajax applications.;2194-2209;16;Volume 81, Number 12, December 2008;
2008;Marco Autili,Leonardo Mostarda,Alfredo Navarra,Massimo Tivoli;Synthesis of decentralized and concurrent adaptors for correctly assembling distributed component-based systems.;2210-2236;27;Volume 81, Number 12, December 2008;
2008;Patrizio Pelliccione,Massimo Tivoli,Antonio Bucchiarone,Andrea Polini;An architectural approach to the correct and automatic assembly of evolving component-based systems.;2237-2251;15;Volume 81, Number 12, December 2008;
2008;Bas Cornelissen,Andy Zaidman,Danny Holten,Leon Moonen,Arie van Deursen,Jarke J. van Wijk;Execution trace analysis through massive sequence and circular bundle views.;2252-2268;17;Volume 81, Number 12, December 2008;
2008;Peter J. Clarke,Djuradj Babich,Tariq M. King,B. M. Golam Kibria;Analyzing clusters of class characteristics in OO applications.;2269-2286;18;Volume 81, Number 12, December 2008;
2008;David Binkley,Nicolas Gold,Mark Harman,Zheng Li,Kiarash Mahdavi;An empirical study of the relationship between the concepts expressed in source code and dependence.;2287-2298;12;Volume 81, Number 12, December 2008;
2008;Harith T. Al-Jumaily,Dolores Cuadra,Paloma Martínez;OCL2Trigger: Deriving active mechanisms for relational databases using Model-Driven Architecture.;2299-2314;16;Volume 81, Number 12, December 2008;
2008;Olga Brukman,Shlomi Dolev,Elliot K. Kolodner;A self-stabilizing autonomic recoverer for eventual Byzantine software.;2315-2327;13;Volume 81, Number 12, December 2008;
2008;Changhoon Lee,Jongsung Kim,Seokhie Hong,Jaechul Sung,Sangjin Lee;Security analysis of the full-round DDO-64 block cipher.;2328-2335;8;Volume 81, Number 12, December 2008;
2008;Mariacarla Calzarossa,Daniele Tessera;Characterization of the evolution of a news Web site.;2336-2344;9;Volume 81, Number 12, December 2008;
2008;Dan Chen,Roland Ewald,Georgios K. Theodoropoulos,Rob Minson,Ton Oguara,Michael Lees,Brian S. Logan,Adelinde M. Uhrmacher;Data access in distributed simulations of multi-agent systems.;2345-2360;16;Volume 81, Number 12, December 2008;
2008;Qinbao Song,Martin J. Shepperd,Xiangru Chen,Jun Liu;Can k-NN imputation improve the performance of C4.5 with small software project data sets? A comparative evaluation.;2361-2370;10;Volume 81, Number 12, December 2008;
2008;Yolanda Blanco-Fernández,José Juan Pazos-Arias,Alberto Gil-Solla,Manuel Ramos Cabrer,Martín López Nores,Jorge García Duque,Ana Fernández Vilas,Rebeca P. Díaz Redondo;Exploiting synergies between semantic reasoning and personalization strategies in intelligent recommender systems: A case study.;2371-2385;15;Volume 81, Number 12, December 2008;
2008;Tom McBride;The mechanisms of project management of software development.;2386-2395;10;Volume 81, Number 12, December 2008;
2008;Panagiotis Papadimitriou,Vassilis Tsaoussidis,Lefteris Mamatas;A receiver-centric rate control scheme for layered video streams in the Internet.;2396-2412;17;Volume 81, Number 12, December 2008;
2008;Philippe Kruchten;What do software architects really do?;2413-2416;4;Volume 81, Number 12, December 2008;
2007;Yi Peng,Fu Li,Ali Mili;Modeling the evolution of operating systems: An empirical study.;1-15;15;Volume 80, Number 1, January 2007;
2007;Hélio R. Costa,Márcio de Oliveira Barros,Guilherme Horta Travassos;Evaluating software project portfolio risks.;16-31;16;Volume 80, Number 1, January 2007;
2007;Susan Kurian,Michael J. Pont;The maintenance and evolution of resource-constrained embedded systems created using design patterns.;32-41;10;Volume 80, Number 1, January 2007;
2007;Wen-Ming Han,Sun-Jen Huang;An empirical analysis of risk components and performance on software projects.;42-50;9;Volume 80, Number 1, January 2007;
2007;Qinbao Song,Martin J. Shepperd;A new imputation method for small software project data sets.;51-62;12;Volume 80, Number 1, January 2007;
2007;Akif Günes Koru,Hongfang Liu;Identifying and characterizing change-prone classes in two large-scale open-source products.;63-73;11;Volume 80, Number 1, January 2007;
2007;Samuel Ajila,Razvan T. Dumitrescu;Experimental use of code delta, code churn, and rate of change to understand software product line evolution.;74-91;18;Volume 80, Number 1, January 2007;
2007;Jingling Xue,Phung Hua Nguyen,John Potter;Interprocedural side-effect analysis for incomplete object-oriented software modules.;92-105;14;Volume 80, Number 1, January 2007;
2007;Christine Hofmeister,Philippe Kruchten,Robert L. Nord,J. Henk Obbink,Alexander Ran,Pierre America;A general model of software architecture design derived from five industrial approaches.;106-126;21;Volume 80, Number 1, January 2007;
2007;Antony Tang,Ann E. Nicholson,Yan Jin,Jun Han;Using Bayesian belief networks for change impact analysis in architecture design.;127-148;22;Volume 80, Number 1, January 2007;
2007;Jenn-Wei Lin;Providing fault-tolerant authentication and authorization in wireless mobile IP networks.;149-163;15;Volume 80, Number 2, February 2007;
2007;Xiaofeng Chen 0001,Fangguo Zhang,Shengli Liu;ID-based restrictive partially blind signatures and applications.;164-171;8;Volume 80, Number 2, February 2007;
2007;Jun Shao,Zhenfu Cao,Rongxing Lu;Improvement of Yang et al.'s threshold proxy signature scheme.;172-177;6;Volume 80, Number 2, February 2007;
2007;Miguel Correia,Nuno Ferreira Neves,Lau Cheuk Lung,Paulo Veríssimo;Worm-IT - A wormhole-based intrusion-tolerant group communication system.;178-197;20;Volume 80, Number 2, February 2007;
2007;Hsung-Pin Chang,Ray-I Chang,Wei-Kuan Shih,Ruei-Chuan Chang;GSR: A global seek-optimizing real-time disk-scheduling algorithm.;198-215;18;Volume 80, Number 2, February 2007;
2007;Alfredo De Santis,Barbara Masucci;New results on non-perfect sharing of multiple secrets.;216-223;8;Volume 80, Number 2, February 2007;
2007;Richard Lai,Tony Tsang;Timed verification of the reliable adaptive multicast protocol.;224-239;16;Volume 80, Number 2, February 2007;
2007;Marwan Abi-Antoun,Jonathan Aldrich,Wesley Coelho;A case study in re-engineering to enforce architectural control flow and data sharing.;240-264;25;Volume 80, Number 2, February 2007;
2007;Liming Zhu,Ngoc Bao Bui,Yan Liu,Ian Gorton;MDABench: Customized benchmark generation using MDA.;265-282;18;Volume 80, Number 2, February 2007;
2007;Karl Cox,Steven J. Bleistein,June M. Verner,Alan M. Davis;REBNITA'05 - 1st International Workshop on Requirements Engineering for Business Need and IT Alignment.;283-284;2;Volume 80, Number 3, March 2007;
2007;Peter Reynolds;Managing requirements for a US$1bn IT-based business transformation: New approaches and challenges.;285-293;9;Volume 80, Number 3, March 2007;
2007;Lana S. Al-Salem,Ala Abu-Samaha;Eliciting Web application requirements - an industrial case study.;294-313;20;Volume 80, Number 3, March 2007;
2007;Atsushi Kokune,Masuhiro Mizuno,Kyoichi Kadoya,Shuichiro Yamamoto;FBCM: Strategy modeling method for the validation of software requirements.;314-327;14;Volume 80, Number 3, March 2007;
2007;Johan F. Hoorn,Elly A. Konijn,Hans van Vliet,Gerrit C. van der Veer;"Requirements change: Fears dictate the must haves; desires the won't haves.";328-355;28;Volume 80, Number 3, March 2007;
2007;Patrick P. C. Lee,John C. S. Lui,David K. Y. Yau;SEAL: A secure communication library for building dynamic group key agreement applications.;356-370;15;Volume 80, Number 3, March 2007;
2007;Zhen He,Richard Lai,Alonso Marquez,Stephen Blackburn;Opportunistic prioritised clustering framework for improving OODBMS performance.;371-387;17;Volume 80, Number 3, March 2007;
2007;Zuhua Shao;Self-certified signature scheme from pairings.;388-395;8;Volume 80, Number 3, March 2007;
2007;Yongjing Lin,Youtao Zhang,Rajiv Gupta;The design and evaluation of path matching schemes on compressed control flow traces.;396-409;14;Volume 80, Number 3, March 2007;
2007;Yi-Hsuan Lee,Cheng Chen;An effective and efficient code generation algorithm for uniform loops on non-orthogonal DSP architecture.;410-428;19;Volume 80, Number 3, March 2007;
2007;Yuan-Yu Tsai,Chung-Ming Wang;A novel data hiding scheme for color images using a BSP tree.;429-437;9;Volume 80, Number 3, March 2007;
2007;Günter Haring,Carlos Juiz,Dorina C. Petriu;Editorial.;439-440;2;Volume 80, Number 4, April 2007;
2007;Alberto Avritzer,Andre B. Bondi,Elaine J. Weyuker;Ensuring system performance for cluster and single server systems.;441-454;14;Volume 80, Number 4, April 2007;
2007;Mauro Caporuscio,Antinisca Di Marco,Paola Inverardi;Model-based system reconfiguration for dynamic performance management.;455-473;19;Volume 80, Number 4, April 2007;
2007;Tauseef A. Israr,C. Murray Woodside,Greg Franks;Interaction tree algorithms to extract effective architecture and layered performance models from traces.;474-492;19;Volume 80, Number 4, April 2007;
2007;Vibhu Saujanya Sharma,Kishor S. Trivedi;Quantifying software performance, reliability and security: An architecture-based approach.;493-509;17;Volume 80, Number 4, April 2007;
2007;Tariq Omari,Greg Franks,C. Murray Woodside,Amy Pan;Efficient performance models for layered server systems with replicated servers and parallel behaviour.;510-527;18;Volume 80, Number 4, April 2007;
2007;Vincenzo Grassi,Raffaela Mirandola,Antonino Sabetta;Filling the gap between design and performance/reliability models of component-based systems: A model-driven approach.;528-558;31;Volume 80, Number 4, April 2007;
2007;Ching-Pao Chang,Chih-Ping Chu;Defect prevention in software processes: An action-based approach.;559-570;12;Volume 80, Number 4, April 2007;
2007;Pearl Brereton,Barbara A. Kitchenham,David Budgen,Mark Turner,Mohamed Khalil;Lessons from applying the systematic literature review process within the software engineering domain.;571-583;13;Volume 80, Number 4, April 2007;
2007;Pankaj Jalote,Rajesh Munshi,Todd A. Proebsting;The When-Who-How analysis of defects for improving the quality control process.;584-589;6;Volume 80, Number 4, April 2007;
2007;Letian Jiang,Guozhi Xu;Modeling and analysis of software aging and software failure.;590-595;6;Volume 80, Number 4, April 2007;
2007;Kwan-Sik Na,James T. Simpson,Xiaotong Li,Tushar Singh,Ki-Yoon Kim;Software development risk and project performance measurement: Evidence in Korea.;596-605;10;Volume 80, Number 4, April 2007;
2007;Yu-Shen Su,Chin-Yu Huang;Neural-network-based approaches for software reliability estimation using dynamic weighted combinational models.;606-615;10;Volume 80, Number 4, April 2007;
2007;Girish H. Subramanian,James J. Jiang,Gary Klein 0001;Software quality and IS project performance improvements from software development process maturity and IS implementation strategies.;616-627;12;Volume 80, Number 4, April 2007;
2007;Nan-Hsing Chiu,Sun-Jen Huang;The adjusted analogy-based software effort estimation based on similarity distances.;628-640;13;Volume 80, Number 4, April 2007;
2007;Ivica Crnkovic,George T. Heineman,Heinz W. Schmidt,Judith A. Stafford,Kurt C. Wallnau;Guest Editorial.;641-642;2;Volume 80, Number 5, May 2007;
2007;Fei Xie,Guowu Yang,Xiaoyu Song;Component-based hardware/software co-verification for building trustworthy embedded systems.;643-654;12;Volume 80, Number 5, May 2007;
2007;Mikael Åkerholm,Jan Carlson,Johan Fredriksson,Hans Hansson,John Håkansson,Anders Möller,Paul Pettersson,Massimo Tivoli;The SAVE approach to component-based development of vehicular systems.;655-667;13;Volume 80, Number 5, May 2007;
2007;Venkita Subramonian,Gan Deng,Christopher D. Gill,Jaiganesh Balasubramanian,Liang-Jui Shen,William Otte,Douglas C. Schmidt,Aniruddha S. Gokhale,Nanbor Wang;The design and performance of component middleware for QoS-enabled deployment and configuration of DRE systems.;668-677;10;Volume 80, Number 5, May 2007;
2007;Lars Grunske;Early quality prediction of component-based systems - A generic framework.;678-686;9;Volume 80, Number 5, May 2007;
2007;Ihor Kuz,Yan Liu,Ian Gorton,Gernot Heiser;CAmkES: A component model for secure microkernel-based embedded systems.;687-699;13;Volume 80, Number 5, May 2007;
2007;Mohammed Hussein,Mohammad Zulkernine;Intrusion detection aware component-based systems: A specification-based framework.;700-710;11;Volume 80, Number 5, May 2007;
2007;Jun-Hong Shen,Ye-In Chang;A skewed distributed indexing for skewed access patterns on the wireless broadcast.;711-723;13;Volume 80, Number 5, May 2007;
2007;Peng-Yeng Yin,Shiuh-Sheng Yu,Pei-Pei Wang,Yi-Te Wang;Task allocation for maximizing reliability of a distributed system using hybrid particle swarm optimization.;724-735;12;Volume 80, Number 5, May 2007;
2007;Nigamanth Sridhar;Serfs: Dynamically-bound parameterized components.;736-749;14;Volume 80, Number 5, May 2007;
2007;Aniello Castiglione,Alfredo De Santis,Claudio Soriente;Taking advantages of a disadvantage: Digital forensics and steganography using document metadata.;750-764;15;Volume 80, Number 5, May 2007;
2007;Nikolaos D. Tselikas,Nikolaos L. Dellas,Eleftherios Koutsoloukas,Sofia Kapellaki,George N. Prezerakos,Iakovos S. Venieris;"Distributed service provision using open APIs-based middleware: ""OSA/Parlay vs. JAIN"" performance evaluation study.";765-777;13;Volume 80, Number 5, May 2007;
2007;Hermes Senger,Eduardo R. Hruschka,Fabrício Alves Barbosa da Silva,Liria Matsumoto Sato,Calebe De Paula Bianchini,Bruno F. Jerosch;Exploiting idle cycles to execute data mining applications on clusters of PCs.;778-790;13;Volume 80, Number 5, May 2007;
2007;Shujun Li,Kwok-Tung Lo;Security problems with improper implementations of improved FEA-M.;791-794;4;Volume 80, Number 5, May 2007;
2007;Li Ma,Jeff Tian;Web error classification and analysis for reliability improvement.;795-804;10;Volume 80, Number 6, June 2007;
2007;Daniel R. Jeske,Qi Zhang;Assessing the validity of one-part software reliability models using likelihood ratio and early detection tests.;805-816;12;Volume 80, Number 6, June 2007;
2007;Avner Engel,Mark Last;Modeling software testing costs and risks using fuzzy logic paradigm.;817-835;19;Volume 80, Number 6, June 2007;
2007;Faheem Ahmed,Luiz Fernando Capretz,Shahbaz Ali Sheikh;Institutionalization of software product line: An empirical investigation of key organizational factors.;836-849;14;Volume 80, Number 6, June 2007;
2007;Christof Ebert;The impacts of software product management.;850-861;12;Volume 80, Number 6, June 2007;
2007;Otávio Augusto Lazzarini Lemos,Auri Marcelo Rizzo Vincenzi,José Carlos Maldonado,Paulo Cesar Masiero;Control and data flow structural testing criteria for aspect-oriented programs.;862-882;21;Volume 80, Number 6, June 2007;
2007;Mark Staples,Mahmood Niazi,D. Ross Jeffery,Alan Abrahams,Paul Byatt,Russell Murphy;An exploratory study of why organizations do not adopt CMMI.;883-895;13;Volume 80, Number 6, June 2007;
2007;Christopher Dabrowski,Kevin Mills,Stephen Quirolgico;Understanding failure response in service discovery systems.;896-917;22;Volume 80, Number 6, June 2007;
2007;Antony Tang,Yan Jin,Jun Han;A rationale-based architecture model for design traceability and reasoning.;918-934;17;Volume 80, Number 6, June 2007;
2007;Charles Cavanaugh,Frank Drews,Lonnie R. Welch;Guest Editor's introduction.;935-937;3;Volume 80, Number 7, July 2007;
2007;Xiaorui Wang,Yingming Chen,Chenyang Lu,Xenofon D. Koutsoukos;FC-ORB: A robust distributed real-time embedded middleware with end-to-end utilization control.;938-950;13;Volume 80, Number 7, July 2007;
2007;Peter van der Stok,Dmitri Jarnikov,Sergei Kozlov,Michael van Hartskamp,Johan J. Lukkien;Hierarchical resource allocation for robust in-home video streaming.;951-961;11;Volume 80, Number 7, July 2007;
2007;Huan Li,Krithi Ramamritham,Prashant J. Shenoy,Roderic A. Grupen,John Sweeney;Resource management for real-time tasks in mobile robotics.;962-971;10;Volume 80, Number 7, July 2007;
2007;Balakrishnan Dasarathy,Shrirang Gadgil,Ravichander Vaidyanathan,Arnie Neidhardt,Brian A. Coan,Kirthika Parmeswaran,Allen A. McIntosh,Frederick Porter;Adaptive network QoS in layer-3/layer-2 networks as a middleware service for mission-critical applications.;972-983;12;Volume 80, Number 7, July 2007;
2007;Patrick J. Lardieri,Jaiganesh Balasubramanian,Douglas C. Schmidt,Gautam H. Thaker,Aniruddha S. Gokhale,Thomas Damiano;A multi-layered resource management framework for dynamic resource management in enterprise DRE systems.;984-996;13;Volume 80, Number 7, July 2007;
2007;Tian He,John A. Stankovic,Michael Marley,Chenyang Lu,Ying Lu 0002,Tarek F. Abdelzaher,Sang Hyuk Son,Gang Tao;Feedback control-based dynamic resource management in distributed real-time systems.;997-1004;8;Volume 80, Number 7, July 2007;
2007;Dazhang Gu,Lonnie R. Welch,Frank Drews,Klaus Ecker;Characterizing robustness in dynamic real-time systems.;1005-1014;10;Volume 80, Number 7, July 2007;
