1995;Rolf Adams,Walter F. Tichy,Annette Weinert;Authors' Response.;http://doi.acm.org/10.1145/210134.210438;217-219;3;Volume 4, Number 2, April 1995 ;
1995;Stanley M. Sutton Jr.,Dennis Heimbigner,Leon J. Osterweil;APPL/A: A Language for Software Process Programming.;http://doi.acm.org/10.1145/214013.214017;221-286;66;Volume 4, Number 3, July 1995;
1995;H. Rebecca Callison;A Time-Sensitive Object Model for Real-Time Systems.;http://doi.acm.org/10.1145/214013.214021;287-317;31;Volume 4, Number 3, July 1995;
1995;Gregory D. Abowd,Robert J. Allen,David Garlan;Formalizing Style to Understand Descriptions of Software Architecture.;http://doi.acm.org/10.1145/226241.226244;319-364;46;Volume 4, Number 4, October 1995;
1995;Daniel Jackson;Structuring Z Specifications with Views;http://doi.acm.org/10.1145/226241.226249;365-389;25;Volume 4, Number 4, October 1995;
1994;Rolf Adams,Walter F. Tichy,Annette Weinert;The Cost of Selective Recompilation and Environment Processing.;http://doi.acm.org/10.1145/174634.174637;3-28;26;Volume 3, Number 1, January 1994 ;
1994;István Forgács;Double Iterative Framework for Flow-Sensitive Interprocedural Data Flow Analysis.;http://doi.acm.org/10.1145/174634.174635;29-55;27;Volume 3, Number 1, January 1994 ;
1994;Angelo Morzenti,Pierluigi San Pietro;Object-Oriented Logical Specification of Time-Critical Systems.;http://doi.acm.org/10.1145/174634.174636;56-98;43;Volume 3, Number 1, January 1994 ;
1994;Roong-Ko Doong,Phyllis G. Frankl;The ASTOOT Approach to Testing Object-Oriented Programs.;http://doi.acm.org/10.1145/192218.192221;101-130;30;Volume 3, Number 2, April 1994 ;
1994;Laura K. Dillon,George Kutty,Louise E. Moser,P. M. Melliar-Smith,Y. S. Ramakrishna;A Graphical Interval Logic for Specifying Concurrent Systems.;http://doi.acm.org/10.1145/192218.192226;131-165;35;Volume 3, Number 2, April 1994 ;
1994;Francesco Parisi-Presicce,Alfonso Pierantonio;An Algebraic Theory of Class Specification.;http://doi.acm.org/10.1145/192218.192235;166-199;34;Volume 3, Number 2, April 1994 ;
1994;Philip J. Bernhard;A Reduced Test Suite for Protocol Conformance Testing.;http://doi.acm.org/10.1145/196092.196088;201-220;20;Volume 3, Number 3, July 1994 ;
1994;Yoonsik Cheon,Gary T. Leavens;The Larch/Smalltalk Interface Specification Language.;http://doi.acm.org/10.1145/196092.195325;221-253;33;Volume 3, Number 3, July 1994 ;
1994;Bingchiang Jeng,Elaine J. Weyuker;A Simplified Domain-Testing Strategy.;http://doi.acm.org/10.1145/196092.193171;254-270;17;Volume 3, Number 3, July 1994 ;
1994;Christian Creveuil,Gruia-Catalin Roman;Formal Specification and Designof a Message Router.;http://doi.acm.org/10.1145/201024.201026;271-307;37;Volume 3, Number 4, October 1994 ;
1994;Miguel Felder,Angelo Morzenti;Validating Real-Time Systems by History-Checking TRIO Specifications.;http://doi.acm.org/10.1145/201024.201034;308-339;32;Volume 3, Number 4, October 1994 ;
1994;Sastry Duri,Ugo A. Buy,R. Devarapalli,Sol M. Shatz;Application and Experimental Evaluation of State Space Reduction Methods for Deadlock Analysis in Ada.;http://doi.acm.org/10.1145/201024.201038;340-380;41;Volume 3, Number 4, October 1994 ;
1993;Manfred Broy;Functional Specification of Time-Sensitive Communicating Systems.;http://doi.acm.org/10.1145/151299.151302;1-46;46;Volume 2, Number 1, January 1993 ;
1993;Gail E. Kaiser,Simon M. Kaplan;Parallel and Distributed Incremental Attribute Evaluation Algorithms for Multiuser Software Development Environments.;http://doi.acm.org/10.1145/151299.151312;47-92;46;Volume 2, Number 1, January 1993 ;
1993;James A. Whittaker,Jesse H. Poore;Markow Analysis of Software Specifications.;http://doi.acm.org/10.1145/151299.151326;93-106;14;Volume 2, Number 1, January 1993 ;
1993;Richard A. DeMillo,A. Jefferson Offutt;Experimental Results from an Automatic Test Case Generator.;http://doi.acm.org/10.1145/151257.151258;109-127;19;Volume 2, Number 2, April 1993 ;
1993;Yishai A. Feldman,Haim Schneider;Simulating Reactive Systems by Deduction.;http://doi.acm.org/10.1145/151257.151259;128-175;48;Volume 2, Number 2, April 1993 ;
1993;Paul Klint;A Meta-Environment for Generating Programming Environments.;http://doi.acm.org/10.1145/151257.151260;176-201;26;Volume 2, Number 2, April 1993 ;
1993;Paolo Ciancarini;Coordinating Rule-Based Software Processes with ESP.;http://doi.acm.org/10.1145/152388.152393;203-227;25;Volume 2, Number 3, July 1993 ;
1993;William G. Griswold,David Notkin;Automated Assistance for Program Restructuring.;http://doi.acm.org/10.1145/152388.152389;228-269;42;Volume 2, Number 3, July 1993 ;
1993;Mary Jean Harrold,Rajiv Gupta,Mary Lou Soffa;A Methodology for Controlling the Size of a Test Suite.;http://doi.acm.org/10.1145/152388.152391;270-285;16;Volume 2, Number 3, July 1993 ;
1993;Andy Podgurski,Lynn Pierce;Retrieving Reusable Software by Sampling Behaviour.;http://doi.acm.org/10.1145/152388.152392;286-303;18;Volume 2, Number 3, July 1993 ;
1993;Laura K. Dillon;A Visual Model for Ada Tasking.;http://doi.acm.org/10.1145/158431.158432;311-345;35;Volume 2, Number 4, October 1993 ;
1993;Farn Wang,Aloysius K. Mok,E. Allen Emerson;Distributed Real-Time System Specification and Verification in APTL.;http://doi.acm.org/10.1145/158431.158434;346-378;33;Volume 2, Number 4, October 1993 ;
1993;Pamela Zave,Michael Jackson;Conjunction as Composition.;http://doi.acm.org/10.1145/158431.158438;379-411;33;Volume 2, Number 4, October 1993 ;
1992;W. Richards Adrion;Editorial.;;1-4;4;Volume 1, Number 1, January 1992 ;
1992;A. Jefferson Offutt;Investigations of the Software Testing Coupling Effect.;http://doi.acm.org/10.1145/125489.125473;5-20;16;Volume 1, Number 1, January 1992 ;
1992;Kurt M. Olender,Leon J. Osterweil;Interprocedural Static Analysis of Sequencing Constraints.;http://doi.acm.org/10.1145/125489.122822;21-52;32;Volume 1, Number 1, January 1992 ;
1992;Victor R. Basili,Gianluigi Caldiera,Giovanni Cantone;A Reference Architecture for the Component Factory.;http://doi.acm.org/10.1145/125489.122823;53-80;28;Volume 1, Number 1, January 1992 ;
1992;Carmen J. Trammell,Leon H. Binder,Cathrine E. Snyder;The Automated Production Control Documentation System: A Case Study in Cleanroom Software Engineering.;http://doi.acm.org/10.1145/125489.122826;81-94;14;Volume 1, Number 1, January 1992 ;
1992;Robert A. Ballance,Susan L. Graham,Michael L. Van de Vanter;The Pan Language-Based Editing System.;http://doi.acm.org/10.1145/125489.122804;95-127;33;Volume 1, Number 1, January 1992 ;
1992;W. Richards Adrion;Editorial.;;133;1;Volume 1, Number 2, April 1992 ;
1992;Gregor Engels,Claus Lewerentz,Manfred Nagl,Wilhelm Schäfer,Andy Schürr;Building Integrated Software Development Environments Part I: Tool Specification.;http://doi.acm.org/10.1145/128894.128895;135-167;33;Volume 1, Number 2, April 1992 ;
1992;James D. Kiper;Structural Testing of Rule-Based Expert Systems.;http://doi.acm.org/10.1145/128894.128896;168-187;20;Volume 1, Number 2, April 1992 ;
1992;G. Michael Schneider,Johnny Martin,Wei-Tek Tsai;An Experimental Study of Fault Detection In User Requirements Documents.;http://doi.acm.org/10.1145/128894.128897;188-204;17;Volume 1, Number 2, April 1992 ;
1992;Eduardo Ostertag,James A. Hendler,Rubén Prieto Díaz,Christine Braun;Computing Similarity in a Reuse Library System: An AI-Based Approach.;http://doi.acm.org/10.1145/131736.131739;205-228;24;Volume 1, Number 3, July 1992 ;
1992;Kevin J. Sullivan,David Notkin;Reconciling Environment Integration and Software Evolution.;http://doi.acm.org/10.1145/131736.131744;229-268;40;Volume 1, Number 3, July 1992 ;
1992;Shmuel S. Tyszberowicz,Amiram Yehudai;OBSERV - A Prototyping Language and Environment.;http://doi.acm.org/10.1145/131736.131751;269-309;41;Volume 1, Number 3, July 1992 ;
1992;Wuu Yang,Susan Horwitz,Thomas W. Reps;A Program Integration Algorithm that Accommodates Semantics-Preserving Transformations.;http://doi.acm.org/10.1145/131736.131756;310-354;45;Volume 1, Number 3, July 1992 ;
1992;Don S. Batory,Sean W. O'Malley;The Design and Implementation of Hierarchical Software Systems with Reusable Components.;http://doi.acm.org/10.1145/136586.136587;355-398;44;Volume 1, Number 4, October 1992 ;
1992;David Harel,Chaim-Arie Kahana;On Statecharts with Overlapping.;http://doi.acm.org/10.1145/136586.136589;399-421;23;Volume 1, Number 4, October 1992 ;
1992;Steven J. Zeil,Faten H. Afifi,Lee J. White;Detection of Linear Errors via Domain Testing.;http://doi.acm.org/10.1145/136586.136590;422-451;30;Volume 1, Number 4, October 1992 ;
