2005;Vincenzo Gervasi,Didar Zowghi;Reasoning about inconsistencies in natural language requirements.;http://doi.acm.org/10.1145/1072997.1072999;277-330;54;Volume 14, Number 3, July 2005;
2005;Paul Klint,Ralf Lämmel,Chris Verhoef;Toward an engineering discipline for grammarware.;http://doi.acm.org/10.1145/1072997.1073000;331-380;50;Volume 14, Number 3, July 2005;
2005;Leon J. Osterweil,Carlo Ghezzi,Jeff Kramer,Alexander L. Wolf;Editorial.;http://doi.acm.org/10.1145/1101815.1101816;381-382;2;Volume 14, Number 4, October 2005;
2005;Jacky Estublier,David B. Leblang,André van der Hoek,Reidar Conradi,Geoffrey Clemm,Walter F. Tichy,Darcy Wiborg Weber;Impact of software engineering research on the practice of software configuration management.;http://doi.acm.org/10.1145/1101815.1101817;383-430;48;Volume 14, Number 4, October 2005;
2005;Barbara G. Ryder,Mary Lou Soffa,Margaret M. Burnett;The impact of software engineering research on modern programming languages.;http://doi.acm.org/10.1145/1101815.1101818;431-477;47;Volume 14, Number 4, October 2005;
2005;Marcelo F. Frias,Carlos López Pombo,Gabriel A. Baum,Nazareno Aguirre,T. S. E. Maibaum;Reasoning about static and dynamic properties in alloy: A purely relational approach.;http://doi.acm.org/10.1145/1101815.1101819;478-526;49;Volume 14, Number 4, October 2005;
2004;Pamela Zave;Address translation in telecommunication features.;http://doi.acm.org/10.1145/1005561.1005562;1-36;36;Volume 13, Number 1, January 2004;
2004;Sebastián Uchitel,Jeff Kramer,Jeff Magee;Incremental elaboration of scenario-based specifications and behavior models using implied scenarios.;http://doi.acm.org/10.1145/1005561.1005563;37-85;49;Volume 13, Number 1, January 2004;
2004;Nalini Venkatasubramanian,Carolyn L. Talcott,Gul Agha;A formal model for reasoning about adaptive QoS-enabled middleware.;http://doi.acm.org/10.1145/1005561.1005564;86-147;62;Volume 13, Number 1, January 2004;
2004;Tankut Akgul,Vincent John Mooney III;Assembly instruction level reverse execution for debugging.;http://doi.acm.org/10.1145/1018210.1018211;149-198;50;Volume 13, Number 2, April 2004;
2004;Alessandro Orso,Saurabh Sinha,Mary Jean Harrold;Classifying data dependences in the presence of pointers for program comprehension, testing, and debugging.;http://doi.acm.org/10.1145/1018210.1018212;199-239;41;Volume 13, Number 2, April 2004;
2004;Roshanak Roshandel,André van der Hoek,Marija Mikic-Rakic,Nenad Medvidovic;Mae - a system model and environment for managing architectural evolution.;http://doi.acm.org/10.1145/1018210.1018213;240-276;37;Volume 13, Number 2, April 2004;
2004;Gregg Rothermel,Sebastian G. Elbaum,Alexey G. Malishevsky,Praveen Kallakuri,Xuemei Qiu;On test suite composition and cost-effective regression testing.;http://doi.acm.org/10.1145/1027092.1027093;277-331;55;Volume 13, Number 3, July 2004;
2004;Stefan Kramer 0001,Hermann Kaindl;Coupling and cohesion metrics for knowledge-based systems using frames and rules.;http://doi.acm.org/10.1145/1027092.1027094;332-358;27;Volume 13, Number 3, July 2004;
2004;Matthew B. Dwyer,Lori A. Clarke,Jamieson M. Cobleigh,Gleb Naumovich;Flow analysis for verifying properties of concurrent software systems.;http://doi.acm.org/10.1145/1040291.1040292;359-430;72;Volume 13, Number 4, October 2004;
2004;Gennaro Costagliola,Vincenzo Deufemia,Giuseppe Polese;A framework for modeling and implementing visual notations with applications to software engineering.;http://doi.acm.org/10.1145/1040291.1040293;431-487;57;Volume 13, Number 4, October 2004;
2003;Carlo Ghezzi,Jeff Magee,H. Dieter Rombach,Mary Lou Soffa;Editorial.;http://doi.acm.org/10.1145/839268.839269;1-2;2;Volume 12, Number 1, January 2003;
2003;Amy P. Felty,Kedar S. Namjoshi;Feature specification and automated conflict detection.;http://doi.acm.org/10.1145/839268.839270;3-27;25;Volume 12, Number 1, January 2003;
2003;Christian Nentwich,Wolfgang Emmerich,Anthony Finkelstein,Ernst Ellmer;Flexible consistency checking.;http://doi.acm.org/10.1145/839268.839271;28-63;36;Volume 12, Number 1, January 2003;
2003;Antónia Lopes,Michel Wermelinger,José Luiz Fiadeiro;High-order architectural connectors.;http://doi.acm.org/10.1145/839268.839272;64-104;41;Volume 12, Number 1, January 2003;
2003;;Reviewers 2002.;http://doi.acm.org/10.1145/839268.839273;105;1;Volume 12, Number 1, January 2003;
2003;Alberto Coen-Porisini,Matteo Pradella,Matteo Rossi,Dino Mandrioli;A formal approach for designing CORBA-based applications.;http://doi.acm.org/10.1145/941566.941567;107-151;45;Volume 12, Number 2, April 2003;
2003;Mark van den Brand,Paul Klint,Jurgen J. Vinju;Term rewriting with traversal functions.;http://doi.acm.org/10.1145/941566.941568;152-190;39;Volume 12, Number 2, April 2003;
2003;Martin P. Robillard,Gail C. Murphy;Static analysis to support the evolution of exception structure in object-oriented systems.;http://doi.acm.org/10.1145/941566.941569;191-221;31;Volume 12, Number 2, April 2003;
2003;Luca Durante,Riccardo Sisto,Adriano Valenzano;Automatic testing equivalence verification of spi calculus specifications.;http://doi.acm.org/10.1145/941566.941570;222-284;63;Volume 12, Number 2, April 2003;
2003;Yossi Cohen,Yishai A. Feldman;Automatic high-quality reengineering of database programs by abstraction, transformation and reimplementation.;http://doi.acm.org/10.1145/958961.958962;285-316;32;Volume 12, Number 3, July 2003;
2003;Franco Zambonelli,Nicholas R. Jennings,Michael Wooldridge;Developing multiagent systems: The Gaia methodology.;http://doi.acm.org/10.1145/958961.958963;317-370;54;Volume 12, Number 3, July 2003;
2003;Marsha Chechik,Benet Devereux,Steve M. Easterbrook,Arie Gurfinkel;Multi-valued symbolic model-checking.;http://doi.acm.org/10.1145/990010.990011;371-408;38;Volume 12, Number 4, October 2003;
2003;Tim Miller,Paul A. Strooper;A framework and tool support for the systematic testing of model-based specifications.;http://doi.acm.org/10.1145/990010.990012;409-439;31;Volume 12, Number 4, October 2003;
2003;Gian Luigi Ferrari,Stefania Gnesi,Ugo Montanari,Marco Pistore;A model-checking verification environment for mobile processes.;http://doi.acm.org/10.1145/990010.990013;440-473;34;Volume 12, Number 4, October 2003;
2002;Nenad Medvidovic,David S. Rosenblum,David F. Redmiles,Jason E. Robbins;Modeling software architectures in the Unified Modeling Language.;http://doi.acm.org/10.1145/504087.504088;2-57;56;Volume 11, Number 1, January 2002;
2002;Tatsuhiro Tsuchiya,Tohru Kikuno;On fault classes and error detection capability of specification-based testing.;http://doi.acm.org/10.1145/504087.504089;58-62;5;Volume 11, Number 1, January 2002;
2002;Idit Keidar,Roger Khazan,Nancy A. Lynch,Alexander A. Shvartsman;An inheritance-based technique for building simulation proofs incrementally.;http://doi.acm.org/10.1145/504087.504090;63-91;29;Volume 11, Number 1, January 2002;
2002;Michael Schrefl,Markus Stumptner;Behavior-consistent specialization of object life cycles.;http://doi.acm.org/10.1145/504087.504091;92-148;57;Volume 11, Number 1, January 2002;
2002;Miguel Felder,Mauro Pezzè;A formal design notation for real-time systems.;http://doi.acm.org/10.1145/505145.505146;149-190;42;Volume 11, Number 2, April 2002;
2002;Don S. Batory,Clay Johnson,Bob MacDonald,Dale von Heeder;Achieving extensibility through product-lines and domain-specific languages: a case study.;http://doi.acm.org/10.1145/505145.505147;191-214;24;Volume 11, Number 2, April 2002;
2002;Yannis Smaragdakis,Don S. Batory;Mixin layers: an object-oriented implementation technique for refinements and collaboration-based designs.;http://doi.acm.org/10.1145/505145.505148;215-255;41;Volume 11, Number 2, April 2002;
2002;Daniel Jackson;Alloy: a lightweight object modelling notation.;http://doi.acm.org/10.1145/505145.505149;256-290;35;Volume 11, Number 2, April 2002;
2002;Alexander P. Pons;Temporal abstract classes and virtual temporal specifications for real-time systems.;http://doi.acm.org/10.1145/567793.567794;291-308;18;Volume 11, Number 3, July 2002;
2002;Audris Mockus,Roy T. Fielding,James D. Herbsleb;Two case studies of open source software development: Apache and Mozilla.;http://doi.acm.org/10.1145/567793.567795;309-346;38;Volume 11, Number 3, July 2002;
2002;Donglin Liang,Mary Jean Harrold;Equivalence analysis and its application in improving the efficiency of program slicing.;http://doi.acm.org/10.1145/567793.567796;347-383;37;Volume 11, Number 3, July 2002;
2002;;Obituary.;http://doi.acm.org/10.1145/606612.606613;385;1;Volume 11, Number 4, October 2002;
2002;Marco Bernardo,Paolo Ciancarini,Lorenzo Donatiello;Architecting families of software systems with process algebras.;http://doi.acm.org/10.1145/606612.606614;386-426;41;Volume 11, Number 4, October 2002;
2002;Robert M. Hierons;Comparing test sets and criteria in the presence of test hypotheses and fault domains.;http://doi.acm.org/10.1145/606612.606615;427-448;22;Volume 11, Number 4, October 2002;
2002;Alexander Egyed;Automated abstraction of class diagrams.;http://doi.acm.org/10.1145/606612.606616;449-491;43;Volume 11, Number 4, October 2002;
2001;Frank Tip,T. B. Dinesh;A slicing-based approach for locating type errors.;http://doi.acm.org/10.1145/366378.366379;5-55;51;Volume 10, Number 1, January 2001;
2001;Huo Yan Chen,T. H. Tse,Tsong Yueh Chen;TACCLE: a methodology for object-oriented software testing at the class and cluster levels.;http://doi.acm.org/10.1145/366378.366380;56-109;54;Volume 10, Number 1, January 2001;
2001;Gregg Rothermel,Margaret M. Burnett,Lixin Li,Christopher DuPuis,Andrei Sheretov;A methodology for testing spreadsheets.;http://doi.acm.org/10.1145/366378.366385;110-147;38;Volume 10, Number 1, January 2001;
2001;John Bible,Gregg Rothermel,David S. Rosenblum;A comparative study of coarse- and fine-grained safe regression test-selection techniques.;http://doi.acm.org/10.1145/367008.367015;149-183;35;Volume 10, Number 2, April 2001;
2001;Todd L. Graves,Mary Jean Harrold,Jung-Min Kim,Adam A. Porter,Gregg Rothermel;An empirical study of regression test selection techiques.;http://doi.acm.org/10.1145/367008.367020;184-208;25;Volume 10, Number 2, April 2001;
2001;Saurabh Sinha,Mary Jean Harrold,Gregg Rothermel;Interprocedural control dependence.;http://doi.acm.org/10.1145/367008.367022;209-254;46;Volume 10, Number 2, April 2001;
2001;Angelo Gargantini,Angelo Morzenti;Automated deductive requirements analysis of critical systems.;http://doi.acm.org/10.1145/383876.383877;255-307;53;Volume 10, Number 3, July 2001;
2001;Dewayne E. Perry,Harvey P. Siy,Lawrence G. Votta;Parallel changes in large-scale software development: an observational case study.;http://doi.acm.org/10.1145/383876.383878;308-337;30;Volume 10, Number 3, July 2001;
2001;Gian Pietro Picco,Gruia-Catalin Roman,Peter J. McCann;Reasoning about code mobility with mobile UNITY.;http://doi.acm.org/10.1145/383876.383879;338-395;58;Volume 10, Number 3, July 2001;
2001;Jean-René Beauvais,Éric Rutten,Thierry Gautier,Roland Houdebine,Paul Le Guernic,Y.-M. Tang;Modeling statecharts and activitycharts as signal equations.;http://doi.acm.org/10.1145/384189.384191;397-451;55;Volume 10, Number 4, October 2001;
2001;Angela Bonifati,Fabiano Cattaneo,Stefano Ceri,Alfonso Fuggetta,Stefano Paraboschi;Designing data marts for data warehouses.;http://doi.acm.org/10.1145/384189.384190;452-483;32;Volume 10, Number 4, October 2001;
2000;Tevfik Bultan,Richard Gerber,Christopher League;Composite model-checking: verification with type-specific symbolic representations.;http://doi.acm.org/10.1145/332740.332746;3-50;48;Volume 9, Number 1, January 2000;
2000;James C. Corbett;Using shape analysis to reduce finite-state models of concurrent Java programs.;http://doi.acm.org/10.1145/332740.332741;51-93;43;Volume 9, Number 1, January 2000;
2000;Carl A. Gunter;Abstracting dependencies between software configuration items.;http://doi.acm.org/10.1145/332740.332743;94-131;38;Volume 9, Number 1, January 2000;
2000;A. Prasad Sistla,Viktor Gyuris,E. Allen Emerson;SMC: a symmetry-based model checker for verification of safety and liveness properties.;http://doi.acm.org/10.1145/350887.350891;133-166;34;Volume 9, Number 2, April 2000;
2000;Paolo Ciancarini,Francesco Franzé,Cecilia Mascolo;Using a coordination language to specify and analyze systems containing mobile components.;http://doi.acm.org/10.1145/350887.350893;167-198;32;Volume 9, Number 2, April 2000;
2000;Panagiotis Louridas,Pericles Loucopoulos;A generic model for reflective design.;http://doi.acm.org/10.1145/350887.350895;199-237;39;Volume 9, Number 2, April 2000;
2000;Paola Inverardi,Alexander L. Wolf,Daniel Yankelevich;Static checking of system behaviors using derived component assumptions.;http://doi.acm.org/10.1145/352591.352593;239-272;34;Volume 9, Number 3, July 2000;
2000;Naftaly H. Minsky,Victoria Ungureanu;Law-governed interaction: a coordination and control mechanism for heterogeneous distributed systems.;http://doi.acm.org/10.1145/352591.352592;273-305;33;Volume 9, Number 3, July 2000;
2000;Kevin L. Mills,Hassan Gomaa;A knowledge-based method for inferring semantic concepts from visual models of system behavior.;http://doi.acm.org/10.1145/352591.352594;306-337;32;Volume 9, Number 3, July 2000;
2000;Dan S. Wallach,Andrew W. Appel,Edward W. Felten;SAFKASI: a security mechanism for language-based systems.;http://doi.acm.org/10.1145/363516.363520;341-378;38;Volume 9, Number 4, October 2000;
2000;Philip W. L. Fong,Robert D. Cameron;Proof linking: modular verification of mobile programs in the presence of lazy, dynamic linking.;http://doi.acm.org/10.1145/363516.363523;379-409;31;Volume 9, Number 4, October 2000;
2000;Andrew C. Myers,Barbara Liskov;Protecting privacy using the decentralized label model.;http://doi.acm.org/10.1145/363516.363526;410-442;33;Volume 9, Number 4, October 2000;
2000;Edmund M. Clarke,Somesh Jha,Wilfredo R. Marrero;Verifying security protocols with Brutus.;http://doi.acm.org/10.1145/363516.363528;443-487;45;Volume 9, Number 4, October 2000;
2000;Antonio Durante,Riccardo Focardi,Roberto Gorrieri;A compiler for analyzing cryptographic protocols using noninterference.;http://doi.acm.org/10.1145/363516.363532;488-528;41;Volume 9, Number 4, October 2000;
1999;Jonathan S. Ostroff;Composition and Refinement of Discrte Real-Time Systems.;http://doi.acm.org/10.1145/295558.295560;1-48;48;Volume 8, Number 1, January 1999;
1999;Shing-Chi Cheung,Jeff Kramer;Checking Safety Properties Using Compositional Reachability Analysis.;http://doi.acm.org/10.1145/295558.295570;49-78;30;Volume 8, Number 1, January 1999;
1999;Emanuele Ciapessoni,Piergiorgio Mirandola,Alberto Coen-Porisini,Dino Mandrioli,Angelo Morzenti;From Formal Models to Formally Based Methods: An Industrial Experience.;http://doi.acm.org/10.1145/295558.295566;79-113;35;Volume 8, Number 1, January 1999;
1999;Peter J. McCann,Gruia-Catalin Roman;Modeling Mobile IP in Mobile UNITY.;http://doi.acm.org/10.1145/304399.304400;115-146;32;Volume 8, Number 2, April 1999;
1999;Jonathan E. Cook,Alexander L. Wolf;Software Process Validation: Quantitatively Measuring the Correspondence of a Process to a Model.;http://doi.acm.org/10.1145/304399.304401;147-176;30;Volume 8, Number 2, April 1999;
1999;Premkumar T. Devanbu;GENOA - A Customizable, Front-end-Retargetable Source Code Analysis Framework.;http://doi.acm.org/10.1145/304399.304402;177-212;36;Volume 8, Number 2, April 1999;
1999;Ernesto Damiani,Maria Grazia Fugini,Carlo Bellettini;A Hierarchy-aware Approach to Faceted Classification of Objected-Oriented Components.;http://doi.acm.org/10.1145/310663.310665;215-262;48;Volume 8, Number 3, July 1999;
1999;Andy Podgurski,Wassim Masri,Yolanda McCleese,Francis G. Wolff,Charles Yang;Estimation of Software Reliability by Stratified Sampling.;http://doi.acm.org/10.1145/310663.310667;263-283;21;Volume 8, Number 3, July 1999;
1999;Jean-Marc Jézéquel;Reifying Variants in Configuration Management.;http://doi.acm.org/10.1145/310663.310668;284-295;12;Volume 8, Number 3, July 1999;
1999;Steven P. Reiss;The Desert environment.;http://doi.acm.org/10.1145/322993.322994;297-342;46;Volume 8, Number 4, October 1999;
1999;Klaus Pohl,Klaus Weidenhaupt,Ralf Dömges,Peter Haumer,Matthias Jarke,Ralf Klamma;PRIME - Toward process-integrated modeling environments: 1.;http://doi.acm.org/10.1145/322993.322995;343-410;68;Volume 8, Number 4, October 1999;
1999;D. Richard Kuhn;Fault classes and error detection capability of specification-based testing.;http://doi.acm.org/10.1145/322993.322996;411-424;14;Volume 8, Number 4, October 1999;
1999;Ernesto Damiani,Maria Grazia Fugini,Carlo Bellettini;Corrigenda: a hierarchy-aware approach to faceted classification of object-oriented components.;http://doi.acm.org/10.1145/322993.322997;425-472;48;Volume 8, Number 4, October 1999;
1998;John C. Doppke,Dennis Heimbigner,Alexander L. Wolf;Software Process Modeling and Execution Within Virtual Environments.;http://doi.acm.org/10.1145/268411.268415;1-40;40;Volume 7, Number 1, January 1998;
1998;Adam A. Porter,Harvey P. Siy,Audris Mockus,Lawrence G. Votta;Understanding the Sources of Variation in Software Inspections.;http://doi.acm.org/10.1145/268411.268421;41-79;39;Volume 7, Number 1, January 1998;
1998;Luciano Baresi,Mauro Pezzè;Toward Formalizing Structured Analysis.;http://doi.acm.org/10.1145/268411.268429;80-107;28;Volume 7, Number 1, January 1998;
1998;Robert W. Bowdidge,William G. Griswold;Supporting the Restructuring of Data Abstractions Through Manipulation of a Program Visualization.;http://doi.acm.org/10.1145/279310.279312;109-157;49;Volume 7, Number 2, April 1998;
1998;Gail C. Murphy,David Notkin,William G. Griswold,Erica S.-C. Lan;An Empirical Study of Static Call Graph Extractors.;http://doi.acm.org/10.1145/279310.279314;158-191;34;Volume 7, Number 2, April 1998;
1998;James J. Hunt,Kiem-Phong Vo,Walter F. Tichy;Delta Algorithms: An Empirical Analysis.;http://doi.acm.org/10.1145/279310.279321;192-214;23;Volume 7, Number 2, April 1998;
1998;Jonathan E. Cook,Alexander L. Wolf;Discovering Models of Software Processes from Event-Based Data.;http://doi.acm.org/10.1145/287000.287001;215-249;35;Volume 7, Number 3, July 1998;
1998;Huo Yan Chen,T. H. Tse,F. T. Chan,Tsong Yueh Chen;In Black and White: An Integrated Approach to Class-Level Testing of Object-Oriented Programs.;http://doi.acm.org/10.1145/287000.287004;250-295;46;Volume 7, Number 3, July 1998;
1998;Judith Crow,Ben L. Di Vito;Formalizing Space Shuttle Software Requirements: Four Case Studies.;http://doi.acm.org/10.1145/287000.287023;296-332;37;Volume 7, Number 3, July 1998;
1998;Robert Allen,David Garlan;Errata: A Formal Basis for Architectural Connection.;http://doi.acm.org/10.1145/287000.287031;333-334;2;Volume 7, Number 3, July 1998;
1998;Anthony Hunter,Bashar Nuseibeh;Managing Inconsistent Specifications: Reasoning, Analysis, and Action.;http://doi.acm.org/10.1145/292182.292187;335-367;33;Volume 7, Number 4, October 1998;
1998;Maria Letizia Jaccheri,Gian Pietro Picco,Patricia Lago;Eliciting software Process Models with the ;http://doi.acm.org/10.1145/292182.292194;368-410;43;Volume 7, Number 4, October 1998;
1998;Alfonso Fuggetta,Luigi Lavazza,Sandro Morasca,Stefano Cinti,Giandomenico Oldano,Elena Orazi;Applying GQM in an Industrial Software Factory.;http://doi.acm.org/10.1145/292182.292197;411-448;38;Volume 7, Number 4, October 1998;
1998;James J. Hunt,Walter F. Tichy;"Addendum to ""Delta Algorithms: An Empirical Analysis"".";http://doi.acm.org/10.1145/292182.292200;449;1;Volume 7, Number 4, October 1998;
1997;Pamela Zave,Michael Jackson;Four Dark Corners of Requirements Engineering.;http://doi.acm.org/10.1145/237432.237434;1-30;30;Volume 6, Number 1, January 1997;
1997;Louise E. Moser,Y. S. Ramakrishna,George Kutty,P. M. Melliar-Smith,Laura K. Dillon;A Graphical Environment for the Design of Concurrent Real-Time Systems.;http://doi.acm.org/10.1145/237432.237438;31-79;49;Volume 6, Number 1, January 1997;
1997;Laura K. Dillon;Task Dependence and Termination in Ada.;http://doi.acm.org/10.1145/237432.237459;80-110;31;Volume 6, Number 1, January 1997;
1997;Scott Henninger;An Evolutionary Approach to Constructing Effective Software Reuse Repositories.;http://doi.acm.org/10.1145/248233.248242;111-140;30;Volume 6, Number 2, April 1997;
1997;Premkumar T. Devanbu,Mark A. Jones;The Use of Description Logics in KBSE Systems.;http://doi.acm.org/10.1145/248233.248253;141-172;32;Volume 6, Number 2, April 1997;
1997;Gregg Rothermel,Mary Jean Harrold;A Safe, Efficient Regression Test Selection Technique.;http://doi.acm.org/10.1145/248233.248262;173-210;38;Volume 6, Number 2, April 1997;
1997;Robert Allen,David Garlan;A Formal Basis for Architectural Connection.;http://doi.acm.org/10.1145/258077.258078;213-249;37;Volume 6, Number 3, July 1997;
1997;Gruia-Catalin Roman,Peter J. McCann,Jerome Y. Plun;Mobile UNITY: Reasoning and Specification in Mobile Computing.;http://doi.acm.org/10.1145/258077.258079;250-282;33;Volume 6, Number 3, July 1997;
1997;Vincenzo Ambriola,Reidar Conradi,Alfonso Fuggetta;Assessing Process-Centered Software Engineering Environments.;http://doi.acm.org/10.1145/258077.258080;283-328;46;Volume 6, Number 3, July 1997;
1997;Alexandre Petrenko;"Technical Correspondence Comments on ""A Reduced Test Suite for Protocol Conformance Testing"".";http://doi.acm.org/10.1145/258077.265733;329-331;3;Volume 6, Number 3, July 1997;
1997;Amy Moormann Zaremski,Jeannette M. Wing;Specification Matching of Software Components.;http://doi.acm.org/10.1145/261640.261641;333-369;37;Volume 6, Number 4, October 1997;
1997;Rajiv Gupta,Mary Lou Soffa,John Howard;Hybrid Slicing: Integrating Dynamic Information with Static Analysis.;http://doi.acm.org/10.1145/261640.261644;370-397;28;Volume 6, Number 4, October 1997;
1997;Andreas Zeller,Gregor Snelting;Unified Versioning Through Feature Logic.;http://doi.acm.org/10.1145/261640.261654;398-441;44;Volume 6, Number 4, October 1997;
1996;Mark van den Brand,Eelco Visser;Generation of Formatters for Context-Free Languages.;http://doi.acm.org/10.1145/226155.226156;1-41;41;Volume 5, Number 1, January 1996;
1996;Premkumar T. Devanbu,David S. Rosenblum,Alexander L. Wolf;Generating Testing and Analysis Tools with Aria.;http://doi.acm.org/10.1145/226155.226157;42-62;21;Volume 5, Number 1, January 1996;
1996;Roger Ferguson,Bogdan Korel;The Chaining Approach for Software Test Data Generation.;http://doi.acm.org/10.1145/226155.226158;63-86;24;Volume 5, Number 1, January 1996;
1996;Elaine J. Weyuker;Using Failure Cost Information for Testing and Reliability Assessment.;http://doi.acm.org/10.1145/227607.227608;87-98;12;Volume 5, Number 2, April 1996;
1996;A. Jefferson Offutt,Ammei Lee,Gregg Rothermel,Roland H. Untch,Christian Zapf;An Experimental Determination of Sufficient Mutant Operators.;http://doi.acm.org/10.1145/227607.227610;99-118;20;Volume 5, Number 2, April 1996;
1996;Francesco Bergadano,Daniele Gunetti;Testing by Means of Inductive Program Learning.;http://doi.acm.org/10.1145/227607.227611;119-145;27;Volume 5, Number 2, April 1996;
1996;Gregor Snelting;Reengineering of Configurations Based on Mathematical Concept Analysis.;http://doi.acm.org/10.1145/227607.227613;146-189;44;Volume 5, Number 2, April 1996;
1996;Gianpaolo Cugola,Elisabetta Di Nitto,Alfonso Fuggetta,Carlo Ghezzi;A Framework for Formalizing Inconsistencies and Deviations in Human-Centered Systems.;http://doi.acm.org/10.1145/234426.234427;191-230;40;Volume 5, Number 3, July 1996;
1996;Constance L. Heitmeyer,Ralph D. Jeffords,Bruce G. Labaw;Automated Consistency Checking of Requirements Specifications.;http://doi.acm.org/10.1145/234426.234431;231-261;31;Volume 5, Number 3, July 1996;
1996;Gail C. Murphy,David Notkin;Lightweight Lexical Source Model Extraction.;http://doi.acm.org/10.1145/234426.234441;262-292;31;Volume 5, Number 3, July 1996;
1996;David Harel,Amnon Naamad;The STATEMATE Semantics of Statecharts.;http://doi.acm.org/10.1145/235321.235322;293-333;41;Volume 5, Number 4, October 1996;
1996;Shing-Chi Cheung,Jeff Kramer;Context Constraints for Compositional Reachability Analysis.;http://doi.acm.org/10.1145/235321.235323;334-377;44;Volume 5, Number 4, October 1996;
1996;Daniel J. Barrett,Lori A. Clarke,Peri L. Tarr,Alexander E. Wise;A Framework for Event-Based Software Integration.;http://doi.acm.org/10.1145/235321.235324;378-421;44;Volume 5, Number 4, October 1996;
1995;David Binkley,Susan Horwitz,Thomas W. Reps;Program Integration for Languages with Procedure Calls.;http://doi.acm.org/10.1145/201055.201056;3-35;33;Volume 4, Number 1, January 1995 ;
1995;William E. Howden,Yudong Huang;Software Trustability Analysis.;http://doi.acm.org/10.1145/201055.201058;36-64;29;Volume 4, Number 1, January 1995 ;
1995;Michal Young,Richard N. Taylor,David L. Levine,Kari A. Nies,Debra Brodbeck;A Concurrency Analysis Tool Suite for Ada Programs: Rational, Design, and Preliminary Experience.;http://doi.acm.org/10.1145/201055.201080;65-106;42;Volume 4, Number 1, January 1995 ;
1995;Daniel Jackson;Aspect: Detecting Bugs with Abstract Dependences.;http://doi.acm.org/10.1145/210134.210135;109-145;37;Volume 4, Number 2, April 1995 ;
1995;Amy Moormann Zaremski,Jeannette M. Wing;Signature Matching: A Tool for Using Software Libraries.;http://doi.acm.org/10.1145/210134.210179;146-170;25;Volume 4, Number 2, April 1995 ;
1995;Mauro Pezzè,Richard N. Taylor,Michal Young;Graph Models for Reachability of Concurrent Programs.;http://doi.acm.org/10.1145/210134.210180;171-213;43;Volume 4, Number 2, April 1995 ;
1995;Bevin R. Brett;"Comments on ""The Cost of Selective Recompilation and Environment Processing"".";http://doi.acm.org/10.1145/210134.210435;214-215;2;Volume 4, Number 2, April 1995 ;
